state,lga_code,lga_name,ward_code,ward_name,pu_code,pu_name
OSUN,01,ATAKUMOSA EAST,01,Iwara,001,TOWN HALL IWARA
OSUN,01,ATAKUMOSA EAST,01,Iwara,002,"UNITY PRY. SCHOOL, IWARA"
OSUN,01,ATAKUMOSA EAST,01,Iwara,003,"L.A. SCHOOL, IWIKUN"
OSUN,01,ATAKUMOSA EAST,01,Iwara,004,"METHODIST PRY. SCHOOL, AYETORO"
OSUN,01,ATAKUMOSA EAST,01,Iwara,005,"L.A. PRY. SCHOOL, AJEBANDELE ASUKU"
OSUN,01,ATAKUMOSA EAST,01,Iwara,006,OPEN SPACE IYINTA
OSUN,01,ATAKUMOSA EAST,01,Iwara,007,OPEN SPACE ODO-IWARA
OSUN,01,ATAKUMOSA EAST,02,Igangan,001,"N.U.D PRY. SCHOL, IGANGAN"
OSUN,01,ATAKUMOSA EAST,02,Igangan,002,"ST. BARTH SCHOOL, IGANGAN"
OSUN,01,ATAKUMOSA EAST,02,Igangan,003,"APOSTOLIC PRY. SCHOOL, OKO-AGO"
OSUN,01,ATAKUMOSA EAST,02,Igangan,004,"ST. LUKE'S SCHOOL, OWODE"
OSUN,01,ATAKUMOSA EAST,02,Igangan,005,OPEN SPACE AJUMOBI
OSUN,01,ATAKUMOSA EAST,02,Igangan,006,OPEN SPACE SAJUKU
OSUN,01,ATAKUMOSA EAST,03,Ipole,001,"TOWN HALL, IPOLE"
OSUN,01,ATAKUMOSA EAST,03,Ipole,002,TOWN HALL ODO IJESA
OSUN,01,ATAKUMOSA EAST,03,Ipole,003,ST. ANDREW ISE-IJESA
OSUN,01,ATAKUMOSA EAST,03,Ipole,004,"L.A. SCHOOL, IMOGBARA"
OSUN,01,ATAKUMOSA EAST,03,Ipole,005,OPEN SPACE IROGBO/IJEMBA
OSUN,01,ATAKUMOSA EAST,03,Ipole,006,"ST. JOHN PRY. SCHOOL, IDADO"
OSUN,01,ATAKUMOSA EAST,04,Iperindo,001,TOWN HALL IPERINDO I
OSUN,01,ATAKUMOSA EAST,04,Iperindo,002,TOWN HALL IPERINDO II
OSUN,01,ATAKUMOSA EAST,04,Iperindo,003,"TEMIDIRE GRAMMAR SCHOOL, IPERINDO"
OSUN,01,ATAKUMOSA EAST,04,Iperindo,004,MATT. CENT AGO ISEGUN
OSUN,01,ATAKUMOSA EAST,04,Iperindo,005,"COMM. PRY. SCHOOL, OKE EGUN"
OSUN,01,ATAKUMOSA EAST,04,Iperindo,006,"COMM. PRY. SCHOOL, KAJOLA"
OSUN,01,ATAKUMOSA EAST,04,Iperindo,007,"CENT. PRY. SCHOOL, AASA"
OSUN,01,ATAKUMOSA EAST,04,Iperindo,008,OPEN SPACE AYENI/TEMIDIRE
OSUN,01,ATAKUMOSA EAST,05,Eti-Oni,001,ETI ONI OPEN SPACE
OSUN,01,ATAKUMOSA EAST,05,Eti-Oni,002,"L.A. PRY. SCHOOL, ALADODO"
OSUN,01,ATAKUMOSA EAST,05,Eti-Oni,003,"ANG. PRY. SCHOOL, ALARERE"
OSUN,01,ATAKUMOSA EAST,05,Eti-Oni,004,COURT HALL ITAPA
OSUN,01,ATAKUMOSA EAST,05,Eti-Oni,005,"MATERNITY CENTRE, ILORO"
OSUN,01,ATAKUMOSA EAST,05,Eti-Oni,006,OPEN SPACE TEMIDIRE I
OSUN,01,ATAKUMOSA EAST,05,Eti-Oni,007,"OPEN SPACE, TEMIDIRE II"
OSUN,01,ATAKUMOSA EAST,06,Ayegunle,001,ST. LUKE'S ODOGBO
OSUN,01,ATAKUMOSA EAST,06,Ayegunle,002,"L.A. PRY. SCHOOL, AJIDO"
OSUN,01,ATAKUMOSA EAST,06,Ayegunle,003,"COMM. PRY. SCHOOL, FARO"
OSUN,01,ATAKUMOSA EAST,06,Ayegunle,004,C.A.C. PRY. SCHOOL AKANNI
OSUN,01,ATAKUMOSA EAST,06,Ayegunle,005,OPEN SPACE ALADURA
OSUN,01,ATAKUMOSA EAST,06,Ayegunle,006,ITAMERIN
OSUN,01,ATAKUMOSA EAST,07,Forest Reserve I,001,L.A. PRY. SCHOOL ONIGBOGI
OSUN,01,ATAKUMOSA EAST,07,Forest Reserve I,002,OPEN SPACE ONIGBOGI
OSUN,01,ATAKUMOSA EAST,07,Forest Reserve I,003,SOKOTO I
OSUN,01,ATAKUMOSA EAST,07,Forest Reserve I,004,SOKOTO II
OSUN,01,ATAKUMOSA EAST,07,Forest Reserve I,005,SOKOTO S.B OJO
OSUN,01,ATAKUMOSA EAST,07,Forest Reserve I,006,OGUNDELE
OSUN,01,ATAKUMOSA EAST,07,Forest Reserve I,007,OWADA
OSUN,01,ATAKUMOSA EAST,08,Forest Reserve II,001,NUMBER
OSUN,01,ATAKUMOSA EAST,08,Forest Reserve II,002,GRAMMAR SCHOOL ALAKA
OSUN,01,ATAKUMOSA EAST,08,Forest Reserve II,003,L.A. SCHOOL LABOSIPO
OSUN,01,ATAKUMOSA EAST,08,Forest Reserve II,004,TIMOLAJA AROWOJOBE
OSUN,01,ATAKUMOSA EAST,08,Forest Reserve II,005,L.A. SCHOOL AREWA
OSUN,01,ATAKUMOSA EAST,08,Forest Reserve II,006,ALONGE/FAJUKE
OSUN,01,ATAKUMOSA EAST,09,Faforiji,001,ST. FELIX PRY. SCHOL FAFORIJI
OSUN,01,ATAKUMOSA EAST,09,Faforiji,002,ST. FELIX PRY. SCHOOL FAFORIJI I
OSUN,01,ATAKUMOSA EAST,09,Faforiji,003,TOWN HALL FAFORIJI
OSUN,01,ATAKUMOSA EAST,09,Faforiji,004,AGBON JEGEDE
OSUN,01,ATAKUMOSA EAST,09,Faforiji,005,"SURAJU PRY. SCHOOL, ERINSEBIJA"
OSUN,01,ATAKUMOSA EAST,09,Faforiji,006,COMM. PRY. SCHOOL OMO-ODO
OSUN,01,ATAKUMOSA EAST,09,Faforiji,007,COMM. PRY. SCHOOL ABATUNTUN
OSUN,01,ATAKUMOSA EAST,09,Faforiji,008,EHIN-OKE
OSUN,01,ATAKUMOSA EAST,10,Ajebandele,001,L.A PRY SCHOOL AJEBANDELE
OSUN,01,ATAKUMOSA EAST,10,Ajebandele,002,"ST. JOHN'S PRY SCHOOL, ERINBURO"
OSUN,01,ATAKUMOSA EAST,10,Ajebandele,003,L.A. PRY SCHOOL AYINRIN ADEDEJI I
OSUN,01,ATAKUMOSA EAST,10,Ajebandele,004,OPEN SPACE OLOWORU OWODE
OSUN,01,ATAKUMOSA EAST,10,Ajebandele,005,"EMMAN. PRY. SCHOOL, LAPAEDE"
OSUN,01,ATAKUMOSA EAST,10,Ajebandele,006,"COMM. PRY SCHOOL, OKE-ODO"
OSUN,01,ATAKUMOSA EAST,10,Ajebandele,007,L.A. PRY SCHOOL ATORIN
OSUN,02,ATAKUMOSA WEST,01,Osu I,001,"METHODIST PRIMARY SCHOOL, OKE OJA - OSU"
OSUN,02,ATAKUMOSA WEST,01,Osu I,002,"C & S PRY.SCHOOL, OSU (OPPOSITE HM'S OFFICE)"
OSUN,02,ATAKUMOSA WEST,01,Osu I,003,"ARUAJI, OSU"
OSUN,02,ATAKUMOSA WEST,01,Osu I,004,"ATAKUNMOSA HIGH SCHOOL, OSU"
OSUN,02,ATAKUMOSA WEST,02,Osu II,001,"APOSTOLIC PRY SCHOOL, IWARO"
OSUN,02,ATAKUMOSA WEST,02,Osu II,002,"PRY SCHOOL, ILOBA"
OSUN,02,ATAKUMOSA WEST,02,Osu II,003,BARA VILLAGE
OSUN,02,ATAKUMOSA WEST,02,Osu II,004,"PRY SCHOOL, ALAKOWE"
OSUN,02,ATAKUMOSA WEST,02,Osu II,005,AYORUNBO VILLAGE
OSUN,02,ATAKUMOSA WEST,02,Osu II,006,ODESOMI VILLAGE
OSUN,02,ATAKUMOSA WEST,02,Osu II,007,"PRY SCHOOL, SASA"
OSUN,02,ATAKUMOSA WEST,02,Osu II,008,"R.C.M. PRY. SCHOOL, KAJOLA"
OSUN,02,ATAKUMOSA WEST,02,Osu II,009,"COMM. PRY. SCHOOL, ASAOBI"
OSUN,02,ATAKUMOSA WEST,02,Osu II,010,BALOGUN VILLAGE
OSUN,02,ATAKUMOSA WEST,02,Osu II,011,KANYE VILLAGE
OSUN,02,ATAKUMOSA WEST,03,Osu III,001,"METHODIST PRY. SCHOOL, OKEOMI, OSU"
OSUN,02,ATAKUMOSA WEST,03,Osu III,002,"METHODIST PRY. SCHOOL, OSU"
OSUN,02,ATAKUMOSA WEST,03,Osu III,003,"L.A. PRY. SCHOOL, ILOWO ST. OSU"
OSUN,02,ATAKUMOSA WEST,03,Osu III,004,"PRY. SCHOOL, ITAMERIN"
OSUN,02,ATAKUMOSA WEST,03,Osu III,005,"COMM. GRAMMAR SCHOOL, AJIDO, OSU"
OSUN,02,ATAKUMOSA WEST,04,Ibodi,001,"COMM. GRAMMAR SCHOOL, IBODI"
OSUN,02,ATAKUMOSA WEST,04,Ibodi,002,"TEMIDIRE PRY. SCHOOL, IBODI"
OSUN,02,ATAKUMOSA WEST,04,Ibodi,003,IGILA VILLAGE
OSUN,02,ATAKUMOSA WEST,04,Ibodi,004,IYERE VILLAGE
OSUN,02,ATAKUMOSA WEST,04,Ibodi,005,OSUN STATE COLL. OF EDUCATION
OSUN,02,ATAKUMOSA WEST,04,Ibodi,006,ILOTIN VILLAGE
OSUN,02,ATAKUMOSA WEST,05,Ifelodun,001,EPE VILLAGE
OSUN,02,ATAKUMOSA WEST,05,Ifelodun,002,IJANA VILLAGE
OSUN,02,ATAKUMOSA WEST,05,Ifelodun,003,ODO IJU VILLAGE
OSUN,02,ATAKUMOSA WEST,05,Ifelodun,004,IYEMOGUN VILLAGE
OSUN,02,ATAKUMOSA WEST,05,Ifelodun,005,"METHODIST PRY. SCHOOL, IGUN"
OSUN,02,ATAKUMOSA WEST,05,Ifelodun,006,APEPE VILLAGE
OSUN,02,ATAKUMOSA WEST,06,Ita Gunmodi,001,"TOWN HALL, ITA GUNMODI I"
OSUN,02,ATAKUMOSA WEST,06,Ita Gunmodi,002,ALABA/OWENA VILLAGE
OSUN,02,ATAKUMOSA WEST,06,Ita Gunmodi,003,ST. PETER'S PRY SCH. ARAROMI VILLAGE
OSUN,02,ATAKUMOSA WEST,06,Ita Gunmodi,004,ARIGBABU VILLAGE
OSUN,02,ATAKUMOSA WEST,06,Ita Gunmodi,005,OKE-IPA VILLAGE
OSUN,02,ATAKUMOSA WEST,06,Ita Gunmodi,006,ITAGUMMODI II TOWN HALL
OSUN,02,ATAKUMOSA WEST,07,Oke Bode,001,OJU OJA OKEBODE
OSUN,02,ATAKUMOSA WEST,07,Oke Bode,002,"ST. JOHN PRY. SCHOOL, OKE-BODE"
OSUN,02,ATAKUMOSA WEST,07,Oke Bode,003,ABEBEYUN/ISEDO PRY. SCHOL
OSUN,02,ATAKUMOSA WEST,07,Oke Bode,004,OKE-OSIN PRY. SCHOOL
OSUN,02,ATAKUMOSA WEST,07,Oke Bode,005,"L.A. PRY. SCHOOL, KAJOLA"
OSUN,02,ATAKUMOSA WEST,07,Oke Bode,006,ARAROMI KAJOLA
OSUN,02,ATAKUMOSA WEST,07,Oke Bode,007,LAALA VILLAGE
OSUN,02,ATAKUMOSA WEST,07,Oke Bode,008,ASIPA/SALORO
OSUN,02,ATAKUMOSA WEST,07,Oke Bode,009,"L.A. PRY. SCHOOL, GIDIGBI"
OSUN,02,ATAKUMOSA WEST,07,Oke Bode,010,"MATERNITY CENTRE, OSUNJELA"
OSUN,02,ATAKUMOSA WEST,08,Isa Obi,001,"ISAOBI PRY. SCHOOL,"
OSUN,02,ATAKUMOSA WEST,08,Isa Obi,002,INASIN VILLAGE
OSUN,02,ATAKUMOSA WEST,08,Isa Obi,003,RISAWE VILLAGE
OSUN,02,ATAKUMOSA WEST,08,Isa Obi,004,ITAOSAN VILLAGE
OSUN,02,ATAKUMOSA WEST,09,Muroko,001,MUROKO/OKE-AWO
OSUN,02,ATAKUMOSA WEST,09,Muroko,002,"ST. JAMES PRY. SCHOOL, ILAA"
OSUN,02,ATAKUMOSA WEST,09,Muroko,003,"L.A. SCHOOL, ISOLO"
OSUN,02,ATAKUMOSA WEST,09,Muroko,004,ILOYA VILLAGE
OSUN,02,ATAKUMOSA WEST,09,Muroko,005,IPOYE VILLAGE
OSUN,02,ATAKUMOSA WEST,09,Muroko,006,ESIRA VILLAGE
OSUN,02,ATAKUMOSA WEST,10,Ifewara I,001,"TOWN HALL, IFEWARA"
OSUN,02,ATAKUMOSA WEST,10,Ifewara I,002,OGOGODOJA VILLAGE
OSUN,02,ATAKUMOSA WEST,10,Ifewara I,003,AGBABIAKA VILLAGE
OSUN,02,ATAKUMOSA WEST,10,Ifewara I,004,"N. U. D. PRY. SCHOOL, IFEWARA"
OSUN,02,ATAKUMOSA WEST,11,Ifewara II,001,"ST. DOMINIC PRY. SCHOOL, IFEWARA"
OSUN,02,ATAKUMOSA WEST,11,Ifewara II,002,IFEWARA HIGH SCHOOL I
OSUN,02,ATAKUMOSA WEST,11,Ifewara II,003,IFEWARA HIGH SCHOOL II
OSUN,02,ATAKUMOSA WEST,11,Ifewara II,004,ABA ORUNTO
OSUN,02,ATAKUMOSA WEST,11,Ifewara II,005,MATERNITY IFEWARA
OSUN,03,AYEDAADE,01,Balogun,001,"ILE ASORO, OPP. CUSTOMARY COURT, GBONGAN"
OSUN,03,AYEDAADE,01,Balogun,002,"OLUFI MEMORIAL PRY. SCHOL, OPP. S.S.S. OFFICE, GBONGAN"
OSUN,03,AYEDAADE,01,Balogun,003,"ST. PATRICK'S GRAMM. SCHOOL, I ADENUGA AREA, GBONGAN"
OSUN,03,AYEDAADE,01,Balogun,004,"ST. PATRICK'S GRAMMAR SCHOOL, II ADENUGA AREA, GBONGAN"
OSUN,03,AYEDAADE,01,Balogun,005,"MOLUBERIN JUNCTION, NEW ROAD AREA, GBONGAN"
OSUN,03,AYEDAADE,01,Balogun,006,"COMMUNITY HALL, OKE OJE AREA, GBONGAN"
OSUN,03,AYEDAADE,02,Otun Balogun,001,"ST. PETER'S PRY. SCHOOL I, OKE APATA GBONGAN"
OSUN,03,AYEDAADE,02,Otun Balogun,002,"ST. PETER'S PRY. SCHOOL II, OKE APATA GBONGAN"
OSUN,03,AYEDAADE,02,Otun Balogun,003,"COMMUNITY HALL OKE OLA AREA, GBONGAN"
OSUN,03,AYEDAADE,02,Otun Balogun,004,"ILE OLOJIN ILE OLOJIN AREA, GBONGAN"
OSUN,03,AYEDAADE,02,Otun Balogun,005,"OKE RORUN, OBADA AREA, GBONGAN"
OSUN,03,AYEDAADE,02,Otun Balogun,006,"ILE MOYEGUN, OBADA AREA, GBONGAN"
OSUN,03,AYEDAADE,03,Olufi,001,"COURT HAL, CUSTOMARY COURT, GBONGAN"
OSUN,03,AYEDAADE,03,Olufi,002,"OBADOORE CUSTOMARY COURT, GBONGAN"
OSUN,03,AYEDAADE,03,Olufi,003,"E. D. C. PRY SCHOOL, I, OWOOPE, OWOPE AREA"
OSUN,03,AYEDAADE,03,Olufi,004,"E.D.C. PRY. SCHOOL, II, OWOOPE, OWOOPE AREA"
OSUN,03,AYEDAADE,03,Olufi,005,"N. U.D. SCHOOL, OKE-OLA, OKE-OLA AREA"
OSUN,03,AYEDAADE,03,Olufi,006,"ILE AKANTI / OJUDE ASEDA, AKANTI COMP. GBONGAN"
OSUN,03,AYEDAADE,03,Olufi,007,"OKE IRORUN JUNCTION, AJEGUNLE AREA"
OSUN,03,AYEDAADE,04,Otun-Olufi,001,"A.U.D. AYEPE, GBAYANRIN AREA GBONGAN I"
OSUN,03,AYEDAADE,04,Otun-Olufi,002,"MATERNITY AJEGUNLE, OKE ELU AREA, GBONGAN"
OSUN,03,AYEDAADE,04,Otun-Olufi,003,"MATERNITY AJEGNLE, OKE ELU AREA, GBONGAN II"
OSUN,03,AYEDAADE,04,Otun-Olufi,004,"ST. PAUL'S PRY. SCHOOL, OKE CHURCH AREA, GBONGAN I"
OSUN,03,AYEDAADE,04,Otun-Olufi,005,"ST. PAUL'S PRY. SCHOOL, OKE CHURCH AREA, GBONGAN II"
OSUN,03,AYEDAADE,04,Otun-Olufi,006,"D.C. SCHOOL 1, OKE OFFA, OKE OFFA AREA GBONGAN"
OSUN,03,AYEDAADE,04,Otun-Olufi,007,"D.C. SCHOOL, II, OKE OFFA, OKE OFFA AREA, GBONGAN"
OSUN,03,AYEDAADE,04,Otun-Olufi,008,"E.D.C. SCHOOL, ARAROMI, ADENUGA AREA, GBONGAN"
OSUN,03,AYEDAADE,04,Otun-Olufi,009,"ST. MARTIN'S PRY SCHOOL, IWO ROAD, GBONGAN"
OSUN,03,AYEDAADE,04,Otun-Olufi,010,"PALACE ROAD, ONIDELE, OKE OFA AREA, GBONGAN"
OSUN,03,AYEDAADE,04,Otun-Olufi,011,"ABEKOKO, ABEKOKO AREA, GBONGAN"
OSUN,03,AYEDAADE,04,Otun-Olufi,012,"OJA AYEPE, I, AYEPE MARKET, GBONGAN"
OSUN,03,AYEDAADE,04,Otun-Olufi,013,"OJA AYEPE II, AYEPE MARKET, GBONGAN"
OSUN,03,AYEDAADE,04,Otun-Olufi,014,"ORITA OKE OFFA, OKE OFFA AREA GBONGAN"
OSUN,03,AYEDAADE,05,Ijegbe/Oke-Eso/Oke-Owu Ijugbe,001,"COURT HALL I, BEHIND ARAB BANK, ODE-OMU"
OSUN,03,AYEDAADE,05,Ijegbe/Oke-Eso/Oke-Owu Ijugbe,002,"COURT HALL II, BEHIND ARAB BANK ODE-OMU"
OSUN,03,AYEDAADE,05,Ijegbe/Oke-Eso/Oke-Owu Ijugbe,003,"D.C. SCHOOL, OKE ESO, OKE ESO, AREA ODE OMU"
OSUN,03,AYEDAADE,05,Ijegbe/Oke-Eso/Oke-Owu Ijugbe,004,"D.C. SCHOOL, OKE ESO, OKE ESO AREA ODEOMU"
OSUN,03,AYEDAADE,05,Ijegbe/Oke-Eso/Oke-Owu Ijugbe,005,"IGBIRA ISALE AREA, IGBIRA VILLAGE ODE OMU"
OSUN,03,AYEDAADE,05,Ijegbe/Oke-Eso/Oke-Owu Ijugbe,006,"ST. DAVID'S GRAMMAR SCHOOL, IWO ROAD, ODE OMU"
OSUN,03,AYEDAADE,05,Ijegbe/Oke-Eso/Oke-Owu Ijugbe,007,A.U.D. OKE ODE AREA OKE ODE AREA ODE OMU
OSUN,03,AYEDAADE,05,Ijegbe/Oke-Eso/Oke-Owu Ijugbe,008,"OKE-OWU HALL I, OKE OWU AREA ODEOMU"
OSUN,03,AYEDAADE,05,Ijegbe/Oke-Eso/Oke-Owu Ijugbe,009,"OKE-OWU HALL II, OKE-OWU AREA ODEOMU"
OSUN,03,AYEDAADE,05,Ijegbe/Oke-Eso/Oke-Owu Ijugbe,010,"OKE-OWU HALL III, OKE-OWU AREA, ODE-OMU"
OSUN,03,AYEDAADE,05,Ijegbe/Oke-Eso/Oke-Owu Ijugbe,011,"OSO ARE AREA, ILE OSO ARE, ODE OMU"
OSUN,03,AYEDAADE,05,Ijegbe/Oke-Eso/Oke-Owu Ijugbe,012,"OLUSUNDE AREA, OLUSUNDE COMP. ODEOMU"
OSUN,03,AYEDAADE,05,Ijegbe/Oke-Eso/Oke-Owu Ijugbe,013,"KETU AREA, KETU AREA ODE OMU"
OSUN,03,AYEDAADE,05,Ijegbe/Oke-Eso/Oke-Owu Ijugbe,014,"OLUSEYI HALL, FAJOB'S COMP. ODE-OMU"
OSUN,03,AYEDAADE,05,Ijegbe/Oke-Eso/Oke-Owu Ijugbe,015,"ORONA AREA, ORONA COMP. ODE OMU"
OSUN,03,AYEDAADE,05,Ijegbe/Oke-Eso/Oke-Owu Ijugbe,016,"IGBIRA OKE AREA, IGBIRA VILLAGE ODEOMU"
OSUN,03,AYEDAADE,05,Ijegbe/Oke-Eso/Oke-Owu Ijugbe,017,"BARA OLUOJA, OLUOJA COMP. ODE OMU"
OSUN,03,AYEDAADE,06,Lagere/Amola,001,"ST. PIUS, AMOLA AREA, ODE OMU"
OSUN,03,AYEDAADE,06,Lagere/Amola,002,"ST. PIUS AMOLA AREA, ODE OMU"
OSUN,03,AYEDAADE,06,Lagere/Amola,003,"D.C. AMOLA, AMOLA AREA, ODE OMU"
OSUN,03,AYEDAADE,06,Lagere/Amola,004,"ST. MICHAEL GRAMMAR SCHOOL, OBADA AREA, ODE OMU"
OSUN,03,AYEDAADE,06,Lagere/Amola,005,"A.U.D. PRY. SCHOOL, LAGERE AREA, ODEOMU"
OSUN,03,AYEDAADE,06,Lagere/Amola,006,"THE APOSTOLIC SCHOOL, IDI ASA'S COMP. ODEOMU"
OSUN,03,AYEDAADE,06,Lagere/Amola,007,"ST. DAVID.S PRIMARY SCHOOL, OBADA AREA, ODEOMU"
OSUN,03,AYEDAADE,06,Lagere/Amola,008,"IDIOSE, ILE OKE ODE OMU"
OSUN,03,AYEDAADE,06,Lagere/Amola,009,"ALAGBAGUN HALL, ALA-GBAGUN HALL, ODEOMU"
OSUN,03,AYEDAADE,06,Lagere/Amola,010,"ALAGBAA, ILE ALAGBAA ODE OMU"
OSUN,03,AYEDAADE,06,Lagere/Amola,011,"LEWERE I, LEWERE COMP. ODEOMU"
OSUN,03,AYEDAADE,06,Lagere/Amola,012,"LEWERE II, LEWERE COMP. ODEOMU"
OSUN,03,AYEDAADE,06,Lagere/Amola,013,"DISPENSARY, ILE IDI ASA, ODE OMU"
OSUN,03,AYEDAADE,06,Lagere/Amola,014,"ONILE AREA, ILE ONILE ARAN, ODEOMU"
OSUN,03,AYEDAADE,06,Lagere/Amola,015,"OLUWO JUNCTION ILE OLUWO, ODEOMU"
OSUN,03,AYEDAADE,06,Lagere/Amola,016,"ONITOKUN AREA, ONITOKUN COMP. ODEOMU"
OSUN,03,AYEDAADE,07,Gbongan Rural,001,D.C. AKOWIDE AKOWIDE VILLAGE
OSUN,03,AYEDAADE,07,Gbongan Rural,002,OGBAAGBA OGBAAGBA VILLAGE
OSUN,03,AYEDAADE,07,Gbongan Rural,003,WAKAJAIYE I
OSUN,03,AYEDAADE,07,Gbongan Rural,004,WAKAJAIYE II
OSUN,03,AYEDAADE,07,Gbongan Rural,005,"OLOBA VILLAGE, OLOBA VILLAGE"
OSUN,03,AYEDAADE,07,Gbongan Rural,006,"LAGBAKA, LAGBAKA VILLAGE"
OSUN,03,AYEDAADE,07,Gbongan Rural,007,"MOJAPA, MOJAPA VILLAGE"
OSUN,03,AYEDAADE,07,Gbongan Rural,008,"AKIRIBOTO I. ST. PETER'S, AKIRIBOTO I"
OSUN,03,AYEDAADE,07,Gbongan Rural,009,"AKIRIBOTO II, ST. DAVID'S, AKIRIBOTO II"
OSUN,03,AYEDAADE,07,Gbongan Rural,010,"AKIRIBOTO III, ST. DAVID'S AKIRIBOTO III"
OSUN,03,AYEDAADE,07,Gbongan Rural,011,"AKIRIBOTO ALABE, AKIRIBOTO VILLAGE"
OSUN,03,AYEDAADE,07,Gbongan Rural,012,"OLUWADA, OLUWADA VILLAGE"
OSUN,03,AYEDAADE,07,Gbongan Rural,013,ALAGBEDE VILLAGE
OSUN,03,AYEDAADE,07,Gbongan Rural,014,BEMBE VILLAGE
OSUN,03,AYEDAADE,07,Gbongan Rural,015,AKINJEPE VILLAGE
OSUN,03,AYEDAADE,07,Gbongan Rural,016,"ELEKIRI BALOGUN OMOLE, ELEKIRI BALOGUN"
OSUN,03,AYEDAADE,07,Gbongan Rural,017,ONIMU VILLAGE
OSUN,03,AYEDAADE,08,Ode-Omu Rural,001,"KAJE ONISANGO, KAJE ONISANGO VILLAGE"
OSUN,03,AYEDAADE,08,Ode-Omu Rural,002,"D.C. SCHOOL, LASOLEI, LASOLE VILLAGE"
OSUN,03,AYEDAADE,08,Ode-Omu Rural,003,"D.C. SCHOOL, LASOLE II, LASOLE VILLAGE"
OSUN,03,AYEDAADE,08,Ode-Omu Rural,004,"C.A.C. AYETORO, TONKERE VILAGE"
OSUN,03,AYEDAADE,08,Ode-Omu Rural,005,"COURT HALL TONKERE, TONKERE TOWN"
OSUN,03,AYEDAADE,08,Ode-Omu Rural,006,"ST. JAME'S TONKERE, TONKERE TOWN"
OSUN,03,AYEDAADE,08,Ode-Omu Rural,007,"ST. STEPHEN OOGI, OOGI TOWN"
OSUN,03,AYEDAADE,08,Ode-Omu Rural,008,"ST. MATTHEW'S EJEMU, EJEMU VILLAGE"
OSUN,03,AYEDAADE,08,Ode-Omu Rural,009,"OJUDO VILLAGE, OJUDO VILLAGE"
OSUN,03,AYEDAADE,08,Ode-Omu Rural,010,"AGBUNGU, AGBUNGU VILLAGE"
OSUN,03,AYEDAADE,08,Ode-Omu Rural,011,"ALAGBEDE BAALE VILLAGE, ALAGBEDE VILLAGE"
OSUN,03,AYEDAADE,09,Obalufon,001,"ST. LUKE'S SCHOOL I, OKE ESO ORILE OWU"
OSUN,03,AYEDAADE,09,Obalufon,002,"ST. LUKE'S SCHOOL II, OKE ESO, ORILE OWU"
OSUN,03,AYEDAADE,09,Obalufon,003,"DABONGBE, DABONGBE VILLAGE"
OSUN,03,AYEDAADE,09,Obalufon,004,"GBEKE HALL, GBEKE AREA, ORILE OWU"
OSUN,03,AYEDAADE,09,Obalufon,005,"GBEKE HALL, GBEKE VILLAGE"
OSUN,03,AYEDAADE,09,Obalufon,006,"FOWOSERE, FOWOSERE VILLAGE"
OSUN,03,AYEDAADE,09,Obalufon,007,"BABA IJO, BABA IJO VILLAGE"
OSUN,03,AYEDAADE,09,Obalufon,008,"ABA IBADAN, ABA IBADAN VILLAGE"
OSUN,03,AYEDAADE,09,Obalufon,009,"ATOBA VILLAGE, ATOBA VILLAGE"
OSUN,03,AYEDAADE,09,Obalufon,010,"ABEWELA VILLAGE, ABEWELA VILLAGE"
OSUN,03,AYEDAADE,10,Anlugbua,001,"GBOGBO VILLAGE, GBOGBO VILLAGE, ORILE OWU"
OSUN,03,AYEDAADE,10,Anlugbua,002,"OLUWO COMPD. OLUWO COMPD, ORILE OWU"
OSUN,03,AYEDAADE,10,Anlugbua,003,"FARM SETTLEMENT, FARM SETTLEMENT, ORILEOWU"
OSUN,03,AYEDAADE,10,Anlugbua,004,"SABO I, SABO AREA"
OSUN,03,AYEDAADE,10,Anlugbua,005,"SABO II, SABO AREA"
OSUN,03,AYEDAADE,10,Anlugbua,006,"ST. PETER'S SCHOOL, OKE OLA, ORILE OWU"
OSUN,03,AYEDAADE,10,Anlugbua,007,"ST. PETER'S SCHOOL, OKE OLA ORILE OWU"
OSUN,03,AYEDAADE,10,Anlugbua,008,"COURT HALL, OJUOJA, ORILE OWU"
OSUN,03,AYEDAADE,10,Anlugbua,009,"COURT HALL, OJU OJA, ORILE OWU"
OSUN,03,AYEDAADE,10,Anlugbua,010,"BAPTIST PRY. SCHOOL, APENA AREA, ORILE OWU"
OSUN,03,AYEDAADE,10,Anlugbua,011,"BAPT. PRY. SCHOOL, APENA AREA, ORILE OWU"
OSUN,03,AYEDAADE,10,Anlugbua,012,"MOTAKO 1, MOTAKO VILLAGE"
OSUN,03,AYEDAADE,10,Anlugbua,013,"MOTAKO II, MOTAKO VILLAGE"
OSUN,03,AYEDAADE,10,Anlugbua,014,"OPE AYOOLA, OPE AYOOLA VILLAGE"
OSUN,03,AYEDAADE,10,Anlugbua,015,"GBONA, GBONNA VILLAGE"
OSUN,03,AYEDAADE,10,Anlugbua,016,"ABIMBOLA VILLAGE, ABIMBOLA VILLAGE"
OSUN,03,AYEDAADE,10,Anlugbua,017,"MOTAKA OJETUNDE, MOTAKA OJETUNDE VILLAGE"
OSUN,03,AYEDAADE,10,Anlugbua,018,"ALAGBEDE, ALAGBEDE VILLAGE"
OSUN,03,AYEDAADE,10,Anlugbua,019,COMMUNITY PRY. SCHOOL ALABAMETA
OSUN,03,AYEDAADE,10,Anlugbua,020,"ALAGUNTAN, ALAGUNTAN VILLAGE"
OSUN,03,AYEDAADE,10,Anlugbua,021,"BARAWO, BARAWO VILLAGE"
OSUN,03,AYEDAADE,11,Araromi-Owu,001,ARAROMI OWU I TOWN
OSUN,03,AYEDAADE,11,Araromi-Owu,002,ARAROMI OWU II TOWN
OSUN,03,AYEDAADE,11,Araromi-Owu,003,ARAROMI OWU MARKET
OSUN,03,AYEDAADE,11,Araromi-Owu,004,"SANGODIRAN, SANGODIRAN VILLAGE"
OSUN,03,AYEDAADE,11,Araromi-Owu,005,"IDI IROKO, IDI IROKO VILLAGE"
OSUN,03,AYEDAADE,11,Araromi-Owu,006,"MOKORE, MOKORE VILLAGE"
OSUN,03,AYEDAADE,11,Araromi-Owu,007,"AJEGUNLE, AJEGUNLE VILLAGE"
OSUN,04,AYEDIRE,01,Oluponna I,001,"COMMUNITY PRY. SCHOOL, ALAYA"
OSUN,04,AYEDIRE,01,Oluponna I,002,"D.C. SCHOOL, ADENLERE, ADENLERE"
OSUN,04,AYEDIRE,01,Oluponna I,003,"METHODIST PRY. SCHOOL, IWO RAILWAY STATION"
OSUN,04,AYEDIRE,01,Oluponna I,004,OLUPONNA TOWN HALL I
OSUN,04,AYEDIRE,01,Oluponna I,005,OLUPONNA TOWN HALL II
OSUN,04,AYEDIRE,02,Oluponna II,001,"D.C. SCHOOL, OLUPONNA"
OSUN,04,AYEDIRE,02,Oluponna II,002,"BAPTIST SCHOOL, OLUPONNA"
OSUN,04,AYEDIRE,02,Oluponna II,003,OJISUN OPEN SPACE
OSUN,04,AYEDIRE,02,Oluponna II,004,ODE OTE/EJEMU MARKET
OSUN,04,AYEDIRE,03,Oluponna III,001,ARAROMI MARKET I
OSUN,04,AYEDIRE,03,Oluponna III,002,ARAROMI MARKET II
OSUN,04,AYEDIRE,03,Oluponna III,003,ARAROMI MARKET III
OSUN,04,AYEDIRE,03,Oluponna III,004,"SAINT JOHN'S SCHOOL, WAASINMI"
OSUN,04,AYEDIRE,03,Oluponna III,005,"D.C. SCHOOL, OLORI/ODUWO"
OSUN,04,AYEDIRE,04,Oke-Osun,001,"CHRIST ANGLICAN SCHOOL, ELESIN"
OSUN,04,AYEDIRE,04,Oke-Osun,002,IYANA IKIRE OPEN SPACE
OSUN,04,AYEDIRE,04,Oke-Osun,003,"A.U.D SCHOOL, ELEJI"
OSUN,04,AYEDIRE,04,Oke-Osun,004,"COMMUNITY HIGH SCHOOL, ONIGANGAN"
OSUN,04,AYEDIRE,04,Oke-Osun,005,"N.U.D. SCHOOL, ILEIRAN"
OSUN,04,AYEDIRE,04,Oke-Osun,006,A.U.D. ABANIKANDA
OSUN,04,AYEDIRE,04,Oke-Osun,007,"D.C. SCHOOL, ALAGBAA"
OSUN,04,AYEDIRE,04,Oke-Osun,008,MAMU/ABIMBOLA
OSUN,04,AYEDIRE,04,Oke-Osun,009,OLORUNDA MARKET
OSUN,04,AYEDIRE,04,Oke-Osun,010,LAITAN VILLAGE
OSUN,04,AYEDIRE,04,Oke-Osun,011,AJEBANDELE VILLAGE
OSUN,04,AYEDIRE,05,Ileogbo I,001,IDI ORE MARKET
OSUN,04,AYEDIRE,05,Ileogbo I,002,"LUTHER KING'S COLLEGE, ILEOGBO"
OSUN,04,AYEDIRE,05,Ileogbo I,003,"METHODIST PRY. SCHOOL, ILEOGBO"
OSUN,04,AYEDIRE,05,Ileogbo I,004,"N.U. D. SCHOOL, ILEOGBO I"
OSUN,04,AYEDIRE,05,Ileogbo I,005,"N.U. D. SCHOOL, ILEOGBO II"
OSUN,04,AYEDIRE,05,Ileogbo I,006,KOBIOWU OPEN SPACE
OSUN,04,AYEDIRE,06,Ileogbo II,001,IDI APE OPEN SPACE
OSUN,04,AYEDIRE,06,Ileogbo II,002,METHODIST SCHOOL OPEN SPACE
OSUN,04,AYEDIRE,06,Ileogbo II,003,ALARAN OPEN SPACE
OSUN,04,AYEDIRE,06,Ileogbo II,004,"COURT HALL, ILEOGBO"
OSUN,04,AYEDIRE,06,Ileogbo II,005,ALAWE OPEN SPACE
OSUN,04,AYEDIRE,07,Ileogbo III,001,OLUDE OPEN SPACE
OSUN,04,AYEDIRE,07,Ileogbo III,002,IDI-OGUN OPEN SPACE
OSUN,04,AYEDIRE,07,Ileogbo III,003,"COMPREHENSIVE HEALTH CENTRE, ILEOGBO"
OSUN,04,AYEDIRE,07,Ileogbo III,004,AGE'S COMPD. ILEOGBO
OSUN,04,AYEDIRE,08,Ileogbo IV,001,ASIPA OPEN SPACE
OSUN,04,AYEDIRE,08,Ileogbo IV,002,"AFRICAN CHURCH AREA, OPEN SPACE"
OSUN,04,AYEDIRE,08,Ileogbo IV,003,GBOGBO OPEN SPACE
OSUN,04,AYEDIRE,08,Ileogbo IV,004,AYI OPEN SPACE
OSUN,04,AYEDIRE,09,Kuta I,001,"COURT HALL, KUTA"
OSUN,04,AYEDIRE,09,Kuta I,002,"A.U.D. SCHOOL, IKOYI/KUTA"
OSUN,04,AYEDIRE,09,Kuta I,003,ALAGBEDE'S COMPD. KUTA
OSUN,04,AYEDIRE,09,Kuta I,004,"DISPENSARY, KUTA"
OSUN,04,AYEDIRE,09,Kuta I,005,OLUNLADE OPEN SPACE
OSUN,04,AYEDIRE,10,Kuta II,001,"SAINT PETER AFRICAN CHURCH SCHOOL, KUTA"
OSUN,04,AYEDIRE,10,Kuta II,002,"A/C METHODIST PRY SCHOOL, RAILWAY STATION"
OSUN,04,AYEDIRE,10,Kuta II,003,ILE ALAYE
OSUN,04,AYEDIRE,10,Kuta II,004,"C.M.S SCHOOL, ILORO"
OSUN,04,AYEDIRE,10,Kuta II,005,ODE OOSA OPEN SPACE
OSUN,05,BOLUWADURO,01,Oke-Omi Otan,001,ST. PHILIP'S PRY. SCHOOL
OSUN,05,BOLUWADURO,01,Oke-Omi Otan,002,ISALE OBAALA
OSUN,05,BOLUWADURO,01,Oke-Omi Otan,003,ITA DADA
OSUN,05,BOLUWADURO,01,Oke-Omi Otan,004,LEGIRI
OSUN,05,BOLUWADURO,01,Oke-Omi Otan,005,ST. NICHOLAS PRY. SCHOOL
OSUN,05,BOLUWADURO,01,Oke-Omi Otan,006,ODOHUN
OSUN,05,BOLUWADURO,01,Oke-Omi Otan,007,BRICK LAYER'S HALL
OSUN,05,BOLUWADURO,01,Oke-Omi Otan,008,ALAAFA/IGBODU
OSUN,05,BOLUWADURO,01,Oke-Omi Otan,009,OKE AKANGBE
OSUN,05,BOLUWADURO,02,Oke Ode Otan,001,OLOSAN
OSUN,05,BOLUWADURO,02,Oke Ode Otan,002,AGBESOLA
OSUN,05,BOLUWADURO,02,Oke Ode Otan,003,OJUDE ARO
OSUN,05,BOLUWADURO,02,Oke Ode Otan,004,COURT HALL/TOWN HALL
OSUN,05,BOLUWADURO,02,Oke Ode Otan,005,IMOJIGBON
OSUN,05,BOLUWADURO,02,Oke Ode Otan,006,OBADA MARKET
OSUN,05,BOLUWADURO,02,Oke Ode Otan,007,ALAFE OKERO
OSUN,05,BOLUWADURO,03,Oke-Otan,001,EJEMU ORORO
OSUN,05,BOLUWADURO,03,Oke-Otan,002,OKE ANAYE
OSUN,05,BOLUWADURO,03,Oke-Otan,003,ALAREMU
OSUN,05,BOLUWADURO,03,Oke-Otan,004,N.U.D PRY. SCHOOL I
OSUN,05,BOLUWADURO,03,Oke-Otan,005,N.U.D. PRY. SCHOOL II
OSUN,05,BOLUWADURO,03,Oke-Otan,006,GAA FULANI
OSUN,05,BOLUWADURO,03,Oke-Otan,007,OROKI
OSUN,05,BOLUWADURO,04,Gbeleru Obaala I,001,KIRIJI MEMORIAL COLLEGE
OSUN,05,BOLUWADURO,04,Gbeleru Obaala I,002,BAPTIST PRY. SCHOOL
OSUN,05,BOLUWADURO,04,Gbeleru Obaala I,003,AFRICA PRY. SCHOOL
OSUN,05,BOLUWADURO,04,Gbeleru Obaala I,004,LIBRARY
OSUN,05,BOLUWADURO,04,Gbeleru Obaala I,005,TOWN HALL
OSUN,05,BOLUWADURO,04,Gbeleru Obaala I,006,AYETORO VILLAGE
OSUN,05,BOLUWADURO,05,Gbeleru Obaala II,001,ESILE RECREATION HALL I
OSUN,05,BOLUWADURO,05,Gbeleru Obaala II,002,ESILE RECREATION HALL II
OSUN,05,BOLUWADURO,05,Gbeleru Obaala II,003,C & S PRY. SCHOOL
OSUN,05,BOLUWADURO,05,Gbeleru Obaala II,004,ODOFIN COMMUNITY HALL
OSUN,05,BOLUWADURO,05,Gbeleru Obaala II,005,ARAGBA VILLAGE
OSUN,05,BOLUWADURO,05,Gbeleru Obaala II,006,KAJOLA/OGUNDEJI VILLAGE
OSUN,05,BOLUWADURO,05,Gbeleru Obaala II,007,OSORO/AJEGUNLE VILLAGE
OSUN,05,BOLUWADURO,05,Gbeleru Obaala II,008,BUDO KIRIJI VILLAGE
OSUN,05,BOLUWADURO,06,Obala Iloro,001,CATHOLIC PRY. SCHOOL
OSUN,05,BOLUWADURO,06,Obala Iloro,002,COMMUNITY HIGH SCHOOL
OSUN,05,BOLUWADURO,06,Obala Iloro,003,ILORO MARKET SQUARE
OSUN,05,BOLUWADURO,06,Obala Iloro,004,COOPERATIVE HALL
OSUN,05,BOLUWADURO,06,Obala Iloro,005,LOWANKAN HALL
OSUN,05,BOLUWADURO,06,Obala Iloro,006,IREPODUN VILLAGE
OSUN,05,BOLUWADURO,06,Obala Iloro,007,ARAROMI EDI VILLAGE
OSUN,05,BOLUWADURO,07,Eripa,001,BAPTIST DAY SCHOOL
OSUN,05,BOLUWADURO,07,Eripa,002,"PALACE AREA, OPEN SPACE"
OSUN,05,BOLUWADURO,07,Eripa,003,TOWN HALL
OSUN,05,BOLUWADURO,07,Eripa,004,POLICE POST
OSUN,05,BOLUWADURO,07,Eripa,005,OLD MATERNITY CENTRE
OSUN,05,BOLUWADURO,07,Eripa,006,COMMUNITY GRAMMAR SCHOOL
OSUN,05,BOLUWADURO,07,Eripa,007,GAA AMODU
OSUN,05,BOLUWADURO,08,Oke-Irun,001,OKERUN MARKET SQUARE I
OSUN,05,BOLUWADURO,08,Oke-Irun,002,OKERUN MARKET SQUARE II
OSUN,05,BOLUWADURO,08,Oke-Irun,003,COMMUNITY PRIMARY SCHOOL
OSUN,05,BOLUWADURO,08,Oke-Irun,004,AJEBANDELE VILLAGE
OSUN,05,BOLUWADURO,08,Oke-Irun,005,IGBO ITA ERIE VILLAGE
OSUN,05,BOLUWADURO,08,Oke-Irun,006,IGBO NLA AYETORO
OSUN,05,BOLUWADURO,08,Oke-Irun,007,COMMUNITY GRAMMAR SCHOOL
OSUN,05,BOLUWADURO,09,Iresi I,001,OJA OBA SQUARE
OSUN,05,BOLUWADURO,09,Iresi I,002,BAPTIST DAY SCHOOL
OSUN,05,BOLUWADURO,09,Iresi I,003,SABO OLOBI
OSUN,05,BOLUWADURO,09,Iresi I,004,OKE ERI SQUARE
OSUN,05,BOLUWADURO,09,Iresi I,005,OGBON ODO ODE
OSUN,05,BOLUWADURO,09,Iresi I,006,AGO FULANI
OSUN,05,BOLUWADURO,09,Iresi I,007,OROKORO PRY. SCHOOL
OSUN,05,BOLUWADURO,10,Iresi II,001,TOWN HALL
OSUN,05,BOLUWADURO,10,Iresi II,002,OBADA MARKET SQUARE
OSUN,05,BOLUWADURO,10,Iresi II,003,N.U.D PRY. SCHOOL
OSUN,05,BOLUWADURO,10,Iresi II,004,AYERIYI
OSUN,05,BOLUWADURO,10,Iresi II,005,IKIFIN POSTAL AGENCY
OSUN,05,BOLUWADURO,10,Iresi II,006,COMPREHENSIVE HEALTH CENTRE
OSUN,05,BOLUWADURO,10,Iresi II,007,CARPENTERS' HALL
OSUN,05,BOLUWADURO,10,Iresi II,008,IGBONKA VILLAGE
OSUN,05,BOLUWADURO,10,Iresi II,009,OBUKE VILLAGE
OSUN,06,BORIPE,01,Oloti Iragbiji,001,"ST. PETER SCHOOL I , IRAGBIJI"
OSUN,06,BORIPE,01,Oloti Iragbiji,002,"L.A. SCHOOL, POPO"
OSUN,06,BORIPE,01,Oloti Iragbiji,003,N.E. P. A
OSUN,06,BORIPE,01,Oloti Iragbiji,004,OKE OSUN
OSUN,06,BORIPE,01,Oloti Iragbiji,005,OKE - AGBO
OSUN,06,BORIPE,01,Oloti Iragbiji,006,AROMADU I
