state,lga_code,lga_name,ward_code,ward_name,pu_code,pu_name
GOMBE,07,KALTUNGO,07,Tula Wange,013,"TANTAN PRI SCH. (KUTUBE II, K/J KUTUBE)"
GOMBE,07,KALTUNGO,07,Tula Wange,014,"BWITIR PRI. SCH. II (BUTAMI, K/J BUTAMI)"
GOMBE,07,KALTUNGO,07,Tula Wange,015,"WANGE PRI SCH. (UNG. HALILU/MISSION,K/HALILU)"
GOMBE,07,KALTUNGO,07,Tula Wange,016,"KINE PRI SCH. I (FALANG, K/J FALANG)"
GOMBE,07,KALTUNGO,07,Tula Wange,017,"KINE PRI SCH. II (SURKWAM, K/J SURKWAM)"
GOMBE,07,KALTUNGO,08,Tula - Yiri,001,"UNG. SARKI I, YIRI PRI. SCH."
GOMBE,07,KALTUNGO,08,Tula - Yiri,002,"UNG. SARKI II, YIRI PRI. SCH."
GOMBE,07,KALTUNGO,08,Tula - Yiri,003,"YIRI PRI. SCH. I-I (BWANE, K/M KMA)"
GOMBE,07,KALTUNGO,08,Tula - Yiri,004,"YIRI PRI. SCH. I-II (BABA GALADIMA, K/GALADIMA)"
GOMBE,07,KALTUNGO,08,Tula - Yiri,005,"KWEN PRI. SCH. I (KWEN, K.M KWEN)"
GOMBE,07,KALTUNGO,08,Tula - Yiri,006,"KWEN PRI. SCH. II (DADIYE, K.M KWEN)"
GOMBE,07,KALTUNGO,08,Tula - Yiri,007,"KWEN PRI. SCH. III (SABON LAYI, K.M KWEN)"
GOMBE,07,KALTUNGO,08,Tula - Yiri,008,"J.S.S BAMBAM I (BAMBAM, K. BAKO)"
GOMBE,07,KALTUNGO,08,Tula - Yiri,009,"J.S.S BAMBAM II (GALADIMA YIRI, K/SARKI)"
GOMBE,07,KALTUNGO,08,Tula - Yiri,010,"J.S.S BAMBAM III (GALADIMA YIRI, G. YIRI PRI. SCH.)"
GOMBE,07,KALTUNGO,08,Tula - Yiri,011,"KWARSU ""A"", G. YIRI PRI. SCH."
GOMBE,07,KALTUNGO,08,Tula - Yiri,012,"YIRI PRI. SCH. II-I (KWARSU, K/YERIMA)"
GOMBE,07,KALTUNGO,08,Tula - Yiri,013,"YIRI PRI. SCH. II-II (KWARSU, K.M. KALAKU)"
GOMBE,07,KALTUNGO,09,Tungo,001,"POKWANLI PRI SCH. I (POKWANLI ""A"" ,POMA BABA BULA)"
GOMBE,07,KALTUNGO,09,Tungo,002,"POKWANLI PRI SCH. I (POKWANLI ""B"", TUL LATI)"
GOMBE,07,KALTUNGO,09,Tungo,003,"LIMBE ""A"", PRI. SCH."
GOMBE,07,KALTUNGO,09,Tungo,004,"LIMBE PRI. SCH. (LIMBE ""B"", TUL DONG)"
GOMBE,07,KALTUNGO,09,Tungo,005,"WULI PRI. SCH. I (WULI ""A"" KAL GOMO)"
GOMBE,07,KALTUNGO,09,Tungo,006,"WULI PRI. SCH. II (WULI ""B"", TUL TWAL)"
GOMBE,07,KALTUNGO,09,Tungo,007,"KAMPANDI PRI SCH. I (KAMPANDI ""A"", DISPENSARY)"
GOMBE,07,KALTUNGO,09,Tungo,008,"KAMPANDI PRI SCH. II (KAMPANDI ""B"", TUL LATI)"
GOMBE,07,KALTUNGO,09,Tungo,009,"KOLWA PRI. SCH. I (KOLWA, POMA B. YAKUBU)"
GOMBE,07,KALTUNGO,09,Tungo,010,"KOLWA PRI. SCH. II (TANDURU, POMA B. YAKUBU)"
GOMBE,07,KALTUNGO,09,Tungo,011,"LAKIDIR PRI. SCH. I (LAWONGLONG, TUL DONG)"
GOMBE,07,KALTUNGO,09,Tungo,012,"LAKIDIR PRI. SCH. II (KASHING, TUL DONG)"
GOMBE,07,KALTUNGO,09,Tungo,013,"LAMBARA OPEN SPACE (LAMBARA, TUL-KWALAK)"
GOMBE,07,KALTUNGO,09,Tungo,014,"PONGRARAM OPEN SPACE (PONGRAM, TUL-KAMBIDO)"
GOMBE,07,KALTUNGO,09,Tungo,015,"SAKAURI OPEN SPACE (SAKAURI, K/JAURO)"
GOMBE,07,KALTUNGO,10,Ture,001,"TURE PANDI ""A"" I , PANDI PRI. SCH."
GOMBE,07,KALTUNGO,10,Ture,002,"TURE PANDI ""B"" II, PANDI PRI. SCH."
GOMBE,07,KALTUNGO,10,Ture,003,"TURE MAI, TURE MAI PRI. SCH."
GOMBE,07,KALTUNGO,10,Ture,004,"TURE OKRA PRI. SCH. (TURE OKRA, K.M UNGUWA)"
GOMBE,07,KALTUNGO,10,Ture,005,"TURE KWE PRI SCH. (TURE KWE 'A', K.M UNGUWA)"
GOMBE,07,KALTUNGO,10,Ture,006,"TURE BALAM ""A"" I, BALAM PRI. SCH."
GOMBE,07,KALTUNGO,10,Ture,007,"TURE BALAM ""B"" II, BALAM PRI. SCH."
GOMBE,07,KALTUNGO,10,Ture,008,"KALAKOROK PRIMARY SCHOOL(KALAKOROK, K.M UNGUWA)"
GOMBE,07,KALTUNGO,10,Ture,009,"STORE PRIMARY SCHOOL(STORE, K. M. UNGUWA)"
GOMBE,07,KALTUNGO,10,Ture,010,"BEDBERE PRI. SCH. (BEDBERE, KOFAR WAZIRI)"
GOMBE,07,KALTUNGO,10,Ture,011,"TURE MAI PRI SCH. I (TURE OKWALDI, K.M UNGUWA)"
GOMBE,07,KALTUNGO,10,Ture,012,"PRIMARY SCHOOL OKWALDI(TURE OKWALDI, DWANG)"
GOMBE,08,KWAMI,01,Bojude,001,"ELIF PRIMARY SCHOOL, BOJUDE (BABA DALA/KOFAR BABA DALA)"
GOMBE,08,KWAMI,01,Bojude,002,"IDI PRIMARY SCHOOL, BOJUDE (MADAKI/KOFAR MADAKI)"
GOMBE,08,KWAMI,01,Bojude,003,"PRIMARY SCHOOL, JORE (SARKIN JORE/KOFAR SARKIN JORE)"
GOMBE,08,KWAMI,01,Bojude,004,"PRIMARY SCHOOL, JAURO SOBA (JAURO SOBA/KPFAR JAURO SOBA)"
GOMBE,08,KWAMI,01,Bojude,005,"OPEN SPACE, JAURO KAWU VILLAGE (JAURO KAWU/KOFAR JAURO KAWU"
GOMBE,08,KWAMI,01,Bojude,006,"OPEN SPACE, MALAM BAPPAH VILLAGE (MALAM BAPPAH/KOFAR JAURO BAPPAH)"
GOMBE,08,KWAMI,01,Bojude,007,"POST OFFICE BOJUDE, (BABA DALA/KOFAR KOSUMA)"
GOMBE,08,KWAMI,01,Bojude,008,"OPEN SPACE, GABANNI/KOFAR SARKIN GABANNI)"
GOMBE,08,KWAMI,01,Bojude,009,PILOT PRIMARY SCHOOL (BAMAIYI I/KOFAR JAURO BAMAIYI)
GOMBE,08,KWAMI,01,Bojude,010,PILOT PRIMARY SCHOOL BAMAIYI II/KOFAR JAURO BAMAIYI
GOMBE,08,KWAMI,01,Bojude,011,"PRIMARY SCHOOL, DIRRI (TAFIDA MUSA/KOFAR TAFIDA MUSA"
GOMBE,08,KWAMI,01,Bojude,012,"DUROKONO, DUROKONO PRI. SCH."
GOMBE,08,KWAMI,01,Bojude,013,"OPEN SPACE, DIRI (DIRRI/KOFAR SARKIN DIRRI)"
GOMBE,08,KWAMI,01,Bojude,014,"JAURO MAUWADA, JAURO MAUWDA PRI. SCH."
GOMBE,08,KWAMI,01,Bojude,015,"OPEN SPACE, JAURO YAYA (JAURO YAYA/KOFAR JAURO YAYA"
GOMBE,08,KWAMI,01,Bojude,016,"PRIMARY SCHOOL, BELE (BELEL/KOFAR SARKIN BELEL"
GOMBE,08,KWAMI,01,Bojude,017,"PRIMARY SCHOOL, ZAMBE (ZAMBE/KOFAR SARKIN ZAMBE)"
GOMBE,08,KWAMI,02,Daban Fulani,001,"OPEN SPACE, UNGUWAN GALADIMA (UNG. GALADIMA/KOFAR GALADIMA)"
GOMBE,08,KWAMI,02,Daban Fulani,002,"CENTRAL PRIMARY D/FULANI, (UNG. MAKWALLA/KOFAR MUSA MALAM)"
GOMBE,08,KWAMI,02,Daban Fulani,003,"OPEN SPACE, UNGUWAN MAKWALLA (UNG. MAKWALLA/KOFAR MAI UNGUWA)"
GOMBE,08,KWAMI,02,Daban Fulani,004,"UNG. DAN BURAN, DABA PRI. SCH."
GOMBE,08,KWAMI,02,Daban Fulani,005,"UNG. YERIMA, MATERNITY"
GOMBE,08,KWAMI,02,Daban Fulani,006,"UNG. YERIMA, DABA PRI. SCH."
GOMBE,08,KWAMI,02,Daban Fulani,007,"OPEN SPACE JAURO YAYA VILLAGE, (JAURO YAYA/KOFAR JAURO YAYA)"
GOMBE,08,KWAMI,02,Daban Fulani,008,"OPEN SPACE, NASARAWA (NASARAWA/KOFAR JAURO YAYA)"
GOMBE,08,KWAMI,02,Daban Fulani,009,"OPEN SPACE, YERIMA KOFAR MAI UNG. (YERIMA/KOFAR MAI UNGUWA)"
GOMBE,08,KWAMI,02,Daban Fulani,010,"OPEN SPACE, DAN BURAM (DAN BURAM/KOFAR SARKIN DABA)"
GOMBE,08,KWAMI,02,Daban Fulani,011,"WURO JABE, WURO JABE PRI. SCH."
GOMBE,08,KWAMI,02,Daban Fulani,012,"OPEN SPACE, METTAKO (KOFAR MAI UNGUWA)"
GOMBE,08,KWAMI,02,Daban Fulani,013,"UNG. WAZIRI, PRIMARY SCHOOL"
GOMBE,08,KWAMI,02,Daban Fulani,014,"OPEN SPACE, MADAKI (KOFAR SHUGABA ADAMU)"
GOMBE,08,KWAMI,02,Daban Fulani,015,"HAMMA LULE, PRIMARY SCHOOL"
GOMBE,08,KWAMI,02,Daban Fulani,016,"OPEN SPACE, ARDO DABA (ARDO DABA/KOFAR AJI)"
GOMBE,08,KWAMI,02,Daban Fulani,017,"OPEN SPACE, ARDO DABA (ARDO DABAKOFAR ARDO DABA)"
GOMBE,08,KWAMI,02,Daban Fulani,018,"OPEN SPACE, WURO KOHA (METTA KOFAR JAURO YAYA)"
GOMBE,08,KWAMI,03,Doho,001,"WURO DOLE, WURO DOLE PRI. SCH."
GOMBE,08,KWAMI,03,Doho,002,"WURO DOLE, DISPENSARY"
GOMBE,08,KWAMI,03,Doho,003,"PRIMARY SCHOOL, DOHO (MAI UNG./KOFAR SARKIN DOHO)"
GOMBE,08,KWAMI,03,Doho,004,PRIMARY SCHOOL UNGUWAN YERIMA (MAI UNGUW./KOFAR AJIYA)
GOMBE,08,KWAMI,03,Doho,005,PRIMARY SCHOOL JAURO BELLO (JAURO BELLO/KOFAR JAURO BELLO)
GOMBE,08,KWAMI,03,Doho,006,"PRIMARY SCHOOL, UNGUWAN YERIMA (KOFAR GEREMA)"
GOMBE,08,KWAMI,03,Doho,007,"UNGUWAN GALADIMA, DOHO PRIMARY SCHOOL"
GOMBE,08,KWAMI,03,Doho,008,"UNG. YERIMA, MATERNITY"
GOMBE,08,KWAMI,03,Doho,009,"JALINGO, JALINGO PRI. SCH."
GOMBE,08,KWAMI,03,Doho,010,"MALKO, MALKO PRI. SCH."
GOMBE,08,KWAMI,03,Doho,011,"OPEN SPACE, SHARIFURI (SHARIFURI, KOFAR JAURO)"
GOMBE,08,KWAMI,03,Doho,012,"OPEN SPACE, JAURO GABDO (KOFAR JAURO GABDO)"
GOMBE,08,KWAMI,03,Doho,013,"LANTAIWA, KOFAR JAURO LANTAIWA"
GOMBE,08,KWAMI,03,Doho,014,"ALAGARNO, ALAGARNO PRI. SCH."
GOMBE,08,KWAMI,03,Doho,015,"WURO TARA, WURO TARA PRI. SCH."
GOMBE,08,KWAMI,03,Doho,016,"PRIMARY SCHOOL, ZANGOMA ABBA (KOFAR ZANGOMA ABBA)"
GOMBE,08,KWAMI,03,Doho,017,"OPEN SPACE, WURO TANNA, (JAURO AHMADU/WURO TANNA KOFAR JAURO)"
GOMBE,08,KWAMI,04,Dukul,001,OPEN SPACE YERIMA. (KOFAR SARKIN DUKKUL)
GOMBE,08,KWAMI,04,Dukul,002,"MADAKI, AREA COURT"
GOMBE,08,KWAMI,04,Dukul,003,"GAJI BAUCHI, GAJI BAUCHI PRI. SCH."
GOMBE,08,KWAMI,04,Dukul,004,PRIMARY SCHOOL DUKKUL (SITTAMANE/KOFAR JAURO)
GOMBE,08,KWAMI,04,Dukul,005,PRIMARY SCHOOL JADA DUKKUL (JADA DUKUL)
GOMBE,08,KWAMI,04,Dukul,006,"YERIMA, DISPENSARY"
GOMBE,08,KWAMI,04,Dukul,007,PRIMARY SCHOOL WALAMA (WALAMA)
GOMBE,08,KWAMI,04,Dukul,008,PRIMARY SCHOOL GAFARA GALADIMA (KOFAR GAFARA GALADIMA)
GOMBE,08,KWAMI,04,Dukul,009,PRIMARY SCHOOL SHANNIN FULANI (KOFAR JAURO SHANNIN FULANI
GOMBE,08,KWAMI,04,Dukul,010,PRIMARY SCHOOL SHANNIN TERA (KOFAR SHANNIN FULANI
GOMBE,08,KWAMI,04,Dukul,011,"PRIMARY SCHOOL, GAFARA MADAKI (GAFARA MADAKI)"
GOMBE,08,KWAMI,04,Dukul,012,PRIMARY SCHOOL GWARAM (WARAM KALAGARI)
GOMBE,08,KWAMI,04,Dukul,013,"PRIMARY SCHOOL, KALAGARI (KALAGARI (KALAGARI ARI KIME K/J)"
GOMBE,08,KWAMI,04,Dukul,014,"PRIMARY SCHOOL, BUSUM (KOFAR JAURO BUSUM)"
GOMBE,08,KWAMI,04,Dukul,015,"ALLUGER, DISPENSARY"
GOMBE,08,KWAMI,04,Dukul,016,OPEN SPACE DINAWA (DINAWA)
GOMBE,08,KWAMI,04,Dukul,017,"PRIMARY SCHOOL, NJOKHIRE (KOFAR JAURO NJOKHIRE)"
GOMBE,08,KWAMI,04,Dukul,018,"WURO JOHE, WURO JOHE PRI. SCH."
GOMBE,08,KWAMI,04,Dukul,019,"PRIMARY SCHOOL, BAGADU (KOFAR JAURO BAGADU)"
GOMBE,08,KWAMI,04,Dukul,020,"BULTURI, BULTURI PRI. SCH."
GOMBE,08,KWAMI,04,Dukul,021,"BIRIBUTU, BIRIBUTU PRI. SCH."
GOMBE,08,KWAMI,04,Dukul,022,"PRIMARY SCHOOL, KOFAR JAURO BAGOGGO (KOFAR JAURO YAYA BAGOGGO)"
GOMBE,08,KWAMI,05,Gadam,001,"KOBOZO, KOBOZO PRI. SCH."
GOMBE,08,KWAMI,05,Gadam,002,"BAFUYA, BAFUYA PRI. SCH."
GOMBE,08,KWAMI,05,Gadam,003,"PRIMARY SCHOOL, GAMADADI (/ KOFAR JAURO BAITA )"
GOMBE,08,KWAMI,05,Gadam,004,PRI. SCH. ZANGOMA GAJI (KOFAR JAURO YABU)
GOMBE,08,KWAMI,05,Gadam,005,"OPEN SPACE, BAMAIYI (BAMIYI BIRIN)"
GOMBE,08,KWAMI,05,Gadam,006,"BULAMA DAUDA, SABON GADAM PRI. SCH."
GOMBE,08,KWAMI,05,Gadam,007,PRI. SCH. GANJUWA (GANJUWA)
GOMBE,08,KWAMI,05,Gadam,008,PRI. SCH. NGAJI ( KOFAR SARKIN DAWO)
GOMBE,08,KWAMI,05,Gadam,009,OPEN SPACE NGAJI MAJJORU (KOFAR JAURO ABDU)
GOMBE,08,KWAMI,05,Gadam,010,"OPEN SPACE, NGAJI MAJJORU (KOFAR JAURO GAMBO)"
GOMBE,08,KWAMI,05,Gadam,011,"BABADALA, MATERNITY"
GOMBE,08,KWAMI,05,Gadam,012,"OPEN SPACE, BABA DALA (BABA DALA/KOFAR BABA DALA)"
GOMBE,08,KWAMI,05,Gadam,013,PRI.SCH. YELWA YAME (KOFAR YELWA YAME)
GOMBE,08,KWAMI,05,Gadam,014,PRI. SCH. YELWA TAFIDA (KOFAR YELWA TAFIDA)
GOMBE,08,KWAMI,05,Gadam,015,PRI. SCH. TAPPI (UNG. CHIROMA/KOFAR CHIROMA TAPPI)
GOMBE,08,KWAMI,05,Gadam,016,PRI. SCH. KALAJANGA ( KOFAR SARKIN KALAJANGA)
GOMBE,08,KWAMI,05,Gadam,017,"BOMALA, BOMALA PRI. SCH."
GOMBE,08,KWAMI,05,Gadam,018,"OPEN SPACE, TAPPI ( YELWA UMARU/KOFAR YELWA UMARU )"
GOMBE,08,KWAMI,05,Gadam,019,PRI. SCH.SARKIN TAPPI (KOFAR SARKIN TAPPI )
GOMBE,08,KWAMI,05,Gadam,020,"OPEN SPACE, ZANGOMA ADAMU VILLAGE (ZANGOMA ADAMU)"
GOMBE,08,KWAMI,05,Gadam,021,MATERNITY TAPPI ( KOFAR BABA DALA )
GOMBE,08,KWAMI,05,Gadam,022,"WURO DOLE, WURO DOLE PRI. SCH."
GOMBE,08,KWAMI,05,Gadam,023,PRI. SCH. KALAJANGA (MALAM BAPPAH/KOFAR MALAM BAPPAH )
GOMBE,08,KWAMI,05,Gadam,024,"OPEN SPACE, TEDO GADAM (KOFAR MAI UNG. KOSUMA)"
GOMBE,08,KWAMI,06,Jurara,001,"SARKIN JURARA, JURARA DISPENSARY"
GOMBE,08,KWAMI,06,Jurara,002,"OPEN SPACE, JAURO BOSE (KOFAR JAURO BOSE"
GOMBE,08,KWAMI,06,Jurara,003,"PRIMARY SCHOOL, JAURO ISA (KOFAR JAURO ISAH)"
GOMBE,08,KWAMI,06,Jurara,004,"MARKET, JURARA (KOFAR SARKIN JURARA)"
GOMBE,08,KWAMI,06,Jurara,005,"JURARA, JURARA PRI. SCH."
GOMBE,08,KWAMI,06,Jurara,006,PRI. SCH. JAURO GAMBO (KOFAR JAURO GAMBO
GOMBE,08,KWAMI,06,Jurara,007,"JAURO BOSE, JAURO BOSE PRI. SCH."
GOMBE,08,KWAMI,06,Jurara,008,"OPEN SPACE, JAURO BOSE (MALAM KACHALLA/KOFAR JAURO MAI GORO)"
GOMBE,08,KWAMI,07,Komfulata,001,"PRIMARY SCHOOL, DAMBA BARDE (KOFAR SARKIN DAMBA BARDE)"
GOMBE,08,KWAMI,07,Komfulata,002,PRI. SCH. BOMALA (KOFAR MAI UNG. BOMALA)
GOMBE,08,KWAMI,07,Komfulata,003,PRI. SCH. BOMALA J. HAMIDU (KOFAR J. HAMIDU)
GOMBE,08,KWAMI,07,Komfulata,004,PRI. SCH. JAURO MALAM (JAURO MALAM/KOFAR JAURO)
GOMBE,08,KWAMI,07,Komfulata,005,"PRIMARY SCHOOL, DINAWA BAKKA (KOFAR JAURO DINAWA BAKKA)"
GOMBE,08,KWAMI,07,Komfulata,006,"OPEN SPACE, GARIN WAKILI (KOFAR JAURO GARIN WAKILI)"
GOMBE,08,KWAMI,07,Komfulata,007,"BULA BARDE, BULA PRI. SCH."
GOMBE,08,KWAMI,07,Komfulata,008,PRI. SCH. GARIN ABBAS (KOFAR JAURO GARIN ABBAS)
GOMBE,08,KWAMI,07,Komfulata,009,"GABUKA, GABUKKA PRI. SCH."
GOMBE,08,KWAMI,07,Komfulata,010,OPEN SPACE GARIN BUNU (KOFAR JAURO GARIN BUNU)
GOMBE,08,KWAMI,07,Komfulata,011,"PRIMARY SCHOOL, DOKARI (KOFAR JAURO DOKARI)"
GOMBE,08,KWAMI,07,Komfulata,012,"OPEN SPACE, JADA (KOFAR JAURO JADA)"
GOMBE,08,KWAMI,07,Komfulata,013,PRI. SCH. JAMJI I (KOFAR SARKIN JAMJI I)
GOMBE,08,KWAMI,07,Komfulata,014,PRI. SCH. JAMJI II (KOFAR SARKIN JAMJI II)
GOMBE,08,KWAMI,07,Komfulata,015,"JAMJI I, JAMJI PRI. SCH."
GOMBE,08,KWAMI,07,Komfulata,016,"JAMJI II, JAMJI PRI. SCH."
GOMBE,08,KWAMI,07,Komfulata,017,PRI. SCH. JAMJI ZANGOMA AMSANI (KOFAR JAURO AMSANI)
GOMBE,08,KWAMI,07,Komfulata,018,"SHONG S / YAKI, SHONGO PRI. SCH."
GOMBE,08,KWAMI,07,Komfulata,019,PRI. SCH. MANGA (KOFAR JAURO MANGA)
GOMBE,08,KWAMI,07,Komfulata,020,"PRI. SCH., YARO (KOFAR JAURO YARO)"
GOMBE,08,KWAMI,07,Komfulata,021,"OPEN SPACE, TUGUJI (KOFAR JAURO TUGUJI)"
GOMBE,08,KWAMI,07,Komfulata,022,"OPEN SPACE DALLI (MALAM DALLI, KOFAR MALAM DALLI)"
GOMBE,08,KWAMI,07,Komfulata,023,PRI. SCH. ALKALI (KOFAR JAURO GARIN ALKALI)
GOMBE,08,KWAMI,07,Komfulata,024,"OPEN SPACE, GARIN YUGUDA (KOFAR JAURO YUGUDA)"
GOMBE,08,KWAMI,07,Komfulata,025,"OPEN SPACE, WUDIL (KOFAR JAURO WUDIL)"
GOMBE,08,KWAMI,07,Komfulata,026,PRI. SCH. DANIYA SARKI (KOFAR SARKI DANIYA)
GOMBE,08,KWAMI,07,Komfulata,027,"OPEN SPACE DANIYA SARKI, (KOFAR JAURO DANIYA SARKI)"
GOMBE,08,KWAMI,07,Komfulata,028,"SARKIN DINAWA, DINAWA PRI. SCH."
GOMBE,08,KWAMI,07,Komfulata,029,"OPEN SPACE, BAPPATE (KOFAR JAURO BAPPATE)"
GOMBE,08,KWAMI,07,Komfulata,030,"PRI. SCH. GARIN DALA, (KOFAR DALA BAFETO)"
GOMBE,08,KWAMI,07,Komfulata,031,PRI. SCH. DINAWA PANTAMI (KOFAR JAURO DINAWA PANTAMI)
GOMBE,08,KWAMI,07,Komfulata,032,"SARKIN KOM, KOM DISPENSARY"
GOMBE,08,KWAMI,07,Komfulata,033,PRI. SCH. GIRGAM (KOFAR SARKI GIRGAM)
GOMBE,08,KWAMI,07,Komfulata,034,PRI. SCH. KAN GIWA (KOFAR SARKI KAN GIWA)
GOMBE,08,KWAMI,07,Komfulata,035,"BEMI, BEMI MATERNITY"
GOMBE,08,KWAMI,07,Komfulata,036,PRI. SCH. DUMBONA (DUMBONA)
GOMBE,08,KWAMI,07,Komfulata,037,"PRI. SCH., BAPPAH TUKUR (KOFAR JAURO BAPPAH TUKUR)"
GOMBE,08,KWAMI,07,Komfulata,038,"OPEN SPACE, ABBA NANANI (KOFAR MAI UNG.)"
GOMBE,08,KWAMI,08,Kwami,001,PRI. SCH. KWAMI (KOFAR SARKI KWAMI)
GOMBE,08,KWAMI,08,Kwami,002,"TUDUN WADA, PRI. SCH. KWAMI"
GOMBE,08,KWAMI,08,Kwami,003,"BABA DALA, KWAMI PRI. SCH."
GOMBE,08,KWAMI,08,Kwami,004,PRI. SCH. PAWO (KOFAR GALADIMA)
GOMBE,08,KWAMI,08,Kwami,005,PRI. SCH. SHONGO DIRANGO (SHONGO DIRANGO)
GOMBE,08,KWAMI,08,Kwami,006,PRI. SCH. GIREMA (KOFAR GALADIMA)
GOMBE,08,KWAMI,08,Kwami,007,"BABADALA, KWAMI PRI. SCH."
GOMBE,08,KWAMI,08,Kwami,008,PRI. SCH. SABON KULUM (KOFAR SARKI KULUM)
GOMBE,08,KWAMI,08,Kwami,009,"ZONGOMA MAMMAN, ZONGOMZA PRI. SCH."
GOMBE,08,KWAMI,08,Kwami,010,PRI. SCH. GANJUWA (KOFAR SARKIN GANJUWA)
GOMBE,08,KWAMI,08,Kwami,011,PRI. SCH. SARKIN NOMA KULUM (KOFAR SARKIN NOMA KULUM)
GOMBE,08,KWAMI,08,Kwami,012,PRI. SCH. YERIMA KAGUM (KOFAR YERIMA KAGUM)
GOMBE,08,KWAMI,08,Kwami,013,PRI. SCH. SHANGA YARI (KOFAR SHANGA YARI)
GOMBE,08,KWAMI,08,Kwami,014,"TITI, TITI PRI. SCH."
GOMBE,08,KWAMI,08,Kwami,015,"PRIMARY SCHOOL, YERIMA GOJE (KOFAR YERIMA GOJE)"
GOMBE,08,KWAMI,08,Kwami,016,PRI. SCH. WURO BUNDU (KOFAR JAURO)
GOMBE,08,KWAMI,08,Kwami,017,PRI. SCH. YERIMA GAMBONI (KOFAR YERIMA GAMBONI)
GOMBE,08,KWAMI,08,Kwami,018,PRI. SCH. JAURO DALIL (KOFAR JAURO DALIL)
GOMBE,08,KWAMI,08,Kwami,019,PRI. SCH. ARDO ABDU (KOFAR J. ARDO)
GOMBE,08,KWAMI,08,Kwami,020,PRI. SCH. SABON GARIN KWAMI (KOFAR JAURO)
GOMBE,08,KWAMI,08,Kwami,021,PRI. SCH. TALE (KOFAR JAURO TALE)
GOMBE,08,KWAMI,08,Kwami,022,"GARIN WAKILI, GARIN WAKILI PRI. SCH."
GOMBE,08,KWAMI,08,Kwami,023,PRI. SCH. YANKARI (KOFAR SARKIN YANKARI)
GOMBE,08,KWAMI,08,Kwami,024,PRI. SCH. MALAM JAMJI MADUKELUM (MADUKELUM)
GOMBE,08,KWAMI,08,Kwami,025,PRI. SCH. MALAM MAJI (MALAM MAJI)
GOMBE,08,KWAMI,08,Kwami,026,PRI. SCH. GALADIMA GERKWAMI (KOFAR GALADIMA)
GOMBE,08,KWAMI,08,Kwami,027,"KOLORI, KOLORI PRI. SCH."
GOMBE,08,KWAMI,08,Kwami,028,"SARKIN KUFAYI, KUFAYI DISPENSARY"
GOMBE,08,KWAMI,08,Kwami,029,"GERKWAMI, GERKWAMI PRI. SCH."
GOMBE,08,KWAMI,08,Kwami,030,PRI. SCH. KUFAYI (GALADIMA/ KOFAR JAURO)
GOMBE,08,KWAMI,09,Malam Sidi,001,"OPEN SPACE, MAI UNG. MADU (KOFAR MADUGU)"
GOMBE,08,KWAMI,09,Malam Sidi,002,"ECC NURSERY, MALAM SIDI (KOFAR YERIMA)"
GOMBE,08,KWAMI,09,Malam Sidi,003,"KOFAR AJIYA, M/ SIDI PRI. SCH."
GOMBE,08,KWAMI,09,Malam Sidi,004,"KOFAR AJIYA, M/ SIDI AREA COURT"
GOMBE,08,KWAMI,09,Malam Sidi,005,OPEN SPACE MADAKI JAMJI (KOFAR JAURO)
GOMBE,08,KWAMI,09,Malam Sidi,006,"ADULT EDUC. OFFICE, KOFAR AJIYA (KOFAR AJIYA, ADULT EDUC. OFFICE)"
GOMBE,08,KWAMI,09,Malam Sidi,007,OPEN SPACE GARIN JAURO BAYO (KOFAR JAURO BAYO)
GOMBE,08,KWAMI,09,Malam Sidi,008,"ZANGOMA KURUGU, KURUGU PRI. SCH."
GOMBE,08,KWAMI,09,Malam Sidi,009,"MADUGU YASHI, MADUGU YASHI PRI. SCH."
GOMBE,08,KWAMI,09,Malam Sidi,010,PRI. SCH. MAGUMARI (KOFAR SARKIN MAGUMARI)
GOMBE,08,KWAMI,09,Malam Sidi,011,"ZANGOMA KYARI, ZANGOMA PRI. SCH."
GOMBE,08,KWAMI,09,Malam Sidi,012,PRI. SCH. KYARI (KOFAR SARKIN KYARI)
GOMBE,08,KWAMI,09,Malam Sidi,013,PRI. SCH. NAHUTA KANURI (KOFAR J. NAHUTA)
GOMBE,08,KWAMI,09,Malam Sidi,014,"OPEN SPACE, JAURO AHMADU (KOFAR JAURO AHMADU)"
GOMBE,08,KWAMI,09,Malam Sidi,015,PRI. SCH. SABON GARI (KOFAR J. SABON GARI)
GOMBE,08,KWAMI,09,Malam Sidi,016,"OPEN SPACE, TANNA (KOFAR TANNA)"
GOMBE,08,KWAMI,09,Malam Sidi,017,"OPEN SPACE, MAJERI (KOFAR MAJERI)"
GOMBE,08,KWAMI,09,Malam Sidi,018,OPEN SPACE ZANGOMA (ZANGOMA WEST)
GOMBE,08,KWAMI,09,Malam Sidi,019,"OPEN SPACE, BUKATI (KOFAR BUKKATI)"
GOMBE,08,KWAMI,09,Malam Sidi,020,PRI. SCH. DAWAKI (KOFAR JAURO DAWAKI)
GOMBE,08,KWAMI,09,Malam Sidi,021,"KURUGU ( MALAM TAFIDA), PRI. SCH."
GOMBE,08,KWAMI,10,Malleri,001,PRI. SCH. CHIROMA (KOFAR CHIROMA)
GOMBE,08,KWAMI,10,Malleri,002,"MADAKI, MALLERI PRI. SCH."
GOMBE,08,KWAMI,10,Malleri,003,PRI. SCH. MASURI (KOFAR MASURI)
GOMBE,08,KWAMI,10,Malleri,004,PRI. SCH. YERIMA (KOFAR YERIMA)
GOMBE,08,KWAMI,10,Malleri,005,"GALADIMA, DISPENSARY"
GOMBE,08,KWAMI,10,Malleri,006,PRI. SCH. MAKERA (KOFAR MAKERA)
GOMBE,08,KWAMI,10,Malleri,007,PRI. SCH. YAYARI (KOFAR ALH. YAYARI)
GOMBE,08,KWAMI,10,Malleri,008,PRI. SCH. JAURO TINDA (KOFAR J. TINDA)
GOMBE,08,KWAMI,10,Malleri,009,PRI. SCH. KOFAR JAURO HAJI (K/J HAJI)
GOMBE,08,KWAMI,10,Malleri,010,PRI. SCH. TINDA BAPPAH (KOFAR JAURO BAPPAH)
GOMBE,08,KWAMI,10,Malleri,011,OPEN SPACE TINDA SABUWA (KOFAR J. SABUWA)
GOMBE,08,KWAMI,10,Malleri,012,PRI. SCH. FESHARE (KOFAR JAURO BABA)
GOMBE,09,NAFADA,01,Barwo / Nasarawo,001,"LAYIN FADA,OPEN SPACE"
GOMBE,09,NAFADA,01,Barwo / Nasarawo,002,"UNG. MADAKI, PRI. SCHOOL"
GOMBE,09,NAFADA,01,Barwo / Nasarawo,003,"BARWO NASARAWO,PRI.SCH"
GOMBE,09,NAFADA,01,Barwo / Nasarawo,004,"BARWO SABON GARI VILLAGE I,OPEN SPACE"
GOMBE,09,NAFADA,01,Barwo / Nasarawo,005,"BARWO SABON GARI VILLAGE II,OPEN SPACE"
GOMBE,09,NAFADA,01,Barwo / Nasarawo,006,"KANJI,HEALTH CENTRE OPEN SPACE"
GOMBE,09,NAFADA,01,Barwo / Nasarawo,007,"WAKKALATU,PRIMARY SCH."
GOMBE,09,NAFADA,01,Barwo / Nasarawo,008,"KUKAWARI VILLAGE,OPEN SPACE"
GOMBE,09,NAFADA,01,Barwo / Nasarawo,009,"FESHINGO VILLAGE,OPEN SPACE"
GOMBE,09,NAFADA,01,Barwo / Nasarawo,010,"LAFIYAWO VILLAGE,OPEN SPACE"
GOMBE,09,NAFADA,01,Barwo / Nasarawo,011,"ZADAWA VILLAGE,OPEN SPACE"
GOMBE,09,NAFADA,01,Barwo / Nasarawo,012,"DADINKOWA VILLAGE,OPEN SPACE"
GOMBE,09,NAFADA,01,Barwo / Nasarawo,013,"LUMPUTI VILLAGE,OPEN SPACE"
GOMBE,09,NAFADA,02,Barwo Winde,001,"BARWOWINDE, PRIMARY SCHOOL (UNGUWAN MADAKI)"
GOMBE,09,NAFADA,02,Barwo Winde,002,"LAYIN GALADIMA, OPEN SPACE (UNGUWAN GALADIMA KOFAR GALADIMA)"
GOMBE,09,NAFADA,02,Barwo Winde,003,UNG. MADAKI / PRIMARY SCHOOL
GOMBE,09,NAFADA,02,Barwo Winde,004,"GANIYANA VILLAGE, OPEN SPACE (GANIYANA KOFAR SARKI)"
GOMBE,09,NAFADA,02,Barwo Winde,005,"KAKIYAWA VILLAGE, OPEN SPACE (KAKIYAWA KOFAR SARKI)"
GOMBE,09,NAFADA,02,Barwo Winde,006,"ZADAWA VILLAGE, OPEN SPACE (ZADAWA KOFAR SARKI)"
GOMBE,09,NAFADA,02,Barwo Winde,007,"LAYIN MALLAM GIDADO, OPEN SPACE (GURIYA KOFAR MALLAM GIDADO"
GOMBE,09,NAFADA,02,Barwo Winde,008,"DABA VILLAGE, OPEN SPACE (DABA KOFAR SARKI)"
GOMBE,09,NAFADA,02,Barwo Winde,009,"WURO JABBI, PRIMARY SCHOOL I, (WURO JABBI KOFAR SARKI)"
GOMBE,09,NAFADA,02,Barwo Winde,010,"WURO JABBI, PRIMARY SCHOOL II, (WURO JABBI KOFAR JAURO)"
GOMBE,09,NAFADA,02,Barwo Winde,011,"WURO JULI VILLAGE, OPEN SPACE (WURO JULI KOFAR JAURO MUSA"
GOMBE,09,NAFADA,03,Birin Bolewa,001,"BIRIN BOLEWA NORTH, PRIMARY SCHOOL (UNGUWAN GALADIMA KOFAR GALADIMA)"
GOMBE,09,NAFADA,03,Birin Bolewa,002,"BIRIN BOLEWA, PRIMARY SCHOOL (UNGUWAN DAWAKI KOFAR CHIROMA)"
GOMBE,09,NAFADA,03,Birin Bolewa,003,"BURARI, PRIMARY SCHOOL (BURARI KOFAR JAURO BURARI)"
GOMBE,09,NAFADA,03,Birin Bolewa,004,"TASHAN KARGO, PRIMARY SCHOOL (TASHAN KARGO KOFAR JAURO ALI)"
GOMBE,09,NAFADA,03,Birin Bolewa,005,"WURO ABBA VILLAGE, OPEN SPACE (WURO ABBA KOFAR ALHAJI MANU)"
GOMBE,09,NAFADA,03,Birin Bolewa,006,"GULMARI VILLAGE, OPEN SPACE (GULMARI KOFAR SARKI)"
GOMBE,09,NAFADA,03,Birin Bolewa,007,"DANGE VILLAGE, OPEN SPACE (DANGE KOFAR JAURO ABBA)"
GOMBE,09,NAFADA,03,Birin Bolewa,008,"MUNDA, PRIMARI SCHOOL (MUNDA KOFAR JAURO MUNDA)"
GOMBE,09,NAFADA,03,Birin Bolewa,009,"MAIDUKURI, PRIMARY SCHOOL (MAIDUKURI KOFAR SARKI)"
GOMBE,09,NAFADA,03,Birin Bolewa,010,"DANGE VILLAGE II, OPEN SPACE (DANGE KOFAR JAURO DURA)"
GOMBE,09,NAFADA,03,Birin Bolewa,011,"KUNKURURI VILLAGE, OPEN SPACE (DAWAKI KOFAR JAURO GIMBA)"
GOMBE,09,NAFADA,03,Birin Bolewa,012,"GOVERNMENT DAY SECONDARY SCHOOL, BIRIN BOLEWA (DAWAKI KOFAR JAURO DAWAKI)"
GOMBE,09,NAFADA,03,Birin Bolewa,013,"MADAKIRI VILLAGE, OPEN SPACE (MADAKIRI KOFAR JAURO GARBA)"
GOMBE,09,NAFADA,03,Birin Bolewa,014,"ABBA ISARI VILLAGE, OPEN SPACE (ABBA ISARI KOFAR MAI ISARI)"
GOMBE,09,NAFADA,04,Birin Fulani East,001,"BIRIN FULANI EAST, DISPENSARY, OPEN SPACE (UNGUWAN GALADIMA KOFAR UBANDOMA)"
GOMBE,09,NAFADA,04,Birin Fulani East,002,"UNG. BARDE, PRIMARY SCHOOL"
GOMBE,09,NAFADA,04,Birin Fulani East,003,"LAYIN KASUWA, OPEN SPACE (UNGUWAN UBANDOMA KOFAR SARKI)"
GOMBE,09,NAFADA,04,Birin Fulani East,004,"SODINGO, PRIMARY SCHOOL"
GOMBE,09,NAFADA,04,Birin Fulani East,005,"SORODO VILLAGE, OPEN SPACE (SORODO KOFAR JAURO GANI)"
GOMBE,09,NAFADA,04,Birin Fulani East,006,"GURAJAWA VILLAGE, OPEN SPACE (GURAJAWA KOFAR MALAM ABDU)"
GOMBE,09,NAFADA,04,Birin Fulani East,007,"GADI VILLAGE, OPEN SPACE (GADI KOFAR JAURO GADI)"
GOMBE,09,NAFADA,04,Birin Fulani East,008,"LUMBO DASHI VILLAGE, OPEN SPACE (LUMBO DASHI KOFAR JAURO)"
GOMBE,09,NAFADA,05,Birin Fulani West,001,"UNG. MADAKI, VETERINARY OFFICE"
GOMBE,09,NAFADA,05,Birin Fulani West,002,"WURO BUNDU VILLAGE, OPEN SPACE (WURO BUNDU KOFAR JAURO ASHAU)"
GOMBE,09,NAFADA,05,Birin Fulani West,003,"SHAGANAWA I, PRIMARY SCHOOL (SHAGANAWA 1 KOFAR JAURO USMAN)"
GOMBE,09,NAFADA,05,Birin Fulani West,004,"SHAGANAWA II, PRIMARY SCHOOL (SHAGANAWA II KOFAR JAURO AHMADU)"
GOMBE,09,NAFADA,05,Birin Fulani West,005,"MADAKI LAMU, PRIMARY SCHOOL (MADAKI LAMU WAGULE KOFAR JAURO AHMADU)"
GOMBE,09,NAFADA,05,Birin Fulani West,006,"DABA VILLAGE, OPEN SPACE (DABA KOFAR JAURO JUNGUDO)"
GOMBE,09,NAFADA,05,Birin Fulani West,007,"BIRIN FULANI WEST, PRIMARY SCHOOL, (WALI KOFAR JAURO ABDULKADIR)"
GOMBE,09,NAFADA,05,Birin Fulani West,008,"JAURO ALHAJI, PRIMARY SCHOOL, (JAURO ALHAJI KOFAR JAURO ALHAJI)"
GOMBE,09,NAFADA,06,Gudukku,001,"GUDUKKU, PRIMARY SCHOOL OPEN SPACE I (UNGUWAN CHIROMA KOFAR SARKI)"
GOMBE,09,NAFADA,06,Gudukku,002,"GUDUKKU, PRIMARY SCHOOL OPEN SPACE II (UNGUWAN UBANDOMA KOFAR UBANDOMA)"
GOMBE,09,NAFADA,06,Gudukku,003,"GASHINGE, PRIMARY SCHOOL (GASHINGE KOFAR JAURO ADAMU)"
GOMBE,09,NAFADA,06,Gudukku,004,"WURO BEGE VILLAGE, OPEN SPACE (WURO BEGE KOFAR JAURO MOHAMMED)"
GOMBE,09,NAFADA,06,Gudukku,005,"GADUM VILLAGE, OPEN SPACE (GADUM KOFAR JAURO SAIDU)"
GOMBE,09,NAFADA,06,Gudukku,006,"LARISKI VILLAGE, OPEN SPACE (LARISKI KOFAR JAURO IDRISA)"
GOMBE,09,NAFADA,06,Gudukku,007,"WALOWAL VILLAGE, OPEN SPACE (WALOWAL KOFAR JAURO AHMADU)"
GOMBE,09,NAFADA,06,Gudukku,008,"YELWA VILLAGE, OPEN SPACE (YELWA KOFAR JAURO USMAN)"
GOMBE,09,NAFADA,06,Gudukku,009,"ZANGE, PRIMARY SCHOOL (ZANGE SULE KOFAR JAURO ALI)"
GOMBE,09,NAFADA,06,Gudukku,010,"GARIN ZANGE VILLAGE, OPEN SPACE (GARIN ZANGI KOFAR JAURO MAIDABARA)"
GOMBE,09,NAFADA,06,Gudukku,011,"SABON SARA VILLAGE, OPEN SPACE (SABON SARA/SABON SARA)"
GOMBE,09,NAFADA,07,Jigawa,001,"GIDAN BAKI,OPEN SPACE (UNGUWAN YERIMA KOFAR SARKI)"
GOMBE,09,NAFADA,07,Jigawa,002,"KUKA, PRIMARY SCHOOL, (KUKA KOFAR JAURO SARKI)"
GOMBE,09,NAFADA,07,Jigawa,003,"TAKAI, PRIMARY SCHOOL, (TAKAI KOFAR JAURO BOKA)"
GOMBE,09,NAFADA,07,Jigawa,004,"DENDELE, PRIMARY SCHOOL I, (DENDELE KOFAR SARKI)"
GOMBE,09,NAFADA,07,Jigawa,005,"DENDELE, PRIMARY SCHOOL II, (DENDELE KOFAR DENDELE)"
GOMBE,09,NAFADA,07,Jigawa,006,"SUKO, PRIMARY SCHOOL (SUKO KOFAR JAURO YAHAI)"
GOMBE,09,NAFADA,07,Jigawa,007,"GUDUKKU YAMMA VILLAGE, OPEN SPACE (GUDUKKU YAMMA KOFAR SARKI GUDUKKU)"
GOMBE,09,NAFADA,07,Jigawa,008,"KIYAYO, PRIMARY SCHOOL (KIYAYO KOFAR SARKI)"
GOMBE,09,NAFADA,07,Jigawa,009,"GOVERNMENT DAY SECONDARY SCHOOL JOLLE I, (JOLLE KOFAR SARKI)"
GOMBE,09,NAFADA,07,Jigawa,010,"GOVERNMENT DAY SECONDARY SCHOOL JOLLE II, (JOLLE KOFAR MADAKI)"
GOMBE,09,NAFADA,07,Jigawa,011,"JIGAWA, PRIMARY SCHOOL, (UNGUWAN YERIMA KOFAR SARKINFAWA)"
GOMBE,09,NAFADA,07,Jigawa,012,"JANGAMA VILLAGE, OPEN SPACE (JANGAMA KOFAR JAURO JANGAMA)"
GOMBE,09,NAFADA,07,Jigawa,013,"LANGE VILLAGE, OPEN SPACE (LANGE KOFAR JAURO LANGE)"
GOMBE,09,NAFADA,08,Nafada Central,001,"BAKIN KASUWA, OPEN SPACE (UNGUWAN MADAKI KOFAR MADAKI)"
GOMBE,09,NAFADA,08,Nafada Central,002,"LAYIN DISTRICT HEAD OFFICE, OPEN SPACE (UNGUWAN MADAKI DISTRICT HEAD OFFICE)"
GOMBE,09,NAFADA,08,Nafada Central,003,"NJALKAM, PRIMARY SCHOOL (NJALKAM KOFAR JAURO IDRISA)"
GOMBE,09,NAFADA,08,Nafada Central,004,"PAPA, PRIMARY SCHOOL I, (PAPA KOFAR JAURO MUSA)"
GOMBE,09,NAFADA,08,Nafada Central,005,"YABULAS, PRIMARY SCHOOL, (YABULAS KOFAR JAURO ALI)"
