state,lga_code,lga_name,ward_code,ward_name,pu_code,pu_name
GOMBE,05,FUNAKAYE,09,Tongo,015,"WURO DOLE, KOFAR JAURO"
GOMBE,05,FUNAKAYE,09,Tongo,016,"GERENGI, KOFAR JAURO"
GOMBE,05,FUNAKAYE,09,Tongo,017,"NGOL KATARI, KOFAR JAURO"
GOMBE,05,FUNAKAYE,09,Tongo,018,"WURO KOHEL, JAURO ALKALI"
GOMBE,05,FUNAKAYE,10,Wawa / Wakkulutu,001,"UNG. MADAKI WAWA, PRIMARY SCHOOL"
GOMBE,05,FUNAKAYE,10,Wawa / Wakkulutu,002,"UNG. GALADIMA, KOFAR GALADIMA"
GOMBE,05,FUNAKAYE,10,Wawa / Wakkulutu,003,"UNG. FULANI, KOFAR MAI UNG."
GOMBE,05,FUNAKAYE,10,Wawa / Wakkulutu,004,"UNG. SARKI YAKI, KOFAR SARKI YAKI"
GOMBE,05,FUNAKAYE,10,Wawa / Wakkulutu,005,"KOMI BOLEWA, PRIMARY SCHOOL"
GOMBE,05,FUNAKAYE,10,Wawa / Wakkulutu,006,"KOMI BOLEWA, KOFAR SARKI"
GOMBE,05,FUNAKAYE,10,Wawa / Wakkulutu,007,"ZONGOMA KARI, KOFAR SARKI"
GOMBE,05,FUNAKAYE,10,Wawa / Wakkulutu,008,"ZONGOMA KARI, PRIMARY SCHOOL"
GOMBE,05,FUNAKAYE,10,Wawa / Wakkulutu,009,"WAKKALTU, PRIMARY SCHOOL"
GOMBE,05,FUNAKAYE,10,Wawa / Wakkulutu,010,"UNG. GALADIMA, KOFAR GALADIMA"
GOMBE,05,FUNAKAYE,10,Wawa / Wakkulutu,011,"ZAZIMARI, KOFAR JAURO"
GOMBE,05,FUNAKAYE,10,Wawa / Wakkulutu,012,"BOGGA REDUWA, KOFAR JAURO"
GOMBE,05,FUNAKAYE,10,Wawa / Wakkulutu,013,"GARIN ALKALI, KOFAR JAURO"
GOMBE,05,FUNAKAYE,10,Wawa / Wakkulutu,014,"KOMI KUFAYI, KOFAR HARUNA"
GOMBE,06,GOMBE,01,Ajiya,001,"AJIYA, KOFAR AJIYA"
GOMBE,06,GOMBE,01,Ajiya,002,"AJIYA, KOFAR MADAKI"
GOMBE,06,GOMBE,01,Ajiya,003,"DOMA AREA COURT, DOMA AREA COURT"
GOMBE,06,GOMBE,01,Ajiya,004,"USMAN TELA, STATE LIBRARY"
GOMBE,06,GOMBE,01,Ajiya,005,"GIDA SARKI, LOCAL GOV'T. SECRETARIAT"
GOMBE,06,GOMBE,01,Ajiya,006,"GIDAN SARKI, KOFAR KAWUNI"
GOMBE,06,GOMBE,01,Ajiya,007,"MUSA SHONGO, KOFAR MUSA SHONGO"
GOMBE,06,GOMBE,02,Bajoga,001,"JIBIR DUKKU, BUS STOP"
GOMBE,06,GOMBE,02,Bajoga,002,"BABAYO BELLO, IDI PRIMARY SCHOOL"
GOMBE,06,GOMBE,02,Bajoga,003,"BABAYO BELLO, KOFAR SALE KAFINTA"
GOMBE,06,GOMBE,02,Bajoga,004,"ZURKALLAINI, IDI PRIMARY SCHOOL"
GOMBE,06,GOMBE,02,Bajoga,005,"ZURKALLAINI, KOFAR ZURKALLAINI"
GOMBE,06,GOMBE,02,Bajoga,006,"USMAN MEMORIAL, USMAN MEMORIAL"
GOMBE,06,GOMBE,02,Bajoga,007,"M/UNG. JABBO, KOFAR M/UNG. JABBO"
GOMBE,06,GOMBE,02,Bajoga,008,"FEDERAL LOW COST I, FEDERAL LOW COST"
GOMBE,06,GOMBE,02,Bajoga,009,"FEDERAL LOW COST II, FEDERAL LOW COST"
GOMBE,06,GOMBE,02,Bajoga,010,"WURO LEDDE, KOFAR JAURO LEDDE"
GOMBE,06,GOMBE,02,Bajoga,011,"MALLAM SHEHU, KOFAR MALLAM SHEHU"
GOMBE,06,GOMBE,03,Bolari East,001,"AJAYI FATUMBI, KOFAR AJAYI FATUMBI"
GOMBE,06,GOMBE,03,Bolari East,002,"USMAN FARUK I, KOFAR USMAN FARUK"
GOMBE,06,GOMBE,03,Bolari East,003,"USMAN FARUK II, KOFAR USMAN FARUK"
GOMBE,06,GOMBE,03,Bolari East,004,"USMAN FARUK, KOFAR YAYA ARABI"
GOMBE,06,GOMBE,03,Bolari East,005,"AUDU BIU, KOFAR AUDU BIU"
GOMBE,06,GOMBE,03,Bolari East,006,"AUDU BIU, KAMARA PRI. SCH."
GOMBE,06,GOMBE,03,Bolari East,007,"MAGAJI SAIDU, KAMARA PRI. SCH."
GOMBE,06,GOMBE,03,Bolari East,008,"MAGAJI SAIDU, KOFAR BABARU BOLARI"
GOMBE,06,GOMBE,03,Bolari East,009,"MAGAJI SAIDU, KOFAR MALAM SAIDU"
GOMBE,06,GOMBE,03,Bolari East,010,"MAGAJI SAIDU, TSAMIYA"
GOMBE,06,GOMBE,03,Bolari East,011,"ARMY CHILDREN SCHOOL, ARMY CHILDREN SCHOOL"
GOMBE,06,GOMBE,03,Bolari East,012,"ARMY CHILDREN, ARMY CHILDREN SCHOOL"
GOMBE,06,GOMBE,03,Bolari East,013,"ARMY CHILDREN SCHOOL, ARMY CHILDREN SCHOOL"
GOMBE,06,GOMBE,03,Bolari East,014,"WAZIRI BOLARI, BOLARI MATERNITY"
GOMBE,06,GOMBE,03,Bolari East,015,"WAZIRI BOLARI, KOFAR ALI DOGO"
GOMBE,06,GOMBE,03,Bolari East,016,"WAKILI GONI, BOLARI AREA COURT"
GOMBE,06,GOMBE,03,Bolari East,017,"CO-OPERATIVE STORES, CO-OPERATIVE STORES"
GOMBE,06,GOMBE,03,Bolari East,018,"BAMUSA, KOFAR JAURO BAMUSA"
GOMBE,06,GOMBE,04,Bolari West,001,KOFAR A. B. BOMALA / A. B. BOMALA
GOMBE,06,GOMBE,04,Bolari West,002,"A. B. BOMALA, KOFAR AUDU KWADO"
GOMBE,06,GOMBE,04,Bolari West,003,"A. B. BOMALA, KOFAR DANLADI JALO"
GOMBE,06,GOMBE,04,Bolari West,004,"KADIRI MAI TABARMA, KOFAR MAI TABARMA"
GOMBE,06,GOMBE,04,Bolari West,005,"GALADIMA UMARU, KOFAR UMAR"
GOMBE,06,GOMBE,04,Bolari West,006,"GALADIMA UMARU, GIDAN RIMI"
GOMBE,06,GOMBE,04,Bolari West,007,"BALULU, TEMP. HOUSE OF ASSEMBLY"
GOMBE,06,GOMBE,04,Bolari West,008,"BALULU, KOFAR BALULU"
GOMBE,06,GOMBE,04,Bolari West,009,"BALULU, KOFAR AUDU WUYO"
GOMBE,06,GOMBE,04,Bolari West,010,"KASUWA ZANA, KASUWAR ZANA"
GOMBE,06,GOMBE,04,Bolari West,011,"WAZIRI BOLARI, KOFAR W. BOLARI"
GOMBE,06,GOMBE,04,Bolari West,012,"WAZIRI BOLARI, KOFAR W. BOLARI"
GOMBE,06,GOMBE,04,Bolari West,013,"KASUWA CHIROMA, KOFAR J. K. CHIYAWA"
GOMBE,06,GOMBE,04,Bolari West,014,"A. A. HARUNA, KOFAR A. A. HARUNA"
GOMBE,06,GOMBE,05,Dawaki,001,"ALH. TSOHO, KOFAR ALH. TSOHO"
GOMBE,06,GOMBE,05,Dawaki,002,"SARKI HAYA, KOFAR SARKI HAYA"
GOMBE,06,GOMBE,05,Dawaki,003,"YAYA HAMMARI I, KOFAR YAYA HAMARI"
GOMBE,06,GOMBE,05,Dawaki,004,"YAYA HAMARI, K. YAYA HAMARI"
GOMBE,06,GOMBE,05,Dawaki,005,"BABA NABIRNI I, BUBAYERO PRI. SCH."
GOMBE,06,GOMBE,05,Dawaki,006,"BABA NABIRNI II, BUBAYERO PRI. SCH."
GOMBE,06,GOMBE,05,Dawaki,007,"BABA NABIRNI, BUBAYERO PRI. SCH."
GOMBE,06,GOMBE,05,Dawaki,008,"KELI, BUBAYERO PRI. SCH."
GOMBE,06,GOMBE,05,Dawaki,009,"MOH'D MAI KATIFA, K/MOH'D M/KATIFA"
GOMBE,06,GOMBE,05,Dawaki,010,"SHETIMA, KOFAR SHETIMA"
GOMBE,06,GOMBE,05,Dawaki,011,"BAPPA HAURO, KOFAR BAPPA"
GOMBE,06,GOMBE,05,Dawaki,012,"BABA SALE, ADAMU HASHIMU"
GOMBE,06,GOMBE,05,Dawaki,013,"BABA SALE, KOFAR BABA SALE"
GOMBE,06,GOMBE,05,Dawaki,014,"BINGEL DADA, DISPENSARY"
GOMBE,06,GOMBE,05,Dawaki,015,"SARKIN DUKKU, NUMCO"
GOMBE,06,GOMBE,05,Dawaki,016,"SARKIN DABE, KOFAR SARKIN DABE"
GOMBE,06,GOMBE,05,Dawaki,017,"MAJIDADI HAMMA, KOFAR M. HAMMA"
GOMBE,06,GOMBE,05,Dawaki,018,"DADA KUMBO, KOFAR DADA KUMBO"
GOMBE,06,GOMBE,05,Dawaki,019,"HAMZA MALLE, KOFAR MALLE"
GOMBE,06,GOMBE,05,Dawaki,020,"YARI, KOFAR YARI"
GOMBE,06,GOMBE,05,Dawaki,021,"SARKIN PAWA, KOFAR S. PAWA"
GOMBE,06,GOMBE,05,Dawaki,022,"MAKAMA BABA, KOFAR M. BABA"
GOMBE,06,GOMBE,06,Herwagana,001,"BUNU, KOFAR S. BUNU"
GOMBE,06,GOMBE,06,Herwagana,002,"MA'AJI ABBA, KOFAR M. ABBA"
GOMBE,06,GOMBE,06,Herwagana,003,"KOGGA I, HASSAN PRI. SCH."
GOMBE,06,GOMBE,06,Herwagana,004,"KOGGA II, HASSAN PRI. SCH."
GOMBE,06,GOMBE,06,Herwagana,005,"MANZO, HASSAN PRI. SCH."
GOMBE,06,GOMBE,06,Herwagana,006,"YAKUBU, KOFAR YAKUBU"
GOMBE,06,GOMBE,06,Herwagana,007,"ADAMU DAMANDA, KOFAR A. DAMANDA"
GOMBE,06,GOMBE,06,Herwagana,008,"HERWAGANA, HERWAGANA PRI. SCH."
GOMBE,06,GOMBE,06,Herwagana,009,"ALH. KAWU ADAMU, KOFAR DAN MALIKI"
GOMBE,06,GOMBE,06,Herwagana,010,"USMAN KAFINTA, KOFAR U. KAFINTA"
GOMBE,06,GOMBE,06,Herwagana,011,"DAN DAURA I, KOFAR DAN DAURA"
GOMBE,06,GOMBE,06,Herwagana,012,"DAN DAURA II, KOFAR DAN DAURA"
GOMBE,06,GOMBE,06,Herwagana,013,"ALH. MALAMI, KOFAR A. MALAMI"
GOMBE,06,GOMBE,06,Herwagana,014,"IBRAHIM SOKOTO, K/I IBRAHIM SOKOTO"
GOMBE,06,GOMBE,06,Herwagana,015,"KALSHINGI, K/ALI KALSHINGI"
GOMBE,06,GOMBE,06,Herwagana,016,"ALIYU DALA, K/ALIYU DALA"
GOMBE,06,GOMBE,06,Herwagana,017,"YUSUF BAYARBE, KOFAR Y. BAYARBE"
GOMBE,06,GOMBE,06,Herwagana,018,"IBRAHIM PENTA, KOFAR I. PENTA"
GOMBE,06,GOMBE,06,Herwagana,019,"MAUDO I, KOFAR MAUDO"
GOMBE,06,GOMBE,06,Herwagana,020,"MAUDO II, KOFAR MAUDO"
GOMBE,06,GOMBE,07,Jeka Dafari,001,"GOVT SCIENCE SEC. SCHOOL GOMBE (GONI ALI, KOFAR GONI ALI)"
GOMBE,06,GOMBE,07,Jeka Dafari,002,"JEKADAFARI PRIMARY SCHOOL (SARKIN FATA, KOFAR SARKIN FATA)"
GOMBE,06,GOMBE,07,Jeka Dafari,003,"HASSAN KWADON, KOFAR H. KWADON"
GOMBE,06,GOMBE,07,Jeka Dafari,004,"UNG. DOMA, DOMA AREA COURT"
GOMBE,06,GOMBE,07,Jeka Dafari,005,"KANI, KOFAR KANI"
GOMBE,06,GOMBE,07,Jeka Dafari,006,"GOVT SCI. SEC. SCH. GOMBE (UMARU ADAMU, KOFAR U/ADAMU)"
GOMBE,06,GOMBE,07,Jeka Dafari,007,"SAIDU MANGU, KOFAR S. MANGU"
GOMBE,06,GOMBE,07,Jeka Dafari,008,"BUZU, KOFAR BUZU"
GOMBE,06,GOMBE,07,Jeka Dafari,009,"MAGAJI RUMBUDI, KOFAR MAGAJI R."
GOMBE,06,GOMBE,07,Jeka Dafari,010,"YAHAYA UMARU, KOFAR Y. UMARU"
GOMBE,06,GOMBE,07,Jeka Dafari,011,"USMAN ASIBITY, KOFAR U. ASIBITY"
GOMBE,06,GOMBE,07,Jeka Dafari,012,"MELE MAI GISHIRI, K. M. MAI GISHIRI"
GOMBE,06,GOMBE,07,Jeka Dafari,013,"HASSAN CENTRAL PRIMARY SCHOOL(IBRAHIM NA YAYA, KOFAR IBRAHIM NAYAYA)"
GOMBE,06,GOMBE,07,Jeka Dafari,014,"MALMA MAMMAN, K. M. MAMMAN"
GOMBE,06,GOMBE,07,Jeka Dafari,015,"MALAM MAMMAN, K. M. MAMMAN"
GOMBE,06,GOMBE,07,Jeka Dafari,016,"MODIBO TUKUR, K. M. TUKUR"
GOMBE,06,GOMBE,07,Jeka Dafari,017,"ALH. SARKI, KOFAR ALH. SARKI"
GOMBE,06,GOMBE,07,Jeka Dafari,018,"CHECHENIYA, K. BAPPAYO JAMJAM"
GOMBE,06,GOMBE,07,Jeka Dafari,019,"NAYAYA, MIN. OF EDUCATION"
GOMBE,06,GOMBE,07,Jeka Dafari,020,"NAMADI, KOFAR NAMADI"
GOMBE,06,GOMBE,07,Jeka Dafari,021,"TSAMIYA, KOFAR J. TSAMIYA"
GOMBE,06,GOMBE,07,Jeka Dafari,022,"BUHARI ESTATE, BUHARI ESTATE"
GOMBE,06,GOMBE,07,Jeka Dafari,023,"IMMIGRATION OFFICE, IMMIGRATION OFFICE"
GOMBE,06,GOMBE,07,Jeka Dafari,024,"IMMIGRATION QUARTERS, IMMIGRATION QUARTERS"
GOMBE,06,GOMBE,07,Jeka Dafari,025,"WANZAM, K. ADAMU WANZAM"
GOMBE,06,GOMBE,07,Jeka Dafari,026,"UPPER BENUE, K. UPPER BENUE"
GOMBE,06,GOMBE,07,Jeka Dafari,027,"BAPPAH TIREBO, K/BAPPAH TIREBO"
GOMBE,06,GOMBE,07,Jeka Dafari,028,"MAI SAKA, KOFAR MAI SAKA"
GOMBE,06,GOMBE,07,Jeka Dafari,029,"J. I. ORJI, J. I. ORJI QUARTERS"
GOMBE,06,GOMBE,08,Kumbiya - Kumbiya,001,"GOJE, KOFAR GOJE"
GOMBE,06,GOMBE,08,Kumbiya - Kumbiya,002,"ALH. YAKUBU, HASSAN PRI. SCH."
GOMBE,06,GOMBE,08,Kumbiya - Kumbiya,003,"HASSAN PRI. SCH., HASSAN PRI. SCH."
GOMBE,06,GOMBE,08,Kumbiya - Kumbiya,004,"ALH. YAKUBU, HASSAN PRI. SCH."
GOMBE,06,GOMBE,08,Kumbiya - Kumbiya,005,"SARKIN DOKA, KOFAR S. DOKA"
GOMBE,06,GOMBE,08,Kumbiya - Kumbiya,006,"AUDU BOJUDE I, KOFAR A. BOJUDE"
GOMBE,06,GOMBE,08,Kumbiya - Kumbiya,007,"AUDU BOJUDE II, KOFAR A. BOJUDE"
GOMBE,06,GOMBE,08,Kumbiya - Kumbiya,008,"NEPA OFFICE, K. NEPA OFFICE"
GOMBE,06,GOMBE,08,Kumbiya - Kumbiya,009,"ISHIYAKU, K. NEPA OFFICE"
GOMBE,06,GOMBE,08,Kumbiya - Kumbiya,010,"CHIROMA, KOFAR CHIROMA"
GOMBE,06,GOMBE,08,Kumbiya - Kumbiya,011,"ADAMU MASINJA, KOFAR A. MASINJA"
GOMBE,06,GOMBE,08,Kumbiya - Kumbiya,012,"UMARU MABUGA, K. U. MABUGA"
GOMBE,06,GOMBE,08,Kumbiya - Kumbiya,013,"MAI GISHIRI, KOFAR MAI GISHIRI"
GOMBE,06,GOMBE,08,Kumbiya - Kumbiya,014,"MIJINYAWA, ADULT EDUCATION"
GOMBE,06,GOMBE,09,Nasarawa,001,"YALAH GURUZA, K. J. YALAN GURUZA"
GOMBE,06,GOMBE,09,Nasarawa,002,"JAURO NASARAWA I, K. NASARAWA PRI. SCH."
GOMBE,06,GOMBE,09,Nasarawa,003,"JAURO NASARAWA II, K. NASARAWA PRI. SCH."
GOMBE,06,GOMBE,09,Nasarawa,004,"MALAM BAPPA, KOFAR M. BAPPA"
GOMBE,06,GOMBE,09,Nasarawa,005,"JULDE, KOFAR JULDE"
GOMBE,06,GOMBE,09,Nasarawa,006,"SODENGI, KOFAR J. SODENGI"
GOMBE,06,GOMBE,09,Nasarawa,007,"SABON GARI DANLAMI, KOFAR M. DANLAMI"
GOMBE,06,GOMBE,10,Pantami,001,"SARKIN PANTAMI, KOFAR S. PANTAMI"
GOMBE,06,GOMBE,10,Pantami,002,"WAKILI HAMZA, KOFAR W. HAMZA"
GOMBE,06,GOMBE,10,Pantami,003,"ABBA, KOFAR ABBA"
GOMBE,06,GOMBE,10,Pantami,004,"ZAKARAWA, KOFAR J. ZAKARAWA"
GOMBE,06,GOMBE,10,Pantami,005,"PARASHA, KOFAR PARASHA"
GOMBE,06,GOMBE,10,Pantami,006,"MALAM MAINA, KOFAR M. MAINA"
GOMBE,06,GOMBE,10,Pantami,007,"SARKIN GABUKKA, KOFAR S. GABUKKA"
GOMBE,06,GOMBE,10,Pantami,008,"GABUKKA PRI. SCH., GABUKKA PRI. SCH."
GOMBE,06,GOMBE,10,Pantami,009,"JAURO BAPPI, KOFAR J. BAPPI"
GOMBE,06,GOMBE,10,Pantami,010,"JAURO MAMUDA, KOFAR J. MAMUDA"
GOMBE,06,GOMBE,10,Pantami,011,"MALAM KURI I, PANTAMI PRI. SCH."
GOMBE,06,GOMBE,10,Pantami,012,"MALAM KURI II, PANTAMI PRI. SCH."
GOMBE,06,GOMBE,10,Pantami,013,"MOH'D MAI SIMINTI, K/M. MAI SIMINTI"
GOMBE,06,GOMBE,10,Pantami,014,"WAKILI MADU, KOFAR WAKILI MADU"
GOMBE,06,GOMBE,10,Pantami,015,"MATERNITY, PANTAMI MATERNITY"
GOMBE,06,GOMBE,10,Pantami,016,"G. S. A. D. P., KOFAR G. S. A. D. P."
GOMBE,06,GOMBE,10,Pantami,017,"L. DAMBAM, KOFAR L. DAMBAM"
GOMBE,06,GOMBE,10,Pantami,018,"MANAWASHI, K/J MANAWASHI"
GOMBE,06,GOMBE,11,Shamaki,001,"PILOT JUNIOR SECONDARY SCH. I (MUSA HADEJA, KOFAR MUSA HADEJA)"
GOMBE,06,GOMBE,11,Shamaki,002,"PILOT JUNIOR SECONDARY SCH. II (LAMDO MAGABA, K/L MAGABA)"
GOMBE,06,GOMBE,11,Shamaki,003,"PILOT JUNIOR SECONDARY SCH. III (MOH'D BOJUDE I, K/M/ BOJUDE)"
GOMBE,06,GOMBE,11,Shamaki,004,"MOH'D BOJUDE, PILOT JUNIOR SEC. SCH."
GOMBE,06,GOMBE,11,Shamaki,005,"YAYAJO I, VETENARY OFFICE"
GOMBE,06,GOMBE,11,Shamaki,006,"YAYAJO II, VETENARY OFFICE"
GOMBE,06,GOMBE,11,Shamaki,007,"GANDU JUNIOR SEC. SCHOOL (SARKIN SHANU, KOFAR S/SHANU)"
GOMBE,06,GOMBE,11,Shamaki,008,"GANDU JUNIOR SEC. SCHOOL (SHAMAKI, KOFAR SHAMAKI)"
GOMBE,06,GOMBE,11,Shamaki,009,"ARABIC TEACHERS COLLEGE I (JAURO ABARE I, KOFAR JAURO ABARE)"
GOMBE,06,GOMBE,11,Shamaki,010,"ARABIC TEACHERS COLLEGE II (JAURO ABARE II, KOFAR J/ABARE)"
GOMBE,06,GOMBE,11,Shamaki,011,"KARANGADA PRIMARY SCH. ( KOFAR GANA, KOFAR GANA)"
GOMBE,06,GOMBE,11,Shamaki,012,"ARABIC TEACHERS COLLEGE (JAURO BABAYO, JAURO KUNA)"
GOMBE,06,GOMBE,11,Shamaki,013,"A. T. C. GOMBE, A. T. C. GOMBE"
GOMBE,06,GOMBE,11,Shamaki,014,"MULTIPURPOSE B HALL GSU I (TC GOMBE I, TC)"
GOMBE,06,GOMBE,11,Shamaki,015,"MULTIPURPOSE B HALL GSU II (TC GOMBE II, TC)"
GOMBE,06,GOMBE,11,Shamaki,016,"KARANGADA PRIMARY SCH. (SANI PINDIGA, K/ SANI PINDIGA)"
GOMBE,06,GOMBE,11,Shamaki,017,"GOVT. COMP. DAY SEC. SCH. (YERIMA JALO, K/YERIMA JALO)"
GOMBE,06,GOMBE,11,Shamaki,018,"MAL. INNA PRIMARY SCHOOL (KORON GIWA, KOFAR MINNA)"
GOMBE,06,GOMBE,11,Shamaki,019,"GANDU JUNIOR SEC. SCHOOL (LAMIDO, KOFAR LAMIDO)"
GOMBE,06,GOMBE,11,Shamaki,020,"TUDUN WADA PRIMARY SCHOOL I (SARKIN RAKUMA, K/S RAKUMA)"
GOMBE,06,GOMBE,11,Shamaki,021,"TUDUN WADA PRIMARY SCHOOL II (USMAN MALALA, K/U MALALA)"
GOMBE,06,GOMBE,11,Shamaki,022,"GANDU JUNIOR SEC. SCHOOL (IDI NAKAKA, KOFAR IDI NAKAKA)"
GOMBE,06,GOMBE,11,Shamaki,023,"IDI NAKAKA, GANDU J. S. S."
GOMBE,06,GOMBE,11,Shamaki,024,"GOVT. COMP. DAY SEC. SCH. (MUSA, KOFAR MUSA)"
GOMBE,06,GOMBE,11,Shamaki,025,"ATC GOMBE (BUBAYERO, KOFAR BUBAYERO)"
GOMBE,06,GOMBE,11,Shamaki,026,"BOGGA SHAWARA I, T/WADA PRI. SCH."
GOMBE,06,GOMBE,11,Shamaki,027,"BOGGA SHAWARA II, T/WADA PRI. SCH."
GOMBE,06,GOMBE,11,Shamaki,028,GOVT. COMP. DAY SEC. SCH. (ALH. GARBA MAIMAGANI K/G MAIMAGANI)
GOMBE,06,GOMBE,11,Shamaki,029,"MAL. INNA PRIMARY SCHOOL (KAGARAWOL, KOFAR MAIKUDI USMAN)"
GOMBE,07,KALTUNGO,01,Awak,001,GJSS BUKKA ARBAIN (DOGON RUWA K.S RAFI)
GOMBE,07,KALTUNGO,01,Awak,002,"KANGARI PR. SCH. I (KWALASHINE,K.FADA)"
GOMBE,07,KALTUNGO,01,Awak,003,KANGARI PR. SCH. II (KANGARI I K.J.MUSA)
GOMBE,07,KALTUNGO,01,Awak,004,KANGARI PR. SCH. III (KANGARI II K.J.MUSA)
GOMBE,07,KALTUNGO,01,Awak,005,"GJSS BUKKA ARBAIN (UBANDOMA,PRI SCH)"
GOMBE,07,KALTUNGO,01,Awak,006,GARIN KORAU OPEN SPACE (GARIN KORAU.K.J KORAU)
GOMBE,07,KALTUNGO,01,Awak,007,GARIN BAKO OPEN SPACE (GARIN BAKO K.J BAKO)
GOMBE,07,KALTUNGO,01,Awak,008,GJSS BUKA ARBAIN (DOGON RUWA K.J DAN ZARIA)
GOMBE,07,KALTUNGO,01,Awak,009,KWALASHINE PRI. SCH. I (JAURO ABDU K.J ABDU)
GOMBE,07,KALTUNGO,01,Awak,010,"KWALASHINE PRI. SCH. II (KWABILAKE FUN/J/A,KJ SAMAILA)"
GOMBE,07,KALTUNGO,01,Awak,011,DUNDAYE OPEN SPACE (DUNDAYE K. NAMADI)
GOMBE,07,KALTUNGO,01,Awak,012,GJSS BUKKA ARBAIN I (DOGON RUWA K/J MANI)
GOMBE,07,KALTUNGO,01,Awak,013,"GJSS BUKKA ARBAIN II (DOGON RUWA K,M HUSSAINI)"
GOMBE,07,KALTUNGO,01,Awak,014,GARIN BARAU OPEN SPACE (GARIN BARAU K/J BARAU)
GOMBE,07,KALTUNGO,01,Awak,015,GARIN BAKO OPEN SPACE (GARIN BAKO K/J DAMACE)
GOMBE,07,KALTUNGO,01,Awak,016,"KWALASHINE, KWALASHINE PRI. SCH."
GOMBE,07,KALTUNGO,01,Awak,017,KWALASHINE PRI. SCH.I ( KWALASHINE K.GALADIMA)
GOMBE,07,KALTUNGO,01,Awak,018,KWALASHINE PRI. SCH. II (KWALASHINE UNG.FULANI)
GOMBE,07,KALTUNGO,01,Awak,019,"DIYELBU COMM. SEC. SCH. I (SOBLONG, PRI SCH)"
GOMBE,07,KALTUNGO,01,Awak,020,"TANGA, ANNEX PRIMARY SCHOOL"
GOMBE,07,KALTUNGO,01,Awak,021,"DIYELBU COMM. SEC. SCH. II (KUNGE,K GALADIMA)"
GOMBE,07,KALTUNGO,01,Awak,022,JAURO GOTEL OPEN SPACE (JAURO GOTEL K/J UMARU)
GOMBE,07,KALTUNGO,01,Awak,023,"SALIYAWA OPEN SPACE (SALIYAWA,K.J SALIYAWA)"
GOMBE,07,KALTUNGO,01,Awak,024,"DAURA OPEN SPACE (DAURA, K/J DAURA)"
GOMBE,07,KALTUNGO,01,Awak,025,"TAYO PRI. SCH. (LUGAYIDI,K.J LUGAYIDI)"
GOMBE,07,KALTUNGO,01,Awak,026,"YERI BWARA, PRIMARY SCHOOL"
GOMBE,07,KALTUNGO,01,Awak,027,TAYO PRIMARY SCHOOL
GOMBE,07,KALTUNGO,01,Awak,028,LATAISHINE OPEN SPACE (LATISHINE K/J YABAWO)
GOMBE,07,KALTUNGO,02,Bule / Kaltin,001,"SABONGARI PRI. SCH. (BALAMUSA/ KWAY, K/J BALAMUSA)"
GOMBE,07,KALTUNGO,02,Bule / Kaltin,002,"BUNDIBUNDE PRI. SCH. (BAYUSE/BUNDIDBIN,K/J YAYA)"
GOMBE,07,KALTUNGO,02,Bule / Kaltin,003,"KALTIN, KALTIN PRI. SCH."
GOMBE,07,KALTUNGO,02,Bule / Kaltin,004,"NAHUTA, NAHUTA PRI. SCH."
GOMBE,07,KALTUNGO,02,Bule / Kaltin,005,YABDE PRI. SCH. (YABDE/B.BAKA K/J YELMAN)
GOMBE,07,KALTUNGO,02,Bule / Kaltin,006,"TANKUBIN PRI. SCH. (YUKUBU KWALE,K/J LADIR)"
GOMBE,07,KALTUNGO,02,Bule / Kaltin,007,BUNDIBUNDE PRI. SCH. (BANKWE K.J ABUBAKAR)
GOMBE,07,KALTUNGO,02,Bule / Kaltin,008,"JAURO ALI PRI. SCH. I (J. ALI/J.HASHIMI,K.J ALI)"
GOMBE,07,KALTUNGO,02,Bule / Kaltin,009,"JAURO ALI PRI. SCH. II (J. ABDU/J.DINYA,J/U,KJ UMAR)"
GOMBE,07,KALTUNGO,02,Bule / Kaltin,010,"JAURO ALI PRI. SCH. III (J.MADAKI J/NADABA,K.G GIBIR)"
GOMBE,07,KALTUNGO,02,Bule / Kaltin,011,"SABON GARI, S. G. PRI. SCH."
GOMBE,07,KALTUNGO,02,Bule / Kaltin,012,"BULE, BULE PRI. SCH."
GOMBE,07,KALTUNGO,02,Bule / Kaltin,013,"KALTIN ""B"", KALTIN PRI. SCH."
GOMBE,07,KALTUNGO,03,Kaltungo West,001,"NASARAWA ""A"", KALTUNGO AREA COURT"
GOMBE,07,KALTUNGO,03,Kaltungo West,002,"NASARAWA ""B"", VIEWING CENTRE"
GOMBE,07,KALTUNGO,03,Kaltungo West,003,"NASARAWA ""C"", KALTUNGO PRI. SCH."
GOMBE,07,KALTUNGO,03,Kaltungo West,004,LGA SECRETARIAT GATE I (NASARAWA'D' LEA DIAPENSARY)
GOMBE,07,KALTUNGO,03,Kaltungo West,005,"NASARAWA ""D"", KALTUNGO AREA COURT"
GOMBE,07,KALTUNGO,03,Kaltungo West,006,"LGA SECRETARIAT GATE II (LADIBIN 'A,' GENERAL HOSPITAL)"
GOMBE,07,KALTUNGO,03,Kaltungo West,007,LGA SECRETARIAT GATE III (LADIBIN 'B' LGA SECRETARIAT)
GOMBE,07,KALTUNGO,03,Kaltungo West,008,"TERMANA PRI. SCH. I (PONDIND DING,TUL KAMBIDO)"
GOMBE,07,KALTUNGO,03,Kaltungo West,009,"TERMANA PRI. SCH. II (LAIKULI,TUL MANGORO)"
GOMBE,07,KALTUNGO,03,Kaltungo West,010,"TERMANA PRIMARY SCHOOL(KALAMBU,POMA DAURA)"
GOMBE,07,KALTUNGO,03,Kaltungo West,011,"TERMANA PRI. SCH. I (PIDDIMMOTONG, TUL KUNJI)"
GOMBE,07,KALTUNGO,03,Kaltungo West,012,"TERMANA PRI. SCH. II (KALEKWA,KAMBIDLABELISWA)"
GOMBE,07,KALTUNGO,03,Kaltungo West,013,"LEA PRI. SCH. KALTUNGO I (KORONG,K.BASHARI)"
GOMBE,07,KALTUNGO,03,Kaltungo West,014,"SCHOOL FOR THE BLIND AND DEAF KALTUNGO(OKDEMBE, TUL KUNJI)"
GOMBE,07,KALTUNGO,03,Kaltungo West,015,"TERMANA PRI. SCH. II (POKWARA, TUL KAMBIDO)"
GOMBE,07,KALTUNGO,03,Kaltungo West,016,"SCHOOL FOR THE BLIND AND DEAF KALTUNGO(POKAJANG,POMA ABNOW)"
GOMBE,07,KALTUNGO,03,Kaltungo West,017,"SCHOOL FOR THE BLIND AND DEAF KALTUNGO(OKBAGANJE,POMA BABA INUWA)"
GOMBE,07,KALTUNGO,03,Kaltungo West,018,"LEA PRI. SCH. KALTUNGO V (DWALE, TUL DWANG)"
GOMBE,07,KALTUNGO,03,Kaltungo West,019,"KALARGU MATERNITY OPEN SPACE I (PIDMOKI ""A"" I.T/WAJA AREA COURT)"
GOMBE,07,KALTUNGO,03,Kaltungo West,020,"KALARGU MATERNITY OPEN SPACE II (PIDMOKI ""B"" II.T/WAJA AREA COURT)"
GOMBE,07,KALTUNGO,03,Kaltungo West,021,"KALARGU MATERNITY OPEN SPACE (PIDMOKI ""C"" II, TUL DWANG)"
GOMBE,07,KALTUNGO,03,Kaltungo West,022,"LAKOLING ""A"", KALORGU PRI. SCH."
GOMBE,07,KALTUNGO,03,Kaltungo West,023,"KALARGU PRI. SCH. I (LAKOLING ""B"" LAKUNJI)"
GOMBE,07,KALTUNGO,03,Kaltungo West,024,"KALARGU PRI. SCH. II (LAKOLING ""C"" I,K.BABA DAUDU)"
GOMBE,07,KALTUNGO,03,Kaltungo West,025,"KALARGU PRI. SCH. III (LAKOLING""D"" II,K.BABA DAUDU)"
GOMBE,07,KALTUNGO,03,Kaltungo West,026,"LGA SECRETARIAT GATE (KASARWAJE,K.M ALPINTI)"
GOMBE,07,KALTUNGO,03,Kaltungo West,027,"KALARGU MATERNITY OPEN SPACE (KALARGO,KANGULI)"
GOMBE,07,KALTUNGO,03,Kaltungo West,028,VIEWING CENTRE OPEN SPACE (MAHUTA K.SARKIN PAWA)
GOMBE,07,KALTUNGO,04,Kaltungo East,001,"KALARING ""A"" I, KALARING PRI. SCH"
GOMBE,07,KALTUNGO,04,Kaltungo East,002,"KALARING ""B"" II, KALARING PRI. SCH."
GOMBE,07,KALTUNGO,04,Kaltungo East,003,"GSSS LAKANJE GATE I (KALARING'C'K,M JIBIR)"
GOMBE,07,KALTUNGO,04,Kaltungo East,004,GSSS LAKANJE GATE II (KALARING 'D' K WAZIRI)
GOMBE,07,KALTUNGO,04,Kaltungo East,005,"KALEH PRI. SCH. I-I (OKRA ""A"" K. BABA YAKUBU)"
GOMBE,07,KALTUNGO,04,Kaltungo East,006,"KALEH PRI. SCH. I-II (OKRA ""B' K. MAI ANG.)"
GOMBE,07,KALTUNGO,04,Kaltungo East,007,"KALEH PRI. SCH. I-III (OKRA ""B"" K.MAI ANG.)"
GOMBE,07,KALTUNGO,04,Kaltungo East,008,"KALEH ""A"" I, KALEH PRI. SCH."
GOMBE,07,KALTUNGO,04,Kaltungo East,009,"KALEH ""B"" II, KALEH PRI. SCH."
GOMBE,07,KALTUNGO,04,Kaltungo East,010,"POPANDI ""A"", POPANDI PRI. SCH."
GOMBE,07,KALTUNGO,04,Kaltungo East,011,"POPANDI PRI. SCH. (POPANDI ""B"" K. MAI ANG.)"
GOMBE,07,KALTUNGO,04,Kaltungo East,012,"POSHERENG PRIMARY SCHOOL(POSHERENG'A',K.M GALADIMA)"
GOMBE,07,KALTUNGO,04,Kaltungo East,013,"POSHERENG PRIMARY SCHOOL(POSHERENG ""B"" KWARA)"
GOMBE,07,KALTUNGO,04,Kaltungo East,014,KIJE OPEN SPACE (KIJE R.C.M SCHOOL)
GOMBE,07,KALTUNGO,04,Kaltungo East,015,"LAYIRO, LAYIRO PRI. SCH."
GOMBE,07,KALTUNGO,04,Kaltungo East,016,"POPANDI PRIMARY SCHOOL, POPANDI(POPANDI ""C"" K.MAI ANG.)"
GOMBE,07,KALTUNGO,04,Kaltungo East,017,MOIDING PRI. SCH. (MOIDING K.MAI ANG.)
GOMBE,07,KALTUNGO,04,Kaltungo East,018,MOIDING PRIM. SCH. (MOIDING K/GALADIMA)
GOMBE,07,KALTUNGO,04,Kaltungo East,019,"KALUWA PRI.SCH. (KALUWA, KM KALUWA)"
GOMBE,07,KALTUNGO,04,Kaltungo East,020,PURMAI PRI. SCH. (PODI K.M PODI)
GOMBE,07,KALTUNGO,04,Kaltungo East,021,BANDARA PRI. SCH. (KOGDE K.M KOGDE)
GOMBE,07,KALTUNGO,04,Kaltungo East,022,"BANDARA, BANDARA PRI. SCH."
GOMBE,07,KALTUNGO,04,Kaltungo East,023,"PURMAI, PURMAI PRI. SCH."
GOMBE,07,KALTUNGO,04,Kaltungo East,024,"LAKWEME, LAKWEME PRI. SCH."
GOMBE,07,KALTUNGO,04,Kaltungo East,025,"KOROMI PRIMARY SCHOOL(LAYIRO / GUJUBA, K/MAI ANG)"
GOMBE,07,KALTUNGO,04,Kaltungo East,026,"KOROMI PRIMARY SCHOOL(LAYIRO / POSHEREN, DISPENSARY)"
GOMBE,07,KALTUNGO,04,Kaltungo East,027,KALUWA PRIMARY SCHOOL(KALUWA K. MAKERA)
GOMBE,07,KALTUNGO,05,Kamo,001,SHENGE/SHENGE PRI. SCH. (SHENGE/SHENGE K/J MAI TUMBI)
GOMBE,07,KALTUNGO,05,Kamo,002,"KUNDULUM / POTWANA, YELWA PRI. SCH."
GOMBE,07,KALTUNGO,05,Kamo,003,YELWA POTWANA PRI. SCH. (YELWA KOFAR SARKI)
GOMBE,07,KALTUNGO,05,Kamo,004,JALINGO PRI. SCH. I (BIRWAI K.J SHUAIBU)
GOMBE,07,KALTUNGO,05,Kamo,005,"JALINGO PRI. SCH. II (YELWA BIRWAI, J/K TURMI)"
GOMBE,07,KALTUNGO,05,Kamo,006,"KONNU, JALINGO PRI. SCH."
GOMBE,07,KALTUNGO,05,Kamo,007,"JALINGO PRI. SCH. III (JALINGO, KOFAR SARKI)"
GOMBE,07,KALTUNGO,05,Kamo,008,JALINGO PRI. SCH. IV (JAURO BABA K/J BABA)
GOMBE,07,KALTUNGO,05,Kamo,009,"JALINGO PRI. SCH. V (JAURO YERIMA, KOFAR YERIMA)"
GOMBE,07,KALTUNGO,05,Kamo,010,"JALINGO PRI. SCH. VI (JAURO GALE, K/J GALE)"
GOMBE,07,KALTUNGO,05,Kamo,011,"JALINGO PRI. SCH. VII (JAURO SANI, K/J SANI)"
GOMBE,07,KALTUNGO,05,Kamo,012,"ZANGE PRI. SCH. (ZANGE, K/J YAHAYA)"
GOMBE,07,KALTUNGO,05,Kamo,013,"GUJUBA PRI. SCH. I (GUJUBA 'A', K/SARKI)"
GOMBE,07,KALTUNGO,05,Kamo,014,"GUJUBA PRI. SCH. II (GUJUBA 'B', K/J BOSE)"
GOMBE,07,KALTUNGO,05,Kamo,015,"GUJUBA PRI. SCH. III (GUJUBA""C"" DINGE)"
GOMBE,07,KALTUNGO,05,Kamo,016,"KUNDULU, LATARIN PRI. SCH. / DATIBO"
GOMBE,07,KALTUNGO,05,Kamo,017,"NYITI NYIBIR, MOSSO PRI. SCH."
GOMBE,07,KALTUNGO,05,Kamo,018,"MOSSO PRI. SCH. (DABEWA, J/K BAKARI)"
GOMBE,07,KALTUNGO,05,Kamo,019,"GUJUBA PRI. SCH. IV (YELMINE, KOFAR JAURO)"
GOMBE,07,KALTUNGO,05,Kamo,020,YELWA POTWANA PRI. SCH. I (BELTIBO KOFAR SARKI)
GOMBE,07,KALTUNGO,05,Kamo,021,"YELWA POTWANA PRI. SCH. II (POTWANA, K/M ARI)"
GOMBE,07,KALTUNGO,06,Tula Baule,001,"BILKITAMAN PRI. SCH. I (BILKITAMAN, KOFAR JAURO)"
GOMBE,07,KALTUNGO,06,Tula Baule,002,"KWALLAM, BAULE PRI. SCH."
GOMBE,07,KALTUNGO,06,Tula Baule,003,"BWAITAI, BAULE PRI. SCH."
GOMBE,07,KALTUNGO,06,Tula Baule,004,"YAKWALE, BAULE PRI. SCH."
GOMBE,07,KALTUNGO,06,Tula Baule,005,"BILADIRA, BAULE PRI. SCH."
GOMBE,07,KALTUNGO,06,Tula Baule,006,"BILKITAMAN PRI. SCH. II (JONGRI/J.AUDI ,KOFAR JAURO)"
GOMBE,07,KALTUNGO,06,Tula Baule,007,"LUNGERI / YELWA, LUNGERI PRI. SCH."
GOMBE,07,KALTUNGO,06,Tula Baule,008,"JALINGO, JALINGO PRI. SCH."
GOMBE,07,KALTUNGO,06,Tula Baule,009,"KUTUSHE, JALINGO PRI. SCH."
GOMBE,07,KALTUNGO,06,Tula Baule,010,"LAFIA / TAULE, LAFIA PRI. SCH."
GOMBE,07,KALTUNGO,06,Tula Baule,011,"TAULE / DALAN, LAFIA PRI. SCH."
GOMBE,07,KALTUNGO,06,Tula Baule,012,"YABADIRAN PRI. SCH. I (BILATUKU, FILANTIMEH)"
GOMBE,07,KALTUNGO,06,Tula Baule,013,"YABADIRAN PRI. SCH. II (LOJURO, FILANTIMEH)"
GOMBE,07,KALTUNGO,06,Tula Baule,014,"LUNGURI PRI. SCH. (SILAWANGHE, KOFAR JAURO)"
GOMBE,07,KALTUNGO,06,Tula Baule,015,"DAKTIBE PRI. SCH. I (BILAKWARE ,I KASUWA FWITI)"
GOMBE,07,KALTUNGO,06,Tula Baule,016,"DAKTIBE PRI. SCH. II (BILAKWARE II, KASUWA FWITI)"
GOMBE,07,KALTUNGO,06,Tula Baule,017,"GARIN WAZIRI/KALARI OPEN SPACE (GARIN WAZIRI/KALARI,JAURO HAMIDU)"
GOMBE,07,KALTUNGO,06,Tula Baule,018,"TIYE PRI. SCH. I (TIYE/BUSSAM, BASWALE)"
GOMBE,07,KALTUNGO,06,Tula Baule,019,"TIYE PRI. SCH. II (BUSSAM/BAYALE, BASUWALE)"
GOMBE,07,KALTUNGO,07,Tula Wange,001,"BWITIR PRI. SCH. I (BAYAM UP I, K/J ISHIYAKU)"
GOMBE,07,KALTUNGO,07,Tula Wange,002,"BWITIR PRI. SCH. II (BAYAM UP II, K/J ISHIYAKU)"
GOMBE,07,KALTUNGO,07,Tula Wange,003,"TANTAN PRI SCH. (BAYAM DOWN, K/J AUDI)"
GOMBE,07,KALTUNGO,07,Tula Wange,004,"MARRARABA PRI. SCH. (MARARRABA, MARARRABA)"
GOMBE,07,KALTUNGO,07,Tula Wange,005,"BEKWALUME PRI. SCH. (BEKWALUME, BEKWALUME)"
GOMBE,07,KALTUNGO,07,Tula Wange,006,"YOYIRO PRI. SCH. (YORIYO, YORIYO/LOBWI)"
GOMBE,07,KALTUNGO,07,Tula Wange,007,"FANTAMI PRI SCH. I (FANTAMI, K/J FANTAMI)"
GOMBE,07,KALTUNGO,07,Tula Wange,008,"FANTAMI PRI SCH. II (KUNIN, KOFAR JAURO KUNIN)"
GOMBE,07,KALTUNGO,07,Tula Wange,009,"BEKUNTIN PRI. SCH. (BEKUNTIN, K/J BEKUNTIN)"
GOMBE,07,KALTUNGO,07,Tula Wange,010,"GJSS TULA, (UNG. MAIKATA, UNG MAIKATA)"
GOMBE,07,KALTUNGO,07,Tula Wange,011,"KULA SHINE / BWABWI YANG, TULA PRI. SCH."
GOMBE,07,KALTUNGO,07,Tula Wange,012,"BWITIR PRI. SCH. I (KUTUBE I, K/J KUTUBE)"
