state,lga_code,lga_name,ward_code,ward_name,pu_code,pu_name
BAYELSA,04,NEMBE,13,Oluasiri,011,"ISAIAHMA /STATE SCHOOL, ISAIAHMA (ISAIAHMA VILLAGE SQUARE)"
BAYELSA,04,NEMBE,13,Oluasiri,012,ISEREKIRI VILLAGE SQUARE
BAYELSA,04,NEMBE,13,Oluasiri,013,KARIKIRI VILLAGE SQUARE
BAYELSA,04,NEMBE,13,Oluasiri,014,DUMOEBIKUMAKIRI VILLAGE SQUARE
BAYELSA,04,NEMBE,13,Oluasiri,015,"FIKORUAMA /STATE SCHOOL, FIKORUAMA (FIKORUAMA VILLAGE SQUARE)"
BAYELSA,04,NEMBE,13,Oluasiri,016,DUALAMBOKIBI VILLAGE SQUARE
BAYELSA,05,OGBIA,01,Ogbia,001,G.S.S. OGBIA TOWN
BAYELSA,05,OGBIA,01,Ogbia,002,MARKET SQUARE OGIA TOWN
BAYELSA,05,OGBIA,01,Ogbia,003,G.S.S. OGBIA TOWN II (APOLOGBO - OGBIA)
BAYELSA,05,OGBIA,01,Ogbia,004,G.S.S. OGBIA TOWN III (AKUMUGI - OGBIA)
BAYELSA,05,OGBIA,01,Ogbia,005,G.S.S. OGBIA TOWN IV (PYN - OGBIA)
BAYELSA,05,OGBIA,01,Ogbia,006,G.S.S. OGBIA TOWN V (VICTORY - OGBIA)
BAYELSA,05,OGBIA,01,Ogbia,007,UPE - OGBIA
BAYELSA,05,OGBIA,01,Ogbia,008,UPE OGBIA TOWN II (ADIONIN - OGBIA)
BAYELSA,05,OGBIA,01,Ogbia,009,SS IDEMA I (OBODIRI - IDEMA)
BAYELSA,05,OGBIA,01,Ogbia,010,SS IDEMA II (OKIROMA - IDEMA)
BAYELSA,05,OGBIA,01,Ogbia,011,SS IDEMA III (EMALO - IDEMA)
BAYELSA,05,OGBIA,01,Ogbia,012,SS IDEMA IV (EBOH - IDEMA)
BAYELSA,05,OGBIA,01,Ogbia,013,OBEDUMA - OBEDUMA
BAYELSA,05,OGBIA,01,Ogbia,014,SS IDEMA V (ADUENI - IDEMA)
BAYELSA,05,OGBIA,02,Otuokpoti,001,S.S. OTUOKPOTI I-I (OGUTA - OTUOKPOTI)
BAYELSA,05,OGBIA,02,Otuokpoti,002,S.S. OTUOKPOTI I-II (AGOSUAN - OTUOKPOTI)
BAYELSA,05,OGBIA,02,Otuokpoti,003,S.S. OTUOKPOTI I
BAYELSA,05,OGBIA,02,Otuokpoti,004,C.S.S. OTUOKPOTI
BAYELSA,05,OGBIA,02,Otuokpoti,005,TOWN HALL I (AGOTOMA OTUOKPOTI)
BAYELSA,05,OGBIA,02,Otuokpoti,006,TOWN HALL II (OBENEMA - OTUOKOPI)
BAYELSA,05,OGBIA,02,Otuokpoti,007,S.S. - OTUOKPOTI II
BAYELSA,05,OGBIA,02,Otuokpoti,008,S.S. - OTUOGORI
BAYELSA,05,OGBIA,02,Otuokpoti,009,S.S. - OTUEGWE I
BAYELSA,05,OGBIA,02,Otuokpoti,010,TOWN SQUARE - OTUEGWE I
BAYELSA,05,OGBIA,02,Otuokpoti,011,S.S. ONUEBUM
BAYELSA,05,OGBIA,02,Otuokpoti,012,S.S. ONUEBUM II (OTUAM CAMP-ONUEBUM)
BAYELSA,05,OGBIA,02,Otuokpoti,013,S.S. ONUEBUM III (EBOKO CAMP-ONUEBUM)
BAYELSA,05,OGBIA,02,Otuokpoti,014,S.S. ONUEBUM IV (OTAMA - EBUM - ONUEBUM)
BAYELSA,05,OGBIA,02,Otuokpoti,015,S.S. ONUEBUM V (IGOBASI - ONUEBUM)
BAYELSA,05,OGBIA,02,Otuokpoti,016,S.S. ONUEBUM VI (OBAGUO - ONUEBUM)
BAYELSA,05,OGBIA,02,Otuokpoti,017,S.S. ONUEBUM VII (ABHOKASI - ONUEBUM)
BAYELSA,05,OGBIA,02,Otuokpoti,018,S.S. ONUEBUM VIII (IRIBO - ONUEBUM)
BAYELSA,05,OGBIA,02,Otuokpoti,019,UBE-OTUEGWE (IDUGUNA - OTUEGWE 1)
BAYELSA,05,OGBIA,03,Ologi,001,S.S. AYAKORO I (DERIME - AYAKORO)
BAYELSA,05,OGBIA,03,Ologi,002,S.S. AYAKORO
BAYELSA,05,OGBIA,03,Ologi,003,S.S. AYAKORO III (DEINBO - AYAKORO)
BAYELSA,05,OGBIA,03,Ologi,004,S.S. AYAKORO IV (IGBIKINA - AYAKORO)
BAYELSA,05,OGBIA,03,Ologi,005,S.S. AYAKORO V (OMOMEMA - AYAKORO)
BAYELSA,05,OGBIA,03,Ologi,006,S.S. AYAKORO VI (OGBUKU - AYAKORO)
BAYELSA,05,OGBIA,03,Ologi,007,TOWN HALL AYAKORO I (ORUA - AYAKORO)
BAYELSA,05,OGBIA,03,Ologi,008,TOWN HALL AYAKORO II (OBEIN - AYAKORO)
BAYELSA,05,OGBIA,03,Ologi,009,TOWN HALL AYAKORO III (OGBARA - AYAKORO)
BAYELSA,05,OGBIA,03,Ologi,010,S.S. OLOGI I (ODE CAMP - OLOGI)
BAYELSA,05,OGBIA,03,Ologi,011,S.S. OLOGI
BAYELSA,05,OGBIA,03,Ologi,012,S.S. OLOGI II (APOLO - OGBO- OLOGI)
BAYELSA,05,OGBIA,03,Ologi,013,S.S. OLOGI IV (OBENARI - OLOGI)
BAYELSA,05,OGBIA,03,Ologi,014,VILLAGE - OLOGI
BAYELSA,05,OGBIA,03,Ologi,015,S.S. OLOGI V (OMYI - OLOGI)
BAYELSA,05,OGBIA,03,Ologi,016,S.S. OLOGI VI (OBAGUO - OLOGI)
BAYELSA,05,OGBIA,03,Ologi,017,S.S. OTUEDU
BAYELSA,05,OGBIA,03,Ologi,018,CAMP SQUARE - OTUEDU
BAYELSA,05,OGBIA,03,Ologi,019,S.S. OTUEDU II (OBAKU - OTUEDU)
BAYELSA,05,OGBIA,04,Anyama,001,S.S. ANYAMA- ANYAMA TOWN I
BAYELSA,05,OGBIA,04,Anyama,002,S.S. ANYAMA - ANYAMA TOWN II
BAYELSA,05,OGBIA,04,Anyama,003,S.S. ANYAMA II-II (ADUBA - ANYAMA TOWN)
BAYELSA,05,OGBIA,04,Anyama,004,S.S. ANYAMA II-III (IGWE - ANYAMA TOWN)
BAYELSA,05,OGBIA,04,Anyama,005,S.S. ANYAMA II-IV (OTU IGOIN ANYAMA TOWN HALL)
BAYELSA,05,OGBIA,04,Anyama,006,S.S. ANYAMA II-V (ADEMA - ANYAMA TOWN)
BAYELSA,05,OGBIA,04,Anyama,007,S.S. - ANYAMA TOWN (ANYAMA - ANYAMA TOWN)
BAYELSA,05,OGBIA,04,Anyama,008,S.S .- ANYAMA TOWN (ATARI - ANYAMA TOWN)
BAYELSA,05,OGBIA,04,Anyama,009,S.S. - ANYAMA TOWN (IKPESU - ANYAMA TOWN)
BAYELSA,05,OGBIA,04,Anyama,010,S.S. - ANYAMA TOWN (EWI - ANYAMA TOWN)
BAYELSA,05,OGBIA,04,Anyama,011,G.S.S - ANYAMA TOWN
BAYELSA,05,OGBIA,04,Anyama,012,S.S. OLOGOHE
BAYELSA,05,OGBIA,04,Anyama,013,S.S – OLOGOHE (APOLO - OSUAN - OLOGOHE)
BAYELSA,05,OGBIA,04,Anyama,014,S.S – OLOGOHE (APOLO - OTAMA - OLOGOHE)
BAYELSA,05,OGBIA,04,Anyama,015,S.S – OLOGOHE (APOLO - OGBO - OLOGOHE)
BAYELSA,05,OGBIA,04,Anyama,016,S.S. OTUOBHI - OTUOBHI TOWN
BAYELSA,05,OGBIA,04,Anyama,017,S.S OTUOBHI TOWN (ATUBU - OTUOBHI TOWN)
BAYELSA,05,OGBIA,04,Anyama,018,S.S OTUOBHI TOWN (OBES - OTUOBHI TOWN)
BAYELSA,05,OGBIA,04,Anyama,019,S.S OTUOBHI TOWN (OBHI-IYI - OTUOBHI TOWN)
BAYELSA,05,OGBIA,04,Anyama,020,S.S. OKIKI- OKIKI TOWN
BAYELSA,05,OGBIA,04,Anyama,021,S.S OKIKI TOWN (EMADUG- OKIKI TOWN)
BAYELSA,05,OGBIA,04,Anyama,022,S.S OKIKI TOWN (OKIKI (II) - OKIKI TOWN)
BAYELSA,05,OGBIA,04,Anyama,023,"OTUAKANAGU, S.S."
BAYELSA,05,OGBIA,04,Anyama,024,S.S. OTUEKPEIN
BAYELSA,05,OGBIA,04,Anyama,025,S.S. OTUEPEIN (APOLOGBO - OTUEPEIN)
BAYELSA,05,OGBIA,05,Okodi,001,TOWN HALL - OKODI
BAYELSA,05,OGBIA,05,Okodi,002,S.S. OKODI - OKODI TOWN
BAYELSA,05,OGBIA,05,Okodi,003,G.S.S. OKODI I (ETIROLOGI - OKODI)
BAYELSA,05,OGBIA,05,Okodi,004,G.S.S. OKODI II (OGALAGA - OKODI)
BAYELSA,05,OGBIA,05,Okodi,005,G.S.S. OKODI III (IYOWOI - OKODI)
BAYELSA,05,OGBIA,05,Okodi,006,G.S.S. OKODI IV (JEREMIAH CAMP - OKODI)
BAYELSA,05,OGBIA,05,Okodi,007,G.S.S. OKODI V (SUNNY CAMP - OKODI)
BAYELSA,05,OGBIA,05,Okodi,008,G.S.S. OKODI VI (OWEDE CAMP - OKODI)
BAYELSA,05,OGBIA,05,Okodi,009,G.S.S. OKODI VII (IMIKI CAMP - OKODI)
BAYELSA,05,OGBIA,05,Okodi,010,S.S. EWAMA - EWAMA TOWN
BAYELSA,05,OGBIA,05,Okodi,011,S.S. EPEBU
BAYELSA,05,OGBIA,05,Okodi,012,TOWN HALL - EPEBU TOWN
BAYELSA,05,OGBIA,05,Okodi,013,G.S.S EPEBU ( (KRAKRAMA - EPEBU TOWN)
BAYELSA,05,OGBIA,05,Okodi,014,EPEBU TOWN HALL I (APOLOGBO - EPEBU TOWN)
BAYELSA,05,OGBIA,05,Okodi,015,EPEBU TOWN HALL II (OTUTU - EPEBU TOWN)
BAYELSA,05,OGBIA,05,Okodi,016,S.S EMADIKE (S.S. EMADIKE)
BAYELSA,05,OGBIA,05,Okodi,017,TOWN HALL EMADIKE I (OTUKURU - EMADIKE)
BAYELSA,05,OGBIA,05,Okodi,018,TOWN HALL - EMADIKE
BAYELSA,05,OGBIA,05,Okodi,019,S.S EPEBU II (LONDON AREA EPEBU)
BAYELSA,05,OGBIA,05,Okodi,020,OBED CAMP
BAYELSA,05,OGBIA,05,Okodi,021,OWILI CAMP
BAYELSA,05,OGBIA,05,Okodi,022,JACSONY CAMP
BAYELSA,05,OGBIA,06,Otuasega,001,G.S.S. OTUASEGA
BAYELSA,05,OGBIA,06,Otuasega,002,OTUASEGA TOWN HALL
BAYELSA,05,OGBIA,06,Otuasega,003,OTUASEGA TOWN CENTRE
BAYELSA,05,OGBIA,06,Otuasega,004,S.S. OTUASEGA I (NEW LAYOUT - OTUASEGA)
BAYELSA,05,OGBIA,06,Otuasega,005,S.S. OTUASEGA
BAYELSA,05,OGBIA,06,Otuasega,006,ORUMA TOWN HALL
BAYELSA,05,OGBIA,06,Otuasega,007,S.S. ORUMA I
BAYELSA,05,OGBIA,06,Otuasega,008,ORUMA TOWN HALL II (ORUMA NEWLAYOUT)
BAYELSA,05,OGBIA,06,Otuasega,009,ORUMA TOWN HALL III (OLODIAMA - ORUMA)
BAYELSA,05,OGBIA,06,Otuasega,010,S.S ORUMA I-II (AMAYANAOWE- ORUMA)
BAYELSA,05,OGBIA,06,Otuasega,011,S.S ORUMA I-III (OLODIAMA II - ORUMA)
BAYELSA,05,OGBIA,06,Otuasega,012,S.S. ORUMA II
BAYELSA,05,OGBIA,06,Otuasega,013,S.S ORUMA II-II (FUNTIRI - ORUMA)
BAYELSA,05,OGBIA,06,Otuasega,014,OTUE - EWE TOWN HALL
BAYELSA,05,OGBIA,06,Otuasega,015,S.S. IBELEBIRI
BAYELSA,05,OGBIA,06,Otuasega,016,IBELEBIRI TOWN HALL I (NEW AVENUE - IBELEBIRI)
BAYELSA,05,OGBIA,06,Otuasega,017,IBELEBIRI TOWN HALL
BAYELSA,05,OGBIA,07,Emeyal,001,EMEYAL I TOWN HALL
BAYELSA,05,OGBIA,07,Emeyal,002,EMEYAL 1 TOWN HALL II (EMEYAL I OBENEMA)
BAYELSA,05,OGBIA,07,Emeyal,003,TOWN HALL - EMEYA II
BAYELSA,05,OGBIA,07,Emeyal,004,C.S.S. EMEYA II-I (AWUSA COMP. - EMEYA II)
BAYELSA,05,OGBIA,07,Emeyal,005,C.S.S. EMEYA II-II (OGBARAKIM - EMEYA II)
BAYELSA,05,OGBIA,07,Emeyal,006,C.S.S. EMEYA II-III (R.C.M. - EMEYA II)
BAYELSA,05,OGBIA,07,Emeyal,007,C.S.S. EMEYA II-IV (OIL MILL - EMEYA II)
BAYELSA,05,OGBIA,07,Emeyal,008,UPE EMEYA II-I (ELEMA - EMEYA II)
BAYELSA,05,OGBIA,07,Emeyal,009,UPE EMEYA II-II (OTUOGBORUMA - EMEYA II)
BAYELSA,05,OGBIA,07,Emeyal,010,TOWN HALL - EMEYAL II
BAYELSA,05,OGBIA,07,Emeyal,011,UPE EMEYA II-III (CAT GUEST HOUSE II)
BAYELSA,05,OGBIA,07,Emeyal,012,UPE EMEYA II-III (EKPODIDI - EMEYAL II)
BAYELSA,05,OGBIA,08,Imiringi,001,IMIRINGI TOWN HALL I (OBENEMA - IMIRINGI)
BAYELSA,05,OGBIA,08,Imiringi,002,IMIRINGI TOWN HALL
BAYELSA,05,OGBIA,08,Imiringi,003,IMIRINGI TOWN HALL III (IYI - IMIRINGI)
BAYELSA,05,OGBIA,08,Imiringi,004,S.S. IMIRINGI
BAYELSA,05,OGBIA,08,Imiringi,005,POWER STATION
BAYELSA,05,OGBIA,08,Imiringi,006,G.S.S. IMIRINGI (CHIEF OWUDOGU - IMIRINGI)
BAYELSA,05,OGBIA,08,Imiringi,007,TOWN HALL ELEBELE I (BETTER LAND ELEBELE)
BAYELSA,05,OGBIA,08,Imiringi,008,TOWN HALL - ELEBELE
BAYELSA,05,OGBIA,08,Imiringi,009,TOWN HALL ELEBELE III (APOLO-OGBO - ELEBELE)
BAYELSA,05,OGBIA,08,Imiringi,010,RISONPALM J.R.Q - ELEBELE
BAYELSA,05,OGBIA,08,Imiringi,011,S.S. - ELEBELE
BAYELSA,05,OGBIA,08,Imiringi,012,G.S.S. ELEBELE I (OBENEMA ELEBELE)
BAYELSA,05,OGBIA,08,Imiringi,013,G.S.S. ELEBELE II (EBEL - LELEBERE)
BAYELSA,05,OGBIA,08,Imiringi,014,G.S.S. ELEBELE III (IDIBOL - ELEBELE)
BAYELSA,05,OGBIA,08,Imiringi,015,SHELL STATION IMIRINGI
BAYELSA,05,OGBIA,08,Imiringi,016,TOWN HALL- IMIRINGI IV (VILLAGE SQ-IMIRINGI)
BAYELSA,05,OGBIA,08,Imiringi,017,G.S.S. ELEBELE IV (APOLO-OTAMA-ELEBELE)
BAYELSA,05,OGBIA,08,Imiringi,018,G.S.S. ELEBELE V (APOLO-OSUAN ELEBELE)
BAYELSA,05,OGBIA,09,Kolo,001,KOLO I TOWN HALL
BAYELSA,05,OGBIA,09,Kolo,002,HEALTH CENTRE KOLO I
BAYELSA,05,OGBIA,09,Kolo,003,KOLO II TOWN HALL
BAYELSA,05,OGBIA,09,Kolo,004,WAITING SHED KOLO II
BAYELSA,05,OGBIA,09,Kolo,005,UBE KOLO II-I (OPEN GROUND KOLO II)
BAYELSA,05,OGBIA,09,Kolo,006,KOLO III TOWN HALL
BAYELSA,05,OGBIA,09,Kolo,007,KOLO III TOWN HALL II (POLICE STATION KOLON III)
BAYELSA,05,OGBIA,09,Kolo,008,CIVIC CENTRE KOLO III
BAYELSA,05,OGBIA,09,Kolo,009,S.S. AMOROKENI
BAYELSA,05,OGBIA,09,Kolo,010,UBE KOLO II-II (KOLO II PLAY GROUND)
BAYELSA,05,OGBIA,09,Kolo,011,UBE KOLO II-III (OTUODU CENTRE KOLO II)
BAYELSA,05,OGBIA,09,Kolo,012,UBE KOLO II-IIV (OTUOGLE KOLO II)
BAYELSA,05,OGBIA,09,Kolo,013,KOLO HEALTH C. KOLO I
BAYELSA,05,OGBIA,09,Kolo,014,S.S. KOLO III (OUT - ADIGI KOLO III)
BAYELSA,05,OGBIA,10,Oloibiri,001,O.G.S. OLOIBIRI
BAYELSA,05,OGBIA,10,Oloibiri,002,O.G.S. OLOIBIRI I (S.K. IBEGU-OLOIBIRI)
BAYELSA,05,OGBIA,10,Oloibiri,003,NATIVE COURT OLOIBIRI
BAYELSA,05,OGBIA,10,Oloibiri,004,O.G.S. OLOIBIRI II (PLAY GROUND - OLOIBIRI)
BAYELSA,05,OGBIA,10,Oloibiri,005,O.G.S. OLOIBIRI III (AMANGALA - OLOIBIRI)
BAYELSA,05,OGBIA,10,Oloibiri,006,O.G.S. OLOIBIRI IV (EWOAMA - OLOIBIRI)
BAYELSA,05,OGBIA,10,Oloibiri,007,S.S. - OLOIBIRI
BAYELSA,05,OGBIA,10,Oloibiri,008,G.S.S. OLOIBIRI (IYOKPO - OLOIBIRI)
BAYELSA,05,OGBIA,10,Oloibiri,009,CIVIC CENTRE - OLOIBIRI
BAYELSA,05,OGBIA,10,Oloibiri,010,OLOIBIRI COURT HALL
BAYELSA,05,OGBIA,11,Opume,001,OPUME TOWN HALL I (OTUEKON - OPUME)
BAYELSA,05,OGBIA,11,Opume,002,OPUME TOWN HALL II (AMAROKON - OPUME)
BAYELSA,05,OGBIA,11,Opume,003,OPUME TOWN HALL III (PARADISE - OPUME)
BAYELSA,05,OGBIA,11,Opume,004,OPUME TOWN HALL IV (ADUMO SQ - OPUME)
BAYELSA,05,OGBIA,11,Opume,005,G.S.S OPUME (OZE - OPUME)
BAYELSA,05,OGBIA,11,Opume,006,S.S. - OPUME
BAYELSA,05,OGBIA,11,Opume,007,ESAN TOWN HALL OPUME (ESAN - OPUME)
BAYELSA,05,OGBIA,11,Opume,008,UBE OPUME I (OYILOLO - OPUME)
BAYELSA,05,OGBIA,11,Opume,009,UBE OPUME II (IMOTI - OPUME)
BAYELSA,05,OGBIA,11,Opume,010,UBE OPUME III (OKOIN - OPUME)
BAYELSA,05,OGBIA,11,Opume,011,UBE OPUME IV (INETIMI - OPUME)
BAYELSA,05,OGBIA,11,Opume,012,UBE OPUME V (ISIBO - OPUME)
BAYELSA,05,OGBIA,11,Opume,013,UBE OPUME VI (OTU/IGWE-OPUME)
BAYELSA,05,OGBIA,11,Opume,014,CSS EMAKALKALA I (OWEI - EMAKALAKALA)
BAYELSA,05,OGBIA,11,Opume,015,CSS EMAKALKALA II (ARIBO SQUARE (EMAKALAKALA))
BAYELSA,05,OGBIA,11,Opume,016,S.S. EMAKALAKALA
BAYELSA,05,OGBIA,11,Opume,017,CSS EMAKALKALA III (IBIDI SQUARE - EMAKALAKALA)
BAYELSA,05,OGBIA,11,Opume,018,S.S EMAKALKALA II (DEDE SQ. - EMAKALAKALA)
BAYELSA,05,OGBIA,11,Opume,019,S.S EMAKALKALA III (OWABA - EMAKALAKALA)
BAYELSA,05,OGBIA,11,Opume,020,MISSION SCH. AKIPELAI I (IGABABA - AKIPELAA)
BAYELSA,05,OGBIA,11,Opume,021,MISSION SCH. AKIPELAI II (ABA - AKIPELAA)
BAYELSA,05,OGBIA,11,Opume,022,AKARAKA (AKARAKA)
BAYELSA,05,OGBIA,11,Opume,023,"SCHOOL MISSION, AKIPELAI"
BAYELSA,05,OGBIA,11,Opume,024,AKIPELAI PLAY GROUND
BAYELSA,05,OGBIA,12,Otakeme,001,S.S. OTAKEME I (OTUOGAL - OTAKEME)
BAYELSA,05,OGBIA,12,Otakeme,002,S.S. OTAKEME II (DANGOSU - OTAKEME)
BAYELSA,05,OGBIA,12,Otakeme,003,S.S. OTAKEME III (MAC-ETELI COMP - OTAKEME)
BAYELSA,05,OGBIA,12,Otakeme,004,S.S. - OTAKEME
BAYELSA,05,OGBIA,12,Otakeme,005,OTAKEME TOWN HALL I (APOLO-SUAN - OTAKEME)
BAYELSA,05,OGBIA,12,Otakeme,006,OTAKEME TOWN HALL II (ODOGU - OTAKEME)
BAYELSA,05,OGBIA,12,Otakeme,007,S.S. OTEGILA - OTAKEME
BAYELSA,05,OGBIA,12,Otakeme,008,OTUOGIDI S.S. - OTUOGIDI
BAYELSA,05,OGBIA,12,Otakeme,009,S.S. OTUOGIDI II (EFAWARI - OTUOGIDI)
BAYELSA,05,OGBIA,12,Otakeme,010,S.S. OTUOGIDI III (IKENI CAMP - OTUOGIDI)
BAYELSA,05,OGBIA,12,Otakeme,011,S.S. OTUOGIDI IV (FABERE - OTUOGIDI)
BAYELSA,05,OGBIA,12,Otakeme,012,S.S. ABOBIRI ABOBIRI TOWN
BAYELSA,05,OGBIA,12,Otakeme,013,ABOBIRI TOWN HALL
BAYELSA,05,OGBIA,12,Otakeme,014,S.S. ABOBIRI II (AGRIC STATION - ABOBIRI)
BAYELSA,05,OGBIA,12,Otakeme,015,U.P.E. - OTABAGI
BAYELSA,05,OGBIA,12,Otakeme,016,TOWN HALL–OTABAGI I (B.S.A. SQUARE. OTABAGI)
BAYELSA,05,OGBIA,12,Otakeme,017,TOWN HALL–OTABAGI II (IBHOLANS - OTABAGI)
BAYELSA,05,OGBIA,12,Otakeme,018,S.S.OTABAGI I (EBEDE CAMP - OTABAGI)
BAYELSA,05,OGBIA,12,Otakeme,019,S.S. OTABI - OTABI TOWN
BAYELSA,05,OGBIA,12,Otakeme,020,WAITING SHED - OTABI
BAYELSA,05,OGBIA,12,Otakeme,021,TOWN HALL - OTABI
BAYELSA,05,OGBIA,12,Otakeme,022,S.S. AKOLOMAN - OTABI
BAYELSA,05,OGBIA,12,Otakeme,023,"S.S. OTABAGI II (NDELE CAMP, OTABAGI)"
BAYELSA,05,OGBIA,12,Otakeme,024,S.S. OTUOGIDI III (OZU CAMP OTUOGIDI)
BAYELSA,05,OGBIA,12,Otakeme,025,SHELL OTUOGIDI
BAYELSA,05,OGBIA,13,Otuabula,001,S.S. OTUABULA I
BAYELSA,05,OGBIA,13,Otuabula,002,S.S OTUABULA I-II (OTUAGBERISI - OTUBULA 1)
BAYELSA,05,OGBIA,13,Otuabula,003,S.S OTUABULA I-III (OLOGO - GBO - OTUABULA)
BAYELSA,05,OGBIA,13,Otuabula,004,S.S OTUABULA I-IV (OGURUMATA - OTUABULA)
BAYELSA,05,OGBIA,13,Otuabula,005,S.S OTUABULA I-V (AFE - OTUABULA I)
BAYELSA,05,OGBIA,13,Otuabula,006,S.S OTUABULA I-VI (ABI - OTUABULA I)
BAYELSA,05,OGBIA,13,Otuabula,007,S.S OTUABULA I-VII (OBANEMA - OTUABULA I)
BAYELSA,05,OGBIA,13,Otuabula,008,S.S OTUABULA I-VIII (ALAGBA - OTUABULA I)
BAYELSA,05,OGBIA,13,Otuabula,009,S.S OTUABULA I-IX (AKALAOGOLO - OTUABULA I)
BAYELSA,05,OGBIA,13,Otuabula,010,MISSION - OTUABULA I
BAYELSA,05,OGBIA,13,Otuabula,011,S.S. OTUABULA II
BAYELSA,05,OGBIA,13,Otuabula,012,S.S OTUABULA II-II (OBAKUBO - OTUABULA II)
BAYELSA,05,OGBIA,13,Otuabula,013,S.S OTUABULA II-III (APOLO - OGBO - OTUABULA II)
BAYELSA,05,OGBIA,13,Otuabula,014,S.S OTUABULA II-IV (AGBAL - OTUABULA II)
BAYELSA,05,OGBIA,13,Otuabula,015,S.S OTUABULA II-V (AKPEMKPEM - OTUABULA II)
BAYELSA,05,OGBIA,13,Otuabula,016,S.S. OTUOKE - OTUOKE TOWN
BAYELSA,05,OGBIA,13,Otuabula,017,S.S OTUOKE II (ORU COMP. OTUOKE TOWN)
BAYELSA,05,OGBIA,13,Otuabula,018,S.S OTUOKE III (AWORABHI - OTUOKE TOWN)
BAYELSA,05,OGBIA,13,Otuabula,019,S.S OTUOKE IV (APOLO - OTAMA - OTUOKE TOWN)
BAYELSA,05,OGBIA,13,Otuabula,020,CIVIC CENTRE OTUOKE I (APOLO OSUAN - OTUOKE)
BAYELSA,05,OGBIA,13,Otuabula,021,CIVIC CENTRE OTUOKE II (EWOKIRI - OTUOKE)
BAYELSA,05,OGBIA,13,Otuabula,022,S.S. OTUABA - OTUABA TOWN
BAYELSA,05,OGBIA,13,Otuabula,023,OTUABA TOWN HALL
BAYELSA,05,OGBIA,13,Otuabula,024,S.S. OTUABA II (APOLO - OGBO - OTUABA)
BAYELSA,05,OGBIA,13,Otuabula,025,SS OTUABA TOWN III (ADEMA - OTUABA TOWN)
BAYELSA,05,OGBIA,13,Otuabula,026,SS OTUABA TOWN IV (OTAMA - OTUABA TOWN)
BAYELSA,05,OGBIA,13,Otuabula,027,SS OTUABA TOWN V (ELABIO - OTUABA TOWN)
BAYELSA,05,OGBIA,13,Otuabula,028,SS OTUABA TOWN VI (EMABI - OTUABA TOWN)
BAYELSA,05,OGBIA,13,Otuabula,029,TOWN HALL OTUABA II (OGOTORU - OTUABA TOWN)
BAYELSA,05,OGBIA,13,Otuabula,030,S.S. EWOI - EWOI TOWN
BAYELSA,05,OGBIA,13,Otuabula,031,S.S. OWOI II (ATUBU - OWOI TOWN)
BAYELSA,05,OGBIA,13,Otuabula,032,S.S. EWOI III (OTUAYELEBA - EWOI TOWN)
BAYELSA,05,OGBIA,13,Otuabula,033,S.S. EWOI IV (ITUMA'S PALACE - EWOI TOWN)
BAYELSA,05,OGBIA,13,Otuabula,034,ABULA CAMP - OTUABULA I
BAYELSA,05,OGBIA,13,Otuabula,035,TOWN HALL OTUAKE (OMOMEMA - OTUAKA)
BAYELSA,05,OGBIA,13,Otuabula,036,TOWN HALL OTUABA III ( (OYAIN OTUABA)
BAYELSA,05,OGBIA,13,Otuabula,037,TOWN HALL OTUABA IV (OGBOGI OTUABA)
BAYELSA,05,OGBIA,13,Otuabula,038,OTUASE OTUABULA
BAYELSA,05,OGBIA,13,Otuabula,039,OTAZI PLAY GROUND
BAYELSA,05,OGBIA,13,Otuabula,040,ORUBIRI OPEN SQUARE
BAYELSA,06,SAGBAMA,01,Agbere,001,"AYAMA, CPS HALL I"
BAYELSA,06,SAGBAMA,01,Agbere,002,TUBURUKUNU - CPS HALL II
BAYELSA,06,SAGBAMA,01,Agbere,003,"KAKARABIRI, CPS HALL III"
BAYELSA,06,SAGBAMA,01,Agbere,004,"TAMBIRI, CPS HALL IIII"
BAYELSA,06,SAGBAMA,01,Agbere,005,"BIUGBENE, COMM. SQUARE"
BAYELSA,06,SAGBAMA,01,Agbere,006,"EGBONNEI - AWA , COMM. SQUARE"
BAYELSA,06,SAGBAMA,01,Agbere,007,"GBOKU/ABARUGU-AMA, COMM. SQUARE"
BAYELSA,06,SAGBAMA,01,Agbere,008,RIVER NUN GRAMMER SCHOOL I (OPOKUMAOWEI/OVURUAMA TOWN)
BAYELSA,06,SAGBAMA,01,Agbere,009,"RIVER NUN GRAMMER SCH. II (ODOKOWARI, COMM. SQUARE)"
BAYELSA,06,SAGBAMA,01,Agbere,010,"RIVER NUN GRAMMER SCH. III (OGBOKIRIAMA, COMM. SQUARE)"
BAYELSA,06,SAGBAMA,02,Angalabiri,001,BEMAWARE; CPS HALL I
BAYELSA,06,SAGBAMA,02,Angalabiri,002,BEMAWARE; CPS HALL II
BAYELSA,06,SAGBAMA,02,Angalabiri,003,OKAUGBENE COMMTY HALL (OKAUGBENE - COMP SQUARE)
BAYELSA,06,SAGBAMA,02,Angalabiri,004,DEIWARE - TOWN HALL
BAYELSA,06,SAGBAMA,02,Angalabiri,005,ORUEREWARE COMMTY HALL (ORUEREWARE - COMP. SQUARE)
BAYELSA,06,SAGBAMA,02,Angalabiri,006,TAMOBIRI COMMTY HALL (TAMOBIRI - TAMOBIRI COMP.)
BAYELSA,06,SAGBAMA,02,Angalabiri,007,AKPANAKAKAWARE - CPS HALL
BAYELSA,06,SAGBAMA,02,Angalabiri,008,AFROMATA - CPS HALL II
BAYELSA,06,SAGBAMA,02,Angalabiri,009,ODUMARIGHAGBENE - CSS HALL
BAYELSA,06,SAGBAMA,02,Angalabiri,010,OGIDIPELEI - CSS HALL
BAYELSA,06,SAGBAMA,02,Angalabiri,011,TURUBIRI COMMTY HALL (TUBURUBIRI - COMP. SQUARE)
BAYELSA,06,SAGBAMA,02,Angalabiri,012,AYAOGBO COMMTY HALL (AYAOGBO - COMP. SQUARE)
BAYELSA,06,SAGBAMA,02,Angalabiri,013,OGBIGBENE COMMTY HALL I (OGBIGBENE - COMP. SQUARE I)
BAYELSA,06,SAGBAMA,02,Angalabiri,014,OGBIGBENE COMMTY HALL II (OGBIGBENE - COMP. SQUARE II)
BAYELSA,06,SAGBAMA,02,Angalabiri,015,"WELSONWARE, PRIM. SCHOOL HALL"
BAYELSA,06,SAGBAMA,02,Angalabiri,016,EGBEINWARE - PRIMARY SCHOOL HALL
BAYELSA,06,SAGBAMA,02,Angalabiri,017,GUAWARE COMMTY HALL (GUAWARE - GUARE SQUARE)
BAYELSA,06,SAGBAMA,02,Angalabiri,018,ARAMABIRI - PRIMARY SCHOOL HALL II
BAYELSA,06,SAGBAMA,02,Angalabiri,019,KALABOYE COMMTY HALL (KALABOYE - KALABOYE SQUARE)
BAYELSA,06,SAGBAMA,02,Angalabiri,020,TORUKUBU - COMM. TOWN HALL
BAYELSA,06,SAGBAMA,02,Angalabiri,021,OLODIAMAWARE - COMP. SQUARE
BAYELSA,06,SAGBAMA,02,Angalabiri,022,OWOLOGBEBE COMMTY HALL (OWOLOGBEBE - TOWN SQUARE)
BAYELSA,06,SAGBAMA,02,Angalabiri,023,TARAMAGBENE - SEC. SCH. HALL
BAYELSA,06,SAGBAMA,02,Angalabiri,024,DUKUNU - COMM. TOWN HALL
BAYELSA,06,SAGBAMA,02,Angalabiri,025,TEINKUNU COMMTY HALL I (TEINKUNU - TOWN SQUARE)
BAYELSA,06,SAGBAMA,02,Angalabiri,026,OZIGBOWARE COMMTY HALL (OZIGBOWARE - COMP. SQUARE)
BAYELSA,06,SAGBAMA,02,Angalabiri,027,TEINKUNU COMMTY HALL II (TEINKUNU - TOWN SQUARE II)
BAYELSA,06,SAGBAMA,03,Ofoni I,001,OGBERIDOLOEDIAGBO - TOWN HALL
BAYELSA,06,SAGBAMA,03,Ofoni I,002,OGBEREDAFE - TOWN HALL
BAYELSA,06,SAGBAMA,03,Ofoni I,003,UGBEGORO - UGBEGORO HOUSE
BAYELSA,06,SAGBAMA,03,Ofoni I,004,OKEDI - CPS I OFONI
BAYELSA,06,SAGBAMA,03,Ofoni I,005,ETEFE - CPS III OFONI
BAYELSA,06,SAGBAMA,03,Ofoni I,006,OVWODOKPOKPO - OGBE CPS III
BAYELSA,06,SAGBAMA,03,Ofoni I,007,KALABAI - CSS OFONI
BAYELSA,06,SAGBAMA,03,Ofoni I,008,ERHURUTO - CPS IV OFONI
BAYELSA,06,SAGBAMA,03,Ofoni I,009,EGBO - TOWN HALL
BAYELSA,06,SAGBAMA,03,Ofoni I,010,OKEDI II - CPS I OFONI
BAYELSA,06,SAGBAMA,03,Ofoni I,011,EGBO II - TOWN HALL
BAYELSA,06,SAGBAMA,04,Ofoni II,001,OGBERIRORO - CPS II OFONI
BAYELSA,06,SAGBAMA,04,Ofoni II,002,OGBERUFUOMA - CPS II OFONI
BAYELSA,06,SAGBAMA,04,Ofoni II,003,EAMUTO - OGBE HALL
BAYELSA,06,SAGBAMA,04,Ofoni II,004,EKADEYA - OGBE HALL
BAYELSA,06,SAGBAMA,04,Ofoni II,005,UBROWHAWHA - TOWN HALL
BAYELSA,06,SAGBAMA,04,Ofoni II,006,UBROGBO - TOWN HALL
BAYELSA,06,SAGBAMA,04,Ofoni II,007,ESEFENA - CPS IV OFONI
BAYELSA,06,SAGBAMA,04,Ofoni II,008,UTORODE - CPS II OFONI
BAYELSA,06,SAGBAMA,04,Ofoni II,009,ESTITSORA - TOWN HALL
BAYELSA,06,SAGBAMA,04,Ofoni II,010,OVWODOKPOKPO - CPS I OFONI
BAYELSA,06,SAGBAMA,05,Ebedebiri,001,"AGBOBUWARE - GOVT. REST, HOUSE"
BAYELSA,06,SAGBAMA,05,Ebedebiri,002,AYARENWARE - CPS HALL I
BAYELSA,06,SAGBAMA,05,Ebedebiri,003,EBUNUANWARE - REST HOUSE
BAYELSA,06,SAGBAMA,05,Ebedebiri,004,AYETOROWARE - TOWN SQUARE
BAYELSA,06,SAGBAMA,05,Ebedebiri,005,ETUAWARE TOWN SQUARE
BAYELSA,06,SAGBAMA,05,Ebedebiri,006,ABENIWARE - TOWN SQUARE
BAYELSA,06,SAGBAMA,05,Ebedebiri,007,AYAMAWARE/OGONUWARI - CPS HALL
BAYELSA,06,SAGBAMA,05,Ebedebiri,008,EGEREWARE - GOVT. REST HOUSE
BAYELSA,06,SAGBAMA,05,Ebedebiri,009,OFURUWARE COMMTY HALL (OGBAZI - COMP SQR)
BAYELSA,06,SAGBAMA,05,Ebedebiri,010,EBEDEBIRI TOWN HALL (OFORU WARE - COMP. SQUARE)
BAYELSA,06,SAGBAMA,05,Ebedebiri,011,AYABIRI - AYABIRI HALL
BAYELSA,06,SAGBAMA,05,Ebedebiri,012,OPOUBAGBENE - MARKET HALL
BAYELSA,06,SAGBAMA,05,Ebedebiri,013,FOUBIRI - MARKET SQUARE
BAYELSA,06,SAGBAMA,05,Ebedebiri,014,OLOKAWARE - MARKET SQUARE
BAYELSA,06,SAGBAMA,05,Ebedebiri,015,EPANBOGBENE - CPS HALL
BAYELSA,06,SAGBAMA,05,Ebedebiri,016,AREHWARE -CPS HALL
BAYELSA,06,SAGBAMA,05,Ebedebiri,017,COMMTY PRI. SCHOOL I (TIEGBEDE - COMP. SQUARE)
BAYELSA,06,SAGBAMA,05,Ebedebiri,018,COMMTY PRI. SCHOOL II (OKOLOMA - COMP. SQUARE)
BAYELSA,06,SAGBAMA,05,Ebedebiri,019,OFORIPEEPEI - MARKET
BAYELSA,06,SAGBAMA,05,Ebedebiri,020,BOUBIRI - MARKET SQUARE
BAYELSA,06,SAGBAMA,06,Ossiama,001,TANYIN - TOWN HALL
BAYELSA,06,SAGBAMA,06,Ossiama,002,KUROBIRI/KINGPOLO - TOWN HALL
BAYELSA,06,SAGBAMA,06,Ossiama,003,AKOROMOBIRI - MARKET SQUARE
BAYELSA,06,SAGBAMA,06,Ossiama,004,OMUBIRI/KPANKPOWARE - TOWN HALL
BAYELSA,06,SAGBAMA,06,Ossiama,005,KILEBIRI - TOWN HALL
BAYELSA,06,SAGBAMA,06,Ossiama,006,WARRIGBENE - CPS HALL
BAYELSA,06,SAGBAMA,06,Ossiama,007,EGBEPULOGBENE CPS I
BAYELSA,06,SAGBAMA,06,Ossiama,008,OPUPOLO - CPS HALL II
BAYELSA,06,SAGBAMA,06,Ossiama,009,AWEGBENE - TOWN HALL
BAYELSA,06,SAGBAMA,06,Ossiama,010,OGBONUGBENE COMPOUND SQUARE I
BAYELSA,06,SAGBAMA,06,Ossiama,011,OGBONUGBENE COMPOUND SQUARE II
BAYELSA,06,SAGBAMA,07,Asamabiri,001,AYAMA - PRIMARY SCHOOL
BAYELSA,06,SAGBAMA,07,Asamabiri,002,TAMUKUNU - PRIMARY SCHOOL
BAYELSA,06,SAGBAMA,07,Asamabiri,003,EBIEGBEDE TOWN HALL
BAYELSA,06,SAGBAMA,07,Asamabiri,004,TAMUKUNU PRI. SCH. (ODUBOGBAOGBO - COMP. SQUARE)
BAYELSA,06,SAGBAMA,07,Asamabiri,005,AYAMA PRI. SCHOOL (OLOMU - COMP. SQUARE)
BAYELSA,06,SAGBAMA,07,Asamabiri,006,EPROH - ANAM CAMP
BAYELSA,06,SAGBAMA,07,Asamabiri,007,EKPERIWARE - TOWN HALL
BAYELSA,06,SAGBAMA,07,Asamabiri,008,AKPEDI - COMP HALL
BAYELSA,06,SAGBAMA,07,Asamabiri,009,KARIAZI - PRIMARY SCHOOL HALL
BAYELSA,06,SAGBAMA,07,Asamabiri,010,AFRICA - SEC. SCHOOL HALL
BAYELSA,06,SAGBAMA,07,Asamabiri,011,"OFONIAWOR - COMP,SQUARE"
BAYELSA,06,SAGBAMA,07,Asamabiri,012,AKPEDE - TOWN HALL
BAYELSA,06,SAGBAMA,07,Asamabiri,013,KARIAZI PRI. SCH. HALL (ORUAMA - COMP. SQUARE)
BAYELSA,06,SAGBAMA,07,Asamabiri,014,AFRICA SEC SCH. HALL (OTUASAMOH - COMP. SQUARE)
BAYELSA,06,SAGBAMA,08,Odoni,001,GBEKEBO COMMTY HALL (GBEKEBOR - COMP SQUARE)
BAYELSA,06,SAGBAMA,08,Odoni,002,OGBO-ODONI COMMTY HALL (OGBO - ODONI - COMP . SQUARE)
BAYELSA,06,SAGBAMA,08,Odoni,003,POU-ODONI COMMTY HALL (POU-ODONI - COMP. SQUARE)
BAYELSA,06,SAGBAMA,08,Odoni,004,TAMU-ODONI COMMTY HALL (TAMU - ODONI - COMP. SQUARE)
BAYELSA,06,SAGBAMA,08,Odoni,005,EWERI COMMTY HALL (EWERI - COMP. SQUARE)
BAYELSA,06,SAGBAMA,08,Odoni,006,OGBO COMMTY HALL (UBAGBENE/AMAKIRI OGBO - COMP SQUARE)
BAYELSA,06,SAGBAMA,08,Odoni,007,GBETAM-AMA COMMTY HALL (GBETAM - AMA-COMP. SQUARE)
BAYELSA,06,SAGBAMA,08,Odoni,008,OWUOBIRIAMA COMMTY HALL (OWOUBIRIAMA - COMP. SQUARE)
BAYELSA,06,SAGBAMA,08,Odoni,009,NAKUNA-AMA COMMTY HALL (NAKUNA - AMA- COMP. SQUARE)
BAYELSA,06,SAGBAMA,08,Odoni,010,OWUSA BENINIAMA COMMTY HALL (OWUSA BENINIAMA - COMP. SQUARE)
BAYELSA,06,SAGBAMA,08,Odoni,011,ADUKU - CPS HALL
BAYELSA,06,SAGBAMA,08,Odoni,012,AKEMI COMMTY HALL (AKEMI - COMP. SQUARE)
BAYELSA,06,SAGBAMA,09,Trofani,001,ABAZI - COMP. SQUARE
BAYELSA,06,SAGBAMA,09,Trofani,002,PINABOSEIGHA - SEC. SCH. HALL
BAYELSA,06,SAGBAMA,09,Trofani,003,AFIAWARE - SEC. SCH. HALL
BAYELSA,06,SAGBAMA,09,Trofani,004,OKPOBIRI COMMTY HALL (OKPOBIRI - COMP SQUARE)
BAYELSA,06,SAGBAMA,09,Trofani,005,ABRUDONOR COMMTY HALL (ABRUDONOR - COMP SQUARE)
BAYELSA,06,SAGBAMA,09,Trofani,006,EKORIKORI COMMTY HALL (EKORIKORI - COMP. SQUARE)
BAYELSA,06,SAGBAMA,10,Sagbama,001,COMMTY PRI. SCH. I (OWEINAMAZI/OZALA - COMP. SQUARE)
BAYELSA,06,SAGBAMA,10,Sagbama,002,COMMTY PRI. SCH. II (EMBAREBAZI - COMP. SQUARE)
BAYELSA,06,SAGBAMA,10,Sagbama,003,COMMTY PRI. SCH. III (ADWEZE/AZAWOZI - COMP. SQUARE)
BAYELSA,06,SAGBAMA,10,Sagbama,004,COMMTY PRI. SCH. IV (INDIAMAZI/AYAMA - COMP SQUARE)
BAYELSA,06,SAGBAMA,10,Sagbama,005,COMMTY SEC SCH. I (KOKPO - COMP SQUARE)
BAYELSA,06,SAGBAMA,10,Sagbama,006,COMMTY PRI. SCH. V (SAGBAMA - COMP SQUARE)
BAYELSA,06,SAGBAMA,10,Sagbama,007,COMMTY SEC SCH. II (OKOROZI - COMP SQUARE)
BAYELSA,06,SAGBAMA,10,Sagbama,008,COMMTY PRI. SCH. VI (OGUOUMUGUDU - COMP SQUARE)
