state,lga_code,lga_name,ward_code,ward_name,pu_code,pu_name
BAYELSA,01,BRASS,01,Brass I,001,TOWN COMMUNITY SCHOOL BUILDING
BAYELSA,01,BRASS,01,Brass I,002,COMMUNITY TOWN HALL (GBUNDU OPEN SPACE)
BAYELSA,01,BRASS,01,Brass I,003,ADA-AMA TOWN HALL. (ADA OPEN SPACE)
BAYELSA,01,BRASS,01,Brass I,004,AGIP COMPLEX (AGIP SITE IND. OPEN SP)
BAYELSA,01,BRASS,01,Brass I,005,SHIDI COMPOUND OPEN SPACE
BAYELSA,01,BRASS,01,Brass I,006,MARKET SQUARE OPEN SPACE
BAYELSA,01,BRASS,01,Brass I,007,IGBODO 1 OPEN SPACE
BAYELSA,01,BRASS,01,Brass I,008,AGIP SITE OPEN SPACE
BAYELSA,01,BRASS,01,Brass I,009,ALAFIE OPEN SPACE
BAYELSA,01,BRASS,01,Brass I,010,BOUTIBI OPEN SPACE
BAYELSA,01,BRASS,01,Brass I,011,ANDREW POLO OPEN SPACE
BAYELSA,01,BRASS,01,Brass I,012,INABUNA OPEN SPACE
BAYELSA,01,BRASS,01,Brass I,013,INGO POLO OPEN SPACE
BAYELSA,01,BRASS,01,Brass I,014,CAMEROUN OPEN SPACE
BAYELSA,01,BRASS,01,Brass I,015,ADA-AMA TOWN HALL (SAMBO I OPEN SPACE)
BAYELSA,01,BRASS,01,Brass I,016,ADA-AMA OPEN SPACE (GEORGE POLO OPEN SPACE)
BAYELSA,01,BRASS,01,Brass I,017,APOSTOLIC COMMUNITY HALL
BAYELSA,01,BRASS,01,Brass I,018,APOSTOLIC COMM. HALL (EREFAMOKUMA OPEN SPACE)
BAYELSA,01,BRASS,01,Brass I,019,EGLA COMPOUND OPEN SPACE
BAYELSA,01,BRASS,01,Brass I,020,JANE COMPOUND OPEN SPACE
BAYELSA,01,BRASS,01,Brass I,021,SAMPSON COMPOUND OPEN SPACE
BAYELSA,01,BRASS,01,Brass I,022,ENINAH OPEN SPACE
BAYELSA,01,BRASS,02,Brass Ward II,001,TWON COMMUNITY KEMMER OPEN SPACE
BAYELSA,01,BRASS,02,Brass Ward II,002,KEMMER TOWN HALL (CONSULATE OPEN SPACE)
BAYELSA,01,BRASS,02,Brass Ward II,003,KEMMER SQUARE (FIRE STATION OP. SP.)
BAYELSA,01,BRASS,02,Brass Ward II,004,TWON KUBU COMM. HALL (GEN. HOSP. OPEN SPACE)
BAYELSA,01,BRASS,02,Brass Ward II,005,TWON KUBU COMM. HALL (DOGOYE POLO OPEN SPACE)
BAYELSA,01,BRASS,02,Brass Ward II,006,TWON KUBU SQUARE (SUNNY POLO OPEN SPACE)
BAYELSA,01,BRASS,02,Brass Ward II,007,TWON KUBU COMMUNITY HALL
BAYELSA,01,BRASS,02,Brass Ward II,008,GENERAL HOSPITAL (LOCATION KIRI COMM HALL)
BAYELSA,01,BRASS,02,Brass Ward II,009,G.S.S TWON SCHOOL BUILDING
BAYELSA,01,BRASS,02,Brass Ward II,010,GIRLS SEC. SCH. (KALAOROBUO OPEN SPACE)
BAYELSA,01,BRASS,02,Brass Ward II,011,G.S.S. TWON SCH. BUILD. (SINTEH POLO OPEN SPACE)
BAYELSA,01,BRASS,02,Brass Ward II,012,CUSTOMARY COURT COURT HALL
BAYELSA,01,BRASS,02,Brass Ward II,013,MANSONKIRI OPEN SPACE
BAYELSA,01,BRASS,02,Brass Ward II,014,ASNOGBAKIRI OPEN SPACE
BAYELSA,01,BRASS,02,Brass Ward II,015,ONABAGO
BAYELSA,01,BRASS,02,Brass Ward II,016,MICAH - KIRI OPEN SPACE
BAYELSA,01,BRASS,03,Ewoama/Fantuo,001,SIERI POLO COMMUNITY HALL
BAYELSA,01,BRASS,03,Ewoama/Fantuo,002,SIERI POLO OPEN SPACE
BAYELSA,01,BRASS,03,Ewoama/Fantuo,003,JOHN POLO OPEN SPACE
BAYELSA,01,BRASS,03,Ewoama/Fantuo,004,DIRIKIRI SCH. BUILD. (ITI-KIRI OPOEN SPACE)
BAYELSA,01,BRASS,03,Ewoama/Fantuo,005,DIRIKIRI OPEN SQUARE (POWGU POLO OP. SP.)
BAYELSA,01,BRASS,03,Ewoama/Fantuo,006,DIRIKIRI SCHOOL BUILDING
BAYELSA,01,BRASS,03,Ewoama/Fantuo,007,DIRIKIRI TOWN HALL. (OPOURUBOU COMM. HALL)
BAYELSA,01,BRASS,03,Ewoama/Fantuo,008,KUROGBAGBA OPEN SPACE
BAYELSA,01,BRASS,03,Ewoama/Fantuo,009,OPU-POLOTRI OPEN SPACE
BAYELSA,01,BRASS,03,Ewoama/Fantuo,010,JOSHUA POLO-FANTUO - OPEN SPACE
BAYELSA,01,BRASS,03,Ewoama/Fantuo,011,GOLD COAST COMMUNITY HALL
BAYELSA,01,BRASS,03,Ewoama/Fantuo,012,EG-EIN KIRI OPEN SPACE
BAYELSA,01,BRASS,03,Ewoama/Fantuo,013,WALTER KIRI OPEN SPACE
BAYELSA,01,BRASS,04,Okpoama,001,S.S. OKPOAMA SCH. BUILD. (AGUMA POLO OPEN SPACE)
BAYELSA,01,BRASS,04,Okpoama,002,S.S. OKPOAMA SCHOOL BUIKDING
BAYELSA,01,BRASS,04,Okpoama,003,OKPOAMA TOWN HALL (ORUKUMO OPEN SPACE)
BAYELSA,01,BRASS,04,Okpoama,004,OKPOAMA CENTRAL SQUARE (DUKURAKU CENT. OP. SP.)
BAYELSA,01,BRASS,04,Okpoama,005,ISELE - AMA OPEN SPACE
BAYELSA,01,BRASS,04,Okpoama,006,G.S..S OKPOAMA OPEN SPACE
BAYELSA,01,BRASS,04,Okpoama,007,TOWN HALL - TOWN HALL
BAYELSA,01,BRASS,04,Okpoama,008,TOWN HALL TOWN HALL (OPU POLO NORTH OPEN SP.)
BAYELSA,01,BRASS,04,Okpoama,009,TOWN HALL (GBANA POLO OPEN SPACE)
BAYELSA,01,BRASS,04,Okpoama,010,TOWN HALL TOWN HALL (SEASIDE KIRI OPEN SPACE)
BAYELSA,01,BRASS,04,Okpoama,011,OGBO - POLO CENTRAL OPEN SPACE
BAYELSA,01,BRASS,04,Okpoama,012,DUKUMA TUBU OPEN SPACE
BAYELSA,01,BRASS,04,Okpoama,013,OPU-POLO OPEN SPACE
BAYELSA,01,BRASS,04,Okpoama,014,JONISONIYAIKIRI OPEN SPACE
BAYELSA,01,BRASS,04,Okpoama,015,TOKIN HALL OPEN SPACE
BAYELSA,01,BRASS,05,Odioma/Diema,001,OGBO-POLO COMMUNITY HALL
BAYELSA,01,BRASS,05,Odioma/Diema,002,OTOKOLO KIRI OPEN SPACE
BAYELSA,01,BRASS,05,Odioma/Diema,003,IKEI DIEMA OPEN SPACE
BAYELSA,01,BRASS,05,Odioma/Diema,004,DIEMA SEASIDE OPEN SPACE
BAYELSA,01,BRASS,05,Odioma/Diema,005,ELEMUAMA DIEMA OPEN SPACE
BAYELSA,01,BRASS,05,Odioma/Diema,006,S.S. IBIDI SCH. BUILD. (BELEU POLO DIEMA OPEN SPACE
BAYELSA,01,BRASS,05,Odioma/Diema,007,IBIDI OPEN SPACE (OGONO POLO OPEN SPACE)
BAYELSA,01,BRASS,05,Odioma/Diema,008,S.S. IBIDI SCH. BUILD. (ADUMU AMA COMM. HALL)
BAYELSA,01,BRASS,05,Odioma/Diema,009,S.S. IBIDI SCHOOL BUILDING
BAYELSA,01,BRASS,05,Odioma/Diema,010,AKABELEU COMMUNITY HALL
BAYELSA,01,BRASS,05,Odioma/Diema,011,COMMUNITY HALL (C.S.S. ODIOMA OPEN SPACE)
BAYELSA,01,BRASS,05,Odioma/Diema,012,KAKA BELEU COMM. HALL (S.S. ODIOMA OPEN SPACE)
BAYELSA,01,BRASS,05,Odioma/Diema,013,OWUBIO OPEN SPACE
BAYELSA,01,BRASS,05,Odioma/Diema,014,OYANKIA OPEN SPACE
BAYELSA,01,BRASS,06,Cape Farmosa,001,EGWEAMA PUBLIC SQUARE (STATE SCHOOL EGWEAMA)
BAYELSA,01,BRASS,06,Cape Farmosa,002,TOWN HALL EGWEAMA (OPEN SPACE EGWEAMA)
BAYELSA,01,BRASS,06,Cape Farmosa,003,"TOWN HALL, EGWEAMA"
BAYELSA,01,BRASS,06,Cape Farmosa,004,"WAGITIA, OPEN SPACE"
BAYELSA,01,BRASS,06,Cape Farmosa,005,"MKT. SQUARE, EGWEAMA"
BAYELSA,01,BRASS,06,Cape Farmosa,006,"EGEREGERE, OPEN SPACE"
BAYELSA,01,BRASS,06,Cape Farmosa,007,"EGWEAMA -OGBO, OPEN SPACE"
BAYELSA,01,BRASS,06,Cape Farmosa,008,"GBENE, OPEN SPACE"
BAYELSA,01,BRASS,06,Cape Farmosa,009,"POTAKOTIKIRI, OPEN SPACE"
BAYELSA,01,BRASS,06,Cape Farmosa,010,"JOWEIKIRI, OPEN SPACE"
BAYELSA,01,BRASS,06,Cape Farmosa,011,"STATE SCHOOL, LIAMA"
BAYELSA,01,BRASS,06,Cape Farmosa,012,TATE SCH. LIAMA (LIAMA OGBO OPEN SPACE)
BAYELSA,01,BRASS,06,Cape Farmosa,013,LIAMA TOWN HALL (SIKOKODU OPEN SPACE)
BAYELSA,01,BRASS,06,Cape Farmosa,014,STATE SCH. LIAMA (DIOPOLO OPEN SPACE)
BAYELSA,01,BRASS,06,Cape Farmosa,015,"BUDUDIE, OPEN SPACE"
BAYELSA,01,BRASS,06,Cape Farmosa,016,"OGBOPOLO, OPEN SPACE"
BAYELSA,01,BRASS,06,Cape Farmosa,017,"IGBAGELE SECONDARY SCH, IGBAGELE"
BAYELSA,01,BRASS,06,Cape Farmosa,018,IGBOBELE TOWN HALL (OPU POLO KIRI OP. SP.)
BAYELSA,01,BRASS,06,Cape Farmosa,019,IGBOBELE SEC. SCH. (BRURUS COMPOUND OPEN SPACE IGBOBELE
BAYELSA,01,BRASS,06,Cape Farmosa,020,"HOLY LAND, IGBAGELE"
BAYELSA,01,BRASS,06,Cape Farmosa,021,"IKPIRIKIRIPOLO, IGBAGELE"
BAYELSA,01,BRASS,07,Konsho,001,EREWEIBIE COMMUNITY HALL
BAYELSA,01,BRASS,07,Konsho,002,HRM PALACE KONGINO OPEN SPACE
BAYELSA,01,BRASS,07,Konsho,003,B C M OPEN SPACE
BAYELSA,01,BRASS,07,Konsho,004,OGBOKIRI OPEN SPACE
BAYELSA,01,BRASS,07,Konsho,005,KOTIKIRI OPEN SPACE
BAYELSA,01,BRASS,07,Konsho,006,IKWAKIRI SCH. BUILD. (ABAZIGBENE OPEN SPACE)
BAYELSA,01,BRASS,07,Konsho,007,IKWAKIRI SCH. BUILD. (YABIE OPEN SPACE)
BAYELSA,01,BRASS,07,Konsho,008,IKWAKIRI SCHOOL BUILDING
BAYELSA,01,BRASS,07,Konsho,009,G.S.S. AKASS COMMUNITY HALL
BAYELSA,01,BRASS,07,Konsho,010,COMMUNITY HALL (OMBUKOROAGHA POLO OPEN SPACE)
BAYELSA,01,BRASS,07,Konsho,011,GSS AKASS COMM. HALL(BUAMA OPEN SPACE)
BAYELSA,01,BRASS,07,Konsho,012,INGONABO COMPOUND OPEN SPACE
BAYELSA,01,BRASS,07,Konsho,013,IHONOGBENE OPEN SPACE
BAYELSA,01,BRASS,07,Konsho,014,IBITIMI POLO OPEN SPACE
BAYELSA,01,BRASS,07,Konsho,015,POKU POLO OPEN SPACE
BAYELSA,01,BRASS,08,Os-Inibiri,001,OPU - OGINIBIRI COMMUNITY HALL
BAYELSA,01,BRASS,08,Os-Inibiri,002,S.S. OGINIBIRI SCHOOL BUILDING
BAYELSA,01,BRASS,08,Os-Inibiri,003,OGINIBIRI TOWN HALL (TOBUGBENE COMM. HALL)
BAYELSA,01,BRASS,08,Os-Inibiri,004,S.S. OGINIBIRI SCH. BUILD. (BONGA AGBA OPEN SPACE)
BAYELSA,01,BRASS,08,Os-Inibiri,005,OBUDEGBENE OPEN SPACE
BAYELSA,01,BRASS,08,Os-Inibiri,006,NANAKIRI - KOLOBIE OPEN SPACE
BAYELSA,01,BRASS,08,Os-Inibiri,007,OPU - GBENE OPEN SPACE
BAYELSA,01,BRASS,08,Os-Inibiri,008,LIBERIA - KOLOBIE OPEN SPACE
BAYELSA,01,BRASS,08,Os-Inibiri,009,BOUNBIE OPEN SPACE
BAYELSA,01,BRASS,08,Os-Inibiri,010,AMAINGBENE OPEN SPACE
BAYELSA,01,BRASS,08,Os-Inibiri,011,KULEGHA POLO OPEN SPACE
BAYELSA,01,BRASS,08,Os-Inibiri,012,OGONI CAMP OPEN SPACE
BAYELSA,01,BRASS,09,Minibie,001,SEGIKIRI OPEN SPACE
BAYELSA,01,BRASS,09,Minibie,002,ABAD POLO OPEN SPACE
BAYELSA,01,BRASS,09,Minibie,003,MINIBILEIE OPEN SPACE
BAYELSA,01,BRASS,09,Minibie,004,MINIANGBA OPEN SPACE
BAYELSA,01,BRASS,09,Minibie,005,SILVER POLO OPEN SPACE
BAYELSA,01,BRASS,09,Minibie,006,TOBUGBENE OPEN SPACE
BAYELSA,01,BRASS,09,Minibie,007,OTONGBENE OPEN SPACE
BAYELSA,01,BRASS,09,Minibie,008,POMINAKIRI OPEN SPACE
BAYELSA,01,BRASS,09,Minibie,009,ITOHONO - AMA OPEN SPACE
BAYELSA,01,BRASS,09,Minibie,010,U.A.C. OPEN SPACE
BAYELSA,01,BRASS,09,Minibie,011,AMANYANABO POLO OPEN SPACE
BAYELSA,01,BRASS,09,Minibie,012,BEKEKIRI OPEN SPACE
BAYELSA,01,BRASS,09,Minibie,013,SCHOOL BUILDING (OKUMBIRI OPEN SPACE)
BAYELSA,01,BRASS,09,Minibie,014,S.S. OKUMBIRI SCHOOL BUILDING
BAYELSA,01,BRASS,09,Minibie,015,S.S. MINIBIE SCHOOL BUILDING
BAYELSA,01,BRASS,09,Minibie,016,S.S. MINIBIE SCH. BUILD. (TONTEREMIEOPEN SPACE)
BAYELSA,01,BRASS,09,Minibie,017,MINIBIE TOWN HALL (TEMPRUAH POLO OPEN SPACE)
BAYELSA,01,BRASS,09,Minibie,018,MINIBIE PUBLIC SQUARE (SAMPSON P0L0 OPEN SPACE)
BAYELSA,01,BRASS,10,Sangana,001,TOMSHAI TOWN HALL (TOMSHAI SANGANA OPEN SPACE)
BAYELSA,01,BRASS,10,Sangana,002,C.S.S. SABSABA SCH. BUILD. (TOMSHAI SANGANA)
BAYELSA,01,BRASS,10,Sangana,003,C.S.S. SABSABA - SCHOOL BUILDING
BAYELSA,01,BRASS,10,Sangana,004,"COMMUNITY SEC. SCH., SANGANA SCH. BUILDING"
BAYELSA,01,BRASS,10,Sangana,005,STATE SCH. SANGANA OPEN SPACE
BAYELSA,01,BRASS,10,Sangana,006,STATE SCH. SANGANA OPEN SPACE (OWI POLO OPEN SP.)
BAYELSA,01,BRASS,10,Sangana,007,STATE SCH. SANGANA OPEN SPACE (MOKO POLO OPEN SPACE)
BAYELSA,01,BRASS,10,Sangana,008,KIANI - BIRI OPEN SPACE
BAYELSA,01,BRASS,10,Sangana,009,S.S. OTUO OPEN SPACE
BAYELSA,01,BRASS,10,Sangana,010,KALAMA TOWN HALL
BAYELSA,01,BRASS,10,Sangana,011,AGO GBENE OPEN SPACE
BAYELSA,01,BRASS,10,Sangana,012,S.S. OTIONIWEITORU OPEN SPACE
BAYELSA,01,BRASS,10,Sangana,013,KATAGBENE OPEN SPACE
BAYELSA,02,EKEREMOR,01,Tarakiri,001,BENITENGHA QTRS.
BAYELSA,02,EKEREMOR,01,Tarakiri,002,OPEN SPACE AYAMABIRI (AYAMABIRI COMPOUND)
BAYELSA,02,EKEREMOR,01,Tarakiri,003,OGBEINBIRI QTRS
BAYELSA,02,EKEREMOR,01,Tarakiri,004,OBRIENWARE QTRS.
BAYELSA,02,EKEREMOR,01,Tarakiri,005,AKPASS WARE QTRS.
BAYELSA,02,EKEREMOR,01,Tarakiri,006,OPEN SPACE EDISIBOU (EDISIBOU COMPOUND)
BAYELSA,02,EKEREMOR,01,Tarakiri,007,OPEN SPACE AKEBIRI (AKEBIRI COMPOUND)
BAYELSA,02,EKEREMOR,01,Tarakiri,008,HARAMA CENTRE ZION
BAYELSA,02,EKEREMOR,01,Tarakiri,009,HEALTH CENTRE QTRS.
BAYELSA,02,EKEREMOR,01,Tarakiri,010,LARAMA ZION TOWN SQUARE
BAYELSA,02,EKEREMOR,01,Tarakiri,011,TAMOBIRI QTRS
BAYELSA,02,EKEREMOR,01,Tarakiri,012,GBAINWARI TOWN HALL
BAYELSA,02,EKEREMOR,01,Tarakiri,013,OPEN SPACE FOUBIRI (FUOBIRI COMPOUND)
BAYELSA,02,EKEREMOR,01,Tarakiri,014,OPEN SPACE EGBOINWARI/AYAMABIRI COMPOUND (EGBOINWARI/AYAMABIRI COMPOUND)
BAYELSA,02,EKEREMOR,01,Tarakiri,015,BANEARE COMPOUND
BAYELSA,02,EKEREMOR,01,Tarakiri,016,EGBEWARI QTRS.
BAYELSA,02,EKEREMOR,01,Tarakiri,017,SUKULUKIRI COMPOUND
BAYELSA,02,EKEREMOR,01,Tarakiri,018,TITIBERI COMPOUND
BAYELSA,02,EKEREMOR,01,Tarakiri,019,BOUDUBUKU QTRS
BAYELSA,02,EKEREMOR,01,Tarakiri,020,OGBOYOUR QTRS
BAYELSA,02,EKEREMOR,01,Tarakiri,021,ZIDEWARE ZIDE QTRS
BAYELSA,02,EKEREMOR,02,Oyiakiri I,001,ALEIBIRI TOWN HALL I (KALATUWARE COMPOUND)
BAYELSA,02,EKEREMOR,02,Oyiakiri I,002,ALEIBIRI TOWN HALL II (OLOLUWARE SQUARE)
BAYELSA,02,EKEREMOR,02,Oyiakiri I,003,ALEIBIRI TOWN HALL III (FEIDEIWARE SQUARE)
BAYELSA,02,EKEREMOR,02,Oyiakiri I,004,ALEIBIRI TOWN HALL IV (ATENTUAWARE SQUARE)
BAYELSA,02,EKEREMOR,02,Oyiakiri I,005,SCHOOL COMPOUND I (YEIDIRODEWARE PRI. SCH)
BAYELSA,02,EKEREMOR,02,Oyiakiri I,006,SCHOOL COMPOUND II (OGBOSUWARE PRI. SCH.)
BAYELSA,02,EKEREMOR,02,Oyiakiri I,007,SCHOOL COMPOUND III (MAINWARE SQUARE)
BAYELSA,02,EKEREMOR,02,Oyiakiri I,008,SCHOOL COMPOUND IV (RIDONKUMOWARE SQUARE)
BAYELSA,02,EKEREMOR,02,Oyiakiri I,009,DUMBO PRI. SCHOOL I (BOUMOWARE)
BAYELSA,02,EKEREMOR,02,Oyiakiri I,010,DUMBO PRI. SCHOOL II (GAGARAWARE SQUARE)
BAYELSA,02,EKEREMOR,02,Oyiakiri I,011,DUMBO PRI. SCHOOL III (PRIETE/DIUNBO PRIMARY SCHOOL)
BAYELSA,02,EKEREMOR,02,Oyiakiri I,012,DUMBO PRI. SCHOOL IV (AYANABIRI SQUARE)
BAYELSA,02,EKEREMOR,03,Oyiakiri II,001,MEDEWARE SQUARE (MEDEWARE SQUARE)
BAYELSA,02,EKEREMOR,03,Oyiakiri II,002,KEREWARE SQUARE
BAYELSA,02,EKEREMOR,03,Oyiakiri II,003,EDEDEWARE SQUARE
BAYELSA,02,EKEREMOR,03,Oyiakiri II,004,DEIS WARE SQUARE
BAYELSA,02,EKEREMOR,03,Oyiakiri II,005,ABOGBAIWARE SQUARE
BAYELSA,02,EKEREMOR,03,Oyiakiri II,006,AMBALABAWARE OPEN SPACE (AMBALABAWARE COMPOUND)
BAYELSA,02,EKEREMOR,03,Oyiakiri II,007,EKPARIBAGHA
BAYELSA,02,EKEREMOR,03,Oyiakiri II,008,OYEIBI PLAY GROUND (AMAKUBUWARE SQUARE)
BAYELSA,02,EKEREMOR,03,Oyiakiri II,009,TEKEWARE SQUARE
BAYELSA,02,EKEREMOR,03,Oyiakiri II,010,FOUBIRI I SQUARE (FOUBIRI I COMPOUND)
BAYELSA,02,EKEREMOR,03,Oyiakiri II,011,FOUBIRI II / AKKPEITU
BAYELSA,02,EKEREMOR,04,Oyiakiri III,001,ANGALAWEGBENE PRI. SCHOOL I (KANREN/OMGBONTU)
BAYELSA,02,EKEREMOR,04,Oyiakiri III,002,EBIDESEIGHABOFA PRIMARY SCHOOL
BAYELSA,02,EKEREMOR,04,Oyiakiri III,003,OGBOLOSERIGBENE PRIMARY SCHOOL
BAYELSA,02,EKEREMOR,04,Oyiakiri III,004,ANGALAWEGBENE PRI. SCHOOL II (AGBOGIDI DUDU SQUARE)
BAYELSA,02,EKEREMOR,04,Oyiakiri III,005,ANGALAWEGBENE PRI. SCHOOL III (TIETIEGBENE QTRS.)
BAYELSA,02,EKEREMOR,04,Oyiakiri III,006,ANGALAWEGBENE PRI. SCHOOL IV (AGADA SQUARE)
BAYELSA,02,EKEREMOR,04,Oyiakiri III,007,OGBOLOSERIGBENE PRIMARY SCHOOL I (KONFAGBENE/NENIEZION QTRS.)
BAYELSA,02,EKEREMOR,04,Oyiakiri III,008,OGBOLOSERIGBENE PRIMARY SCHOOL II (AYOKOROGBENE/TIKIGBENE SQUARE)
BAYELSA,02,EKEREMOR,04,Oyiakiri III,009,OGBOLOSERIGBENE PRIMARY SCHOOL III (AKEYAGBENE/KURUBOUGBENE)
BAYELSA,02,EKEREMOR,05,Oyiakiri IV,001,LALAGBENE PRIMARY SCHOOL
BAYELSA,02,EKEREMOR,05,Oyiakiri IV,002,HEALTH CENTRE (EBIAMA QTRS.)
BAYELSA,02,EKEREMOR,05,Oyiakiri IV,003,NDDC SCH. BUILDING (OFONIWAREGBENE SQUARE)
BAYELSA,02,EKEREMOR,05,Oyiakiri IV,004,AKATOMU/ADAGBABIRI PRIMARY SCHOOL
BAYELSA,02,EKEREMOR,05,Oyiakiri IV,005,KUNOLE PRIMARY SCHOOL
BAYELSA,02,EKEREMOR,05,Oyiakiri IV,006,OGBOSUWARE PRIMARY SCHOOL
BAYELSA,02,EKEREMOR,05,Oyiakiri IV,007,C.P.S OGBOSUWARE QTRS
BAYELSA,02,EKEREMOR,05,Oyiakiri IV,008,ADUKU AMS QTRS
BAYELSA,02,EKEREMOR,05,Oyiakiri IV,009,AMATEBE PRIMARY SCHOOL.
BAYELSA,02,EKEREMOR,06,Oporomor I,001,BOLOUGBENE SQUARE
BAYELSA,02,EKEREMOR,06,Oporomor I,002,TUGBENUE QTRS
BAYELSA,02,EKEREMOR,06,Oporomor I,003,DADIWARE QTRS
BAYELSA,02,EKEREMOR,06,Oporomor I,004,OGEGE WARE QTRS
BAYELSA,02,EKEREMOR,06,Oporomor I,005,BOMOBIRI QTRS
BAYELSA,02,EKEREMOR,06,Oporomor I,006,ST. JULU ZION QTRS
BAYELSA,02,EKEREMOR,06,Oporomor I,007,TARAKENEGBENE QTRS
BAYELSA,02,EKEREMOR,06,Oporomor I,008,EBIKEMEGBENE QTRS
BAYELSA,02,EKEREMOR,06,Oporomor I,009,OTONGBOBIRI
BAYELSA,02,EKEREMOR,06,Oporomor I,010,AFANTAN QTRS
BAYELSA,02,EKEREMOR,06,Oporomor I,011,OPEN SPACE CLOSE TO CHURCH I (ZION QTRS.)
BAYELSA,02,EKEREMOR,06,Oporomor I,012,OPEN SPACE CLOSE TO CHURCH II (AMAIKA ZION QTRS.)
BAYELSA,02,EKEREMOR,06,Oporomor I,013,ENIEHAWARE QTRS I
BAYELSA,02,EKEREMOR,06,Oporomor I,014,COMM PRI. SCH. OBIRIGBENE I (ENDUKEWARE QTRS. II)
BAYELSA,02,EKEREMOR,06,Oporomor I,015,COMM PRI. SCH. OBIRIGBENE II (AWIPIWARE ATRS)
BAYELSA,02,EKEREMOR,06,Oporomor I,016,COMM. PRI. SCHO. OBIRIGBENE III (BOZIMOWARE QTRS.)
BAYELSA,02,EKEREMOR,06,Oporomor I,017,AKPOBOUGBENE QTRS
BAYELSA,02,EKEREMOR,07,Oporomor II,001,BOLOU EGEDE PRIMARY SCHOOL
BAYELSA,02,EKEREMOR,07,Oporomor II,002,SAGBA EGEDE SEC. SCHOOL
BAYELSA,02,EKEREMOR,07,Oporomor II,003,PUBLIC REST HOUSE CLOSE ABUKOEGBEDE I (OFURU EGEDE SQUARE)
BAYELSA,02,EKEREMOR,07,Oporomor II,004,CLARK-GBERE SQUARE
BAYELSA,02,EKEREMOR,07,Oporomor II,005,PUBLIC REST HOUSE CLOSE ABUKOEGBEDE II (ABUKO EGEDE SQUARE)
BAYELSA,02,EKEREMOR,07,Oporomor II,006,SECONDAY SCH. NURGBENA (NURGBENA/APODOBIA)
BAYELSA,02,EKEREMOR,07,Oporomor II,007,ENIEDEDUMU/TARAIZA PRI. SCH.
BAYELSA,02,EKEREMOR,07,Oporomor II,008,PUBLIC REST HOUSE AZAGBENE (AZAGBENE SQUARE)
BAYELSA,02,EKEREMOR,07,Oporomor II,009,PUBLIC REST HOUSE DIBE (DIBE/APEDE-EGBA EGEDE SQUARE)
BAYELSA,02,EKEREMOR,07,Oporomor II,010,OPEN SPACE OMOINWARE (OMION-WARE SQ)
BAYELSA,02,EKEREMOR,07,Oporomor II,011,OROGBENE SEC SCHOOL
BAYELSA,02,EKEREMOR,07,Oporomor II,012,PUBLIC REST HOUSE CLOSE TOAZAGBOWARE (AZAGBOWARE SQUARE)
BAYELSA,02,EKEREMOR,07,Oporomor II,013,PUBLIC REST HOUSE CLOSE TOTARIZA (TARAIZA QTRS.)
BAYELSA,02,EKEREMOR,07,Oporomor II,014,PUBLIC REST HOUSE CLOSE TO BEAUTIFUL GATE (BEAUTIFUL GATE SQUARE)
BAYELSA,02,EKEREMOR,07,Oporomor II,015,PUBLIC REST HOUSE CLOSE PERETU (PERETU EGEDE SQUARE)
BAYELSA,02,EKEREMOR,07,Oporomor II,016,FEREMAMS TOWN HALL
BAYELSA,02,EKEREMOR,08,Oporomor III,001,"PRI. SCH. CPD, EGBIRIGBENE (EGBALEBOKOGBENE/ATIMIGBENE/EGBI RIGBENUE/EGBEDE- QTRS.)"
BAYELSA,02,EKEREMOR,08,Oporomor III,002,PUBLIC REST HOUSE CLOSE TO OCTOBA-AMA (KUMORGBENE/OCTOBA-AMA COMPOUND)
BAYELSA,02,EKEREMOR,08,Oporomor III,003,PUBLIC REST HOUSE CLOSE TO OKOROTIE (OKOROTIE-GBENE QTRS.)
BAYELSA,02,EKEREMOR,08,Oporomor III,004,PUBLIC REST HOUSE CLOSE TO ZINC-GBENE (ZINCGBENE/ETINBIRI QTRS.)
BAYELSA,02,EKEREMOR,08,Oporomor III,005,PRIMARY SCH. OPP. OTIEWO I (DUWOIBAL/OGBOBOBOU/DESIN PEREPOR/OTIEWEI/EGBIRIOPOMU- COMPOUND)
BAYELSA,02,EKEREMOR,08,Oporomor III,006,PRIMARY SCH. OPP. OTIEWO II (AKAGBEGBENE/ZIOTON GHAGBENE/BEMAPUDE-QTRS.)
BAYELSA,02,EKEREMOR,08,Oporomor III,007,PRIMARY SCH. OPP. OTIEWO III (GBENE/AKPAMA/CHURCH/ KIRIKANEYE COMPOUND)
BAYELSA,02,EKEREMOR,08,Oporomor III,008,"PUBLIC REST HOUSE, CLOSE TO WEKY PLACE (WEKY PACACE QTRS.)"
BAYELSA,02,EKEREMOR,08,Oporomor III,009,SEC. SCH. EKEREMOR TOWN (CALIFORNIA/MARCUS QTRS.)
BAYELSA,02,EKEREMOR,08,Oporomor III,010,PUBLIC REST HOUSE TOMUBULOU (TOMUBULOU/EGOUGBOUN. COMPOUND)
BAYELSA,02,EKEREMOR,08,Oporomor III,011,PUBLIC REST HOUSE CLOSE TO OKPEGBENE/ASENEGBENE/OPOMIGBENE (OKPEGBENE/ASENEGBENE - OPOMUGBENE COMPOUND)
BAYELSA,02,EKEREMOR,08,Oporomor III,012,OPEN SPACE CLOSE TO OLAFAGBENE SAPELEGBENE (OLAFAGBENE/SAPELEGBENE QTRS.)
BAYELSA,02,EKEREMOR,08,Oporomor III,013,PUBLIC REST HOUSE COLSE TO OLUOGBENE/OMUKOROGBENE (OLOUGBENE/OMUKOROGBENE/COMPOUND)
BAYELSA,02,EKEREMOR,08,Oporomor III,014,OPEN SPACE SEIGHA (SEIGHA)
BAYELSA,02,EKEREMOR,08,Oporomor III,015,OPEN SPACE CLOSE TO BRANGO QUARTERS (BRANGO QTRS.)
BAYELSA,02,EKEREMOR,08,Oporomor III,016,PUBLIC REST HOUSE CLOSE TO AGBANAWARE (AGBANAWARE QTRS. I)
BAYELSA,02,EKEREMOR,08,Oporomor III,017,OPEN REST HOUSE CLOSE TO AGOMOWARE (AGOMOWARE QTRS. II)
BAYELSA,02,EKEREMOR,08,Oporomor III,018,PUBLIC REST HOUSE CLOSE TO AZIKPOWARE (AZIKPOWARE QTRS.)
BAYELSA,02,EKEREMOR,08,Oporomor III,019,OPEN SPACE CLOSE TO DOWUISUIOGHAWARE (DUWOISUOGHAWARE QTRS.)
BAYELSA,02,EKEREMOR,08,Oporomor III,020,PUBLIC REST HOUSE CLOSE TO PENAWEIWARE (PENA-OWEIWARE)
BAYELSA,02,EKEREMOR,08,Oporomor III,021,PUBLIC REST HOUSE (OGBOSAINWARE QTRS.)
BAYELSA,02,EKEREMOR,08,Oporomor III,022,PUBLIC REST HOUSE CLOSE TO EMGBIDIWARE QTRS. (EMGBIDIWARE)
BAYELSA,02,EKEREMOR,08,Oporomor III,023,PUBLIC REST HOUSE CLOSE TO ADENEKEWARE (ADENEKEWARE)
BAYELSA,02,EKEREMOR,08,Oporomor III,024,CIVIL CENTRE EKEREMOR TOWN (AYEWARE QTRS.)
BAYELSA,02,EKEREMOR,08,Oporomor III,025,OPEN SPACE CLOSE TO AYAMA (AYAMA I)
BAYELSA,02,EKEREMOR,08,Oporomor III,026,PUBLIC REST HOUSE CLOSE TO AYAMA I (AYAMA II)
BAYELSA,02,EKEREMOR,08,Oporomor III,027,PUBLIC REST HOUSE CLOSE TO AYAMA II (AYAMA III)
BAYELSA,02,EKEREMOR,08,Oporomor III,028,PUBLIC REST HOUSE CLOSE TO AYAMA III (AZUZUWARE I SQUARE I)
BAYELSA,02,EKEREMOR,08,Oporomor III,029,PUBLIC REST HOUSE CLOSE TO AYAMA IV (AZUZUWARE II SQUARE II)
BAYELSA,02,EKEREMOR,08,Oporomor III,030,PUBLIC REST HOUSE CLOSE TO AYAMA V (AZIDEKEOREYEINE SQUARE)
BAYELSA,02,EKEREMOR,08,Oporomor III,031,PUBLIC REST HOUSE CLOSE TO AYAMA VI (AYAMA IV)
BAYELSA,02,EKEREMOR,08,Oporomor III,032,PUBLIC REST HOUSE CLOSE TO AYAMA VII (AYAMA V)
BAYELSA,02,EKEREMOR,08,Oporomor III,033,PUBLIC REST HOUSE CLOSE TO AYAMA VIII (AYAMA VI)
BAYELSA,02,EKEREMOR,08,Oporomor III,034,PRI. SCH. CPD CLOSE TO OKOROTIEGBENE (ESELEMOEREGBENE/ONDUDUMOGBENE/OKORTIEGBENE)
BAYELSA,02,EKEREMOR,08,Oporomor III,035,PUBLIC REST HOUSE CLOSE TO AGOMOWARE (AGOMOWARE II)
BAYELSA,02,EKEREMOR,09,Oporomor IV,001,PUBLIC REST HOUSE CLOSE TO ABIRI I (ABIRI I SQUARE)
BAYELSA,02,EKEREMOR,09,Oporomor IV,002,PUBLIC REST HOUSE AT THE WATER FRONT (ABIRI II QTRS. I)
BAYELSA,02,EKEREMOR,09,Oporomor IV,003,ABIRI III QTRS II
BAYELSA,02,EKEREMOR,09,Oporomor IV,004,OPEN SPACE CLOSE TO BIRIEWOU COMPOUND I (BIRIEREWOU I COMPOUND I)
BAYELSA,02,EKEREMOR,09,Oporomor IV,005,BIRIEREWOU OPEN SPACE (BIRIEREWOU II COMPOUND II)
BAYELSA,02,EKEREMOR,09,Oporomor IV,006,AZAZIBIRI SQUARE
BAYELSA,02,EKEREMOR,09,Oporomor IV,007,BOU SQUARE
BAYELSA,02,EKEREMOR,09,Oporomor IV,008,DAUNEMUGHAN SQUARE (DAUNEMUGHAN COMPOUND)
BAYELSA,02,EKEREMOR,09,Oporomor IV,009,EKAMBARA SQUARE
BAYELSA,02,EKEREMOR,09,Oporomor IV,010,EKIERE SQUARE
BAYELSA,02,EKEREMOR,09,Oporomor IV,011,FIEFIE
BAYELSA,02,EKEREMOR,09,Oporomor IV,012,ODOH I
BAYELSA,02,EKEREMOR,09,Oporomor IV,013,ODOH II
BAYELSA,02,EKEREMOR,09,Oporomor IV,014,EBIKAKEBIRI SQUARE
BAYELSA,02,EKEREMOR,09,Oporomor IV,015,SANAH I
BAYELSA,02,EKEREMOR,09,Oporomor IV,016,SANAH II QTRS.
BAYELSA,02,EKEREMOR,09,Oporomor IV,017,TOUNBOLAPERE QTRS
BAYELSA,02,EKEREMOR,09,Oporomor IV,018,GEDEBIRI QTRS
BAYELSA,02,EKEREMOR,09,Oporomor IV,019,AKOLOGBENE QTRS
BAYELSA,02,EKEREMOR,09,Oporomor IV,020,AKONO QTRS
BAYELSA,02,EKEREMOR,10,Oporomor V,001,BIOWEI PRI. SCHOOL
BAYELSA,02,EKEREMOR,10,Oporomor V,002,ANDEIGBENE SQUARE
BAYELSA,02,EKEREMOR,10,Oporomor V,003,AYANA EGEDE SQUARE
BAYELSA,02,EKEREMOR,10,Oporomor V,004,FOU EGEDE SQUARE
BAYELSA,02,EKEREMOR,10,Oporomor V,005,PERE EGEDE SQUARE
BAYELSA,02,EKEREMOR,10,Oporomor V,006,SI - EGEDE SQUARE
BAYELSA,02,EKEREMOR,10,Oporomor V,007,TAREPERE -EGEDE/ SQUARE
BAYELSA,02,EKEREMOR,10,Oporomor V,008,TAMO-NDORO/AFAROU QTRS
BAYELSA,02,EKEREMOR,10,Oporomor V,009,SUOGBENE QTRS
BAYELSA,02,EKEREMOR,10,Oporomor V,010,GLORY ZION QTRS
BAYELSA,02,EKEREMOR,10,Oporomor V,011,ABUKO BULOU QTRS
BAYELSA,02,EKEREMOR,10,Oporomor V,012,GWAZE SQUARE
BAYELSA,02,EKEREMOR,10,Oporomor V,013,OWEGBENE PRI. SCH.
BAYELSA,02,EKEREMOR,10,Oporomor V,014,CHURCH EDUMU SQUARE
BAYELSA,02,EKEREMOR,10,Oporomor V,015,OKOKODIA EDUMU
BAYELSA,02,EKEREMOR,10,Oporomor V,016,OYAKPADEKUMOR QTRS
BAYELSA,02,EKEREMOR,11,Eduwini I,001,ZAFAWEI/IGBONS/AKORI/AGINABIRI SQUARE
BAYELSA,02,EKEREMOR,11,Eduwini I,002,AYAMS/BAKIRI ZION SQUARE
BAYELSA,02,EKEREMOR,11,Eduwini I,003,AGBERIGBARI/GUODE. SQUARE
BAYELSA,02,EKEREMOR,11,Eduwini I,004,MARKET/YAPREGBA ZION SQUARE
BAYELSA,02,EKEREMOR,11,Eduwini I,005,AZATITOR/FAMOUS ZION QTRS
BAYELSA,02,EKEREMOR,11,Eduwini I,006,AMAZER
BAYELSA,02,EKEREMOR,11,Eduwini I,007,OSUMAIBIC/WAREBAKEFE
BAYELSA,02,EKEREMOR,11,Eduwini I,008,AGGE PALM BUSH QTRS
BAYELSA,02,EKEREMOR,11,Eduwini I,009,IDUERE/EGBE EBE QTRS
BAYELSA,02,EKEREMOR,11,Eduwini I,010,AMATUF/AZAMABIRI SQUARE
BAYELSA,02,EKEREMOR,11,Eduwini I,011,OGBERINTU SQUARE
BAYELSA,02,EKEREMOR,11,Eduwini I,012,OROBIRI SQUARE
BAYELSA,02,EKEREMOR,12,Eduwini II,001,REST HOUSE CLOSE TO TOBOBIRI/POUBIRI (TOBOBIRI/POUBIRI)
BAYELSA,02,EKEREMOR,12,Eduwini II,002,BIOBIRI SQUARE
BAYELSA,02,EKEREMOR,12,Eduwini II,003,TONOR SQUARE
BAYELSA,02,EKEREMOR,12,Eduwini II,004,EBIRIBODO SQUARE
BAYELSA,02,EKEREMOR,12,Eduwini II,005,BESSINGBENE SQUARE
BAYELSA,02,EKEREMOR,12,Eduwini II,006,FIYE EDUMU HALL
BAYELSA,02,EKEREMOR,12,Eduwini II,007,AGUDUGU T. HALL
BAYELSA,02,EKEREMOR,12,Eduwini II,008,PENTUWARE T. HALL
BAYELSA,02,EKEREMOR,12,Eduwini II,009,AZAGBEANE
BAYELSA,02,EKEREMOR,12,Eduwini II,010,AYA IDUMU SQUARE
BAYELSA,02,EKEREMOR,12,Eduwini II,011,TUNU QTRS
BAYELSA,02,EKEREMOR,12,Eduwini II,012,IDORO -IDUMU QTRS
BAYELSA,02,EKEREMOR,12,Eduwini II,013,TOBUBIRI PRI. SCHOOL
BAYELSA,02,EKEREMOR,12,Eduwini II,014,TOBUGBENE - TORU QTRS
BAYELSA,02,EKEREMOR,12,Eduwini II,015,OPUKUSHI SQUARE
BAYELSA,02,EKEREMOR,12,Eduwini II,016,FOUBOPOLO SQUARE
BAYELSA,02,EKEREMOR,12,Eduwini II,017,CLOUGH CRECK SQUARE
BAYELSA,02,EKEREMOR,12,Eduwini II,018,BEBETORUDIGAUSEE SQUARE
BAYELSA,02,EKEREMOR,12,Eduwini II,019,KOROMOTORU SQUARE
BAYELSA,02,EKEREMOR,12,Eduwini II,020,CENSETEBE SQUARE
BAYELSA,03,KOLOKUMA/OPOKUMA,01,Odi (North) I,001,YAINMOAMA TOWN HALL
BAYELSA,03,KOLOKUMA/OPOKUMA,01,Odi (North) I,002,YAINMOAMA TOWN HALL I (YAINMOAMA MARKET SQUARE I)
BAYELSA,03,KOLOKUMA/OPOKUMA,01,Odi (North) I,003,YAINMOAMA TOWN HALL II (YAINMOAMA MARKET SQUARE II)
BAYELSA,03,KOLOKUMA/OPOKUMA,01,Odi (North) I,004,YAINMOAMA TOWN HALL III (YAINMOAMA OGBO TOWN HALL)
BAYELSA,03,KOLOKUMA/OPOKUMA,01,Odi (North) I,005,KEMENANBO OPEN SPACE (EBEREZE [EKPERI] OPEN SPACE)
BAYELSA,03,KOLOKUMA/OPOKUMA,01,Odi (North) I,006,KEMENANABO TOWN HALL
BAYELSA,03,KOLOKUMA/OPOKUMA,01,Odi (North) I,007,OLODANI TOWN HALL
BAYELSA,03,KOLOKUMA/OPOKUMA,01,Odi (North) I,008,CHRIST THE KING ACADEMY SCHOOL I (AMAKIRIEBIAMA VILLAGE SQUARE)
BAYELSA,03,KOLOKUMA/OPOKUMA,01,Odi (North) I,009,AMAKIEBIAMA TOWN HALL
BAYELSA,03,KOLOKUMA/OPOKUMA,01,Odi (North) I,010,CHRIST THE KING ACADEMY SCHOOL II (AMAKIRIBIAMA OPEN SQUARE)
BAYELSA,03,KOLOKUMA/OPOKUMA,02,Odi (Central) II,001,OGIEMA TOWN HALL
BAYELSA,03,KOLOKUMA/OPOKUMA,02,Odi (Central) II,002,OGIENMA TOWN HALL
BAYELSA,03,KOLOKUMA/OPOKUMA,02,Odi (Central) II,003,IGBILA PRIMARY SCHO0L I (FISHING CAMP TOWN HALL)
